"","X1","author","author_created_date","author_flair","author_flair_binary","comment_karma","created_utc","domain","gilded","id","image","journal_h_index","link_karma","num_comments","subfield","title","title_len","upvotes","url","max_title_length","mean_title_length","title_sent"
"780",779,"RifkinsDilemma",1408017251,NA,"no",2300,1484709074,"washingtonpost.com",0,"5omvl4","yes","low",111177,4,"Animal Science","This new species of moth has ‘yellowish-white scales’ on its head. It is named for Donald Trump.",84,0,"https://www.washingtonpost.com/news/speaking-of-science/wp/2017/01/17/this-new-species-of-moth-has-yellowish-white-scales-on-its-head-it-is-named-for-donald-trump/?utm_term=.fe1a0f3da078&tid=sm_tw&tid=sm_tw&tid=sm_tw",9,4.16666666666667,0.0113636363636364
"781",780,"dori_lukey",1461676944,NA,"no",56064,1484707659,"bbc.com",0,"5omr1z","yes","low",82299,2,"Social Science","Friends 'key to fewer school dropouts' - Positive parental and friendship group influences are key to cutting drop-out rates, according to Arizona State University research",148,25,"http://www.bbc.com/news/education-38651628",10,5.72,0.0294117647058824
"782",781,"SirT6",1397166648,"cancer     reward13","yes",91843,1484701328,"sciencedaily.com",0,"5om6b7","no","low",285726,535,"Psychology","Study finds links between swearing and honesty: Psychologists have learned that people who frequently curse are being more honest.",112,8677,"https://www.sciencedaily.com/releases/2017/01/170117105107.htm",13,5.78947368421053,0.0416666666666667
"783",782,"drewiepoodle",1320210830,"reward10","yes",141280,1484701183,"upi.com",0,"5om5si","yes","low",3416850,3,"Animal Science","Scientists have named a newly discovered species of moth after Donald Trump. Researchers named the moth after him because in adult form, it boasts a series of yellowish-white scales on its head, resembling the hair of Trump.",188,1,"http://www.upi.com/Science_News/2017/01/17/New-moth-species-named-for-Donald-Trumps-hair/7281484686000/",11,4.81578947368421,-0.0147058823529412
"784",783,"vilnius2013",1391507165,"bio","yes",22207,1484700850,"acsh.org",0,"5om4ra","yes","low",301481,329,"Chemistry","Brown marmorated stink bugs are invading the U.S. They are often found on grapes and are crushed in the winemaking process. This stressful event causes them to produce a smelly chemical that is also found in cilantro, which food chemists and wine tasters can detect in red wine.",231,2443,"http://acsh.org/news/2017/01/17/stink-bugs-add-flavor-cilantro-red-wine-10741",10,4.72916666666667,-0.107142857142857
"785",784,"burtzev",1269213033,NA,"no",9427,1484698054,"pnas.org",0,"5olutf","yes","high",466885,0,"Medicine","Biophysical properties of the clinical-stage antibody landscape",57,1,"http://www.pnas.org/content/early/2017/01/11/1616408114.abstract.html?etoc",11,7,0
"786",785,"Wagamaga",1401896229,NA,"no",36563,1484694796,"huffingtonpost.com",0,"5oljij","yes","low",1505508,14,"Psychology","A study has found depressed mood and exhaustion to be on par with high cholesterol levels and obesity as a risk factor for cardiovascular disease.",122,75,"http://www.huffingtonpost.com/entry/depression-heart-health_us_587cf2d3e4b0b3c7a7b21eed?section=us_science",14,4.84,-0.0865384615384615
"787",786,"NinjaDiscoJesus",1314456936,NA,"no",286255,1484694775,"livescience.com",0,"5oljfz","yes","low",2689566,6,"Animal Science","Scientists have found the first evidence of vampire bats supping on human blood.",68,16,"http://www.livescience.com/57521-vampire-bats-drink-human-blood.html?",10,5.15384615384615,-0.0625
"788",787,"physicsdavid",1161818091,NA,"no",14,1484693219,"blog.pnas.org",0,"5oldo5","yes","high",5585,9,"Psychology","The influence of peers on gender identity development",46,0,"http://blog.pnas.org/2017/01/journal-club-influence-of-peers-on-gender-identity-development/",11,5.75,0.1
"789",788,"nscharping",1462989010,NA,"no",0,1484687751,"blogs.discovermagazine.com",0,"5okstm","yes","low",21160,2,"Neuroscience","Study participants forced to react while their heart was beating, as opposed to resting, exhibited more violent, racially biased behavior.",119,0,"http://blogs.discovermagazine.com/d-brief/2017/01/17/perception-heartbeat-racial-bias/#.WH6H7mQrKX0",12,5.75,0.0227272727272727
"790",789,"mvea",1148438857,"med   reward3","yes",56749,1484683791,"dzif.de",0,"5okdz8","no","low",5257017,35,"Medicine","A new HIV neutralising antibody, called 10-1074, has been successfully shown to suppress viremia in HIV-1-infected individuals in a new human trial published in Nature Medicine by US and German researchers.",176,3265,"http://www.dzif.de/en/news_media_centre/news_press_releases/view/detail/artikel/erfolgreiche_antikoerperstudie_bei_hiv_infektion/",12,5,0.0125
"791",790,"drewiepoodle",1320210830,"reward10","yes",141280,1484682968,"upi.com",0,"5okard","yes","low",3416850,6,"Environment","Central Asia ready to be repopulated with tigers, new study says",54,37,"http://www.upi.com/Science_News/2017/01/17/Central-Asia-ready-to-be-repopulated-with-tigers-new-study-says/2391484663043",11,4.81818181818182,0.0625
"792",791,"drewiepoodle",1320210830,"reward10","yes",141280,1484678060,"iiasa.ac.at",0,"5ojsng","yes","low",3416850,2,"Environment","Study confirms link between deforestation and economic growth in developing nations",73,8,"http://www.iiasa.ac.at/web/home/about/news/170116-forest-dev.html",13,6.63636363636364,0.0178571428571429
"793",792,"drsosci",1435015515,NA,"no",49,1484677700,"researchgate.net",0,"5ojran","no","low",420,6,"Physics","Chaos, Fractals, Self-Similarity, and the Limits of Prediction",55,32,"https://www.researchgate.net/publication/306226253_Visual_Analysis_of_Nonlinear_Dynamical_Systems_Chaos_Fractals_Self-Similarity_and_the_Limits_of_Prediction",10,5.66666666666667,-0.05
"794",793,"burtzev",1269213033,NA,"no",9427,1484677242,"elifesciences.org",0,"5ojpjk","yes","low",466886,0,"Environment","Present-day central African forest is a legacy of the 19th century human history",68,1,"https://elifesciences.org/content/6/e20343?utm_source=content_alert&utm_medium=email&utm_content=fulltext&utm_campaign=elife-alerts",7,4.78571428571429,0
"795",794,"researchisgood",1443541602,NA,"no",2555,1484673078,"researchgate.net",0,"5oj9rx","yes","low",79444,610,"Health","No asthma found in one third of adults who were diagnosed within the past 5 years, according to JAMA study",87,11957,"https://www.researchgate.net/blog/post/no-asthma-found-in-one-third-of-adults-previously-diagnosed-with-it",9,4.3,-0.0833333333333333
"796",795,"TheScientistMagazine",1479409508,"journ two","yes",622,1484671395,"the-scientist.com",0,"5oj3f3","yes","low",33794,2,"Biology","A new cell phone-based microscope identifies cancerous mutations and DNA sequencing reactions using the camera on a smartphone, according to study in Nature Communications.",149,30,"http://www.the-scientist.com/?articles.view/articleNo/48017/title/Next-Generation--Mobile-Microscope-Detects-DNA-Sequences/",14,5.84,0.0625
"797",796,"recentfish",1455618839,NA,"no",15415,1484669244,"researchgate.net",0,"5oivsc","yes","low",165437,18,"Neuroscience","People are more likely to perceive black men as a threat in snap-judgements that coincide with heartbeats",89,30,"https://www.researchgate.net/blog/post/racial-bias-happens-in-a-heartbeat-literally",10,4.88888888888889,0.0625
"798",797,"JeansCudsIJoins",1389740053,NA,"no",205,1484667892,"nature.com",0,"5oir4m","yes","high",749,2,"Animal Science","How the panda’s ‘thumb’ evolved twice. Two species of distantly related panda may have adapted to a bamboo-centric diet in similar genetic ways.",128,24,"http://www.nature.com/news/how-the-panda-s-thumb-evolved-twice-1.21300",9,4.875,-0.0078125
"799",798,"Quiglius",1451834580,"reward1","yes",2759,1484666836,"nature.com",0,"5oinhy","no","high",661765,5,"Astronomy","Large stationary gravity wave in the atmosphere of Venus - 10,000-kilometer-long gravity wave",81,33,"http://www.nature.com/ngeo/journal/vaop/ncurrent/full/ngeo2873.html",10,5.57142857142857,0.0125
"800",799,"americ",1257843533,NA,"no",7653,1484664654,"nature.com",0,"5oig78","no","high",24105,3,"Medicine","Large patient databases for healthcare decision-making in cancer could improve quality of life and decrease healthcare costs, according to a paper published in Nature Genetics",151,6,"http://www.nature.com/articles/ng.3756.epdf?shared_access_token=QTegMSDCYB-5P-HY7BpdhdRgN0jAjWel9jnR3ZoTv0Oz0vTHW8gssVxQgAaaUWmzztOPMxWk-vQMlow4lEsa6NgWWyMUgxVBhEvMnTl-GnjSucVm6udUUhERxPbG7rEEJyPrSyS2_EFoMsFwS6zeIpgBztehN3hjE1QNOIj9ivtldk7U4PbLNh7jYPuWBC9xhCyw1hjAndLOyuxshO-aVA%3D%3D",10,5.73076923076923,0.132352941176471
"801",800,"AmerChemSocietyAMA",1436281181,"chem AMA  reward21","yes",13244,1484658927,"self.science",0,"5ohzqa","yes","low",92832,515,"Biosimilars AMA","Hi Reddit! I am Joseph Glajch, the Director of Analytical Development for Momenta Pharmaceuticals. Ask me anything about biosimilars or what it’s like for chemists to work in the private sector.",166,4282,"https://www.reddit.com/r/science/comments/5ohzqa/hi_reddit_i_am_joseph_glajch_the_director_of/",15,5.16129032258065,-0.0568181818181818
"802",801,"collagenlife",1483741540,"physics","yes",3,1484653219,"onlinelibrary.wiley.com",0,"5ohlrq","yes","low",66,3,"Biology","Fundamental science gets a special notice in Jan 9th issue of Advanced Materials Interfaces. Happy 25th Anniversary MPIKG",104,5,"http://onlinelibrary.wiley.com/journal/10.1002/(ISSN)2196-7350",11,5.72222222222222,0.0625
"803",802,"sataky",1340813587,NA,"no",2800,1484649615,"smithsonianmag.com",0,"5ohe2l","yes","low",54049,4,"Neuroscience","Monkeys, like humans, know the limits of their own memory",48,83,"http://www.smithsonianmag.com/science-nature/wise-monkey-knows-how-little-he-knows-180961807/",7,4.6,0.075
"804",803,"TJools",1483096964,NA,"no",0,1484647978,"rsos.royalsocietypublishing.org",0,"5ohao3","yes","low",75,0,"Biology","x Temporally and spatially partitioned behaviours of spinner dolphins: implications for resilience to human disturbance",105,69,"http://rsos.royalsocietypublishing.org/content/4/1/160626",12,6.93333333333333,-0.046875
"805",804,"H8-M8",1469819442,NA,"no",317,1484641312,"sciencedirect.com",0,"5ogxf3","yes","low",8187,1,"Geology","Climate cycling on early Mars caused by the carbonate-<U+0080><U+0093>silicate cycle",63,1,"http://www.sciencedirect.com/science/article/pii/S0012821X16304794",9,5.27272727272727,-0.015625
"806",805,"Wagamaga",1401896229,NA,"no",36563,1484640727,"umass.edu",0,"5ogwa9","no","low",1505508,0,"Environment","Results of a new study by researchers at the Northeast Climate Science Center at the University of Massachusetts Amherst suggest that temperatures across the northeastern United States will increase much faster than the global average",200,24,"http://www.umass.edu/newsoffice/article/northeast-us-temperatures-are-decades",13,5.71428571428571,0
"807",806,"wtfastro",1332871456,"physics","yes",4493,1484630515,"journals.sagepub.com",0,"5og8d4","yes","low",3117,13,"Psychology","Study found a correlation between telling the truth and use of profanity",61,112,"http://journals.sagepub.com/doi/full/10.1177/1948550616681055",11,5.08333333333333,0.0833333333333333
"808",807,"Rug_Bar",1469442890,NA,"no",98,1484627383,"google.com",0,"5ofzm8","yes","low",13910,15,"Biology","Complex life may have had a false start 2.3 billion years ago",50,94,"https://www.google.com/amp/s/www.newscientist.com/article/2118088-complex-life-may-have-had-a-false-start-2-3-billion-years-ago/amp/?client=safari",7,4.16666666666667,-0.107142857142857
"809",808,"drsosci",1435015515,NA,"no",49,1484614193,"researchgate.net",0,"5oetbs","yes","low",420,1,"Social Science","Depicting urban boundaries from a mobility network of spatial interactions: A case study of Great Britain with geo-located Twitter data",116,6,"https://www.researchgate.net/publication/312283173_Depicting_urban_boundaries_from_a_mobility_network_of_spatial_interactions_A_case_study_of_Great_Britain_with_geo-located_Twitter_data",12,5.42857142857143,0.0267857142857143
"810",809,"drsosci",1435015515,NA,"no",49,1484614138,"researchgate.net",0,"5oet56","yes","low",420,1,"Engineering","Causal structure learning for travel mode choice using structural restrictions and model averaging algorithm",95,4,"https://www.researchgate.net/publication/310824912_Causal_structure_learning_for_travel_mode_choice_using_structural_restrictions_and_model_averaging_algorithm",12,6.78571428571429,0.075
"811",810,"drchris498",1323347508,NA,"no",1227,1484613502,"journals.plos.org",0,"5oer0z","yes","low",3865,1,"Animal Science","Where Have All the Giants Gone; How Animals Deal with the Problem of Size.",61,24,"http://journals.plos.org/plosbiology/article?id=10.1371/journal.pbio.2000473",7,4.21428571428571,-0.171875
"812",811,"snikrepab_",1347138563,NA,"no",9796,1484611697,"statnews.com",0,"5oekqn","yes","low",93852,88,"Health","Dangerous superbug appears to be spreading stealthily in US hospitals",60,334,"https://www.statnews.com/2017/01/16/cre-superbug/",10,6,-0.1
"813",812,"drewiepoodle",1320210830,"reward10","yes",141280,1484610862,"mountsinai.org",0,"5oehx9","yes","low",3416850,5,"Neuroscience","Hormonal fluctuations women undergo make them particularly sensitive, compared to men, to the addictive properties of cocaine. Findings show how high estrogen release during the estrus cycle increases the pleasure felt via the brain’s reward pathway.",217,38,"http://www.mountsinai.org/about-us/newsroom/press-releases/researchers-reveal-connection-between-female-estrogen-cycle-and-addictive-potential-of-cocaine-",12,5.86111111111111,0.0263157894736842
"814",813,"drewiepoodle",1320210830,"reward10","yes",141280,1484607465,"bu.edu",0,"5oe61c","yes","low",3416850,1,"Biology","Levels of specific biomarkers, or chemicals found in the blood, can be combined to produce patterns that signify how well a person is aging and his or risk for future aging-related diseases, according to a new study",179,17,"http://www.bu.edu/research/articles/biomarker-patterns-predict-healthy-aging/",10,4.60526315789474,-0.0178571428571429
"815",814,"Silverseren",1384805506,NA,"no",51638,1484603664,"jic.ac.uk",0,"5ods76","yes","low",65788,1,"Biology","Researchers discover the genetic transport mechanism behind anti-cancer compound synthesis in the Madagascar Periwinkle using gene silencing",124,43,"https://www.jic.ac.uk/news/2017/01/mia-transport-protein-no-longer-missing-in-action/",11,6.83333333333333,-0.03125
"816",815,"The_Cardinal_Rule",1405110503,NA,"no",8778,1484602060,"nature.com",0,"5odm2u","no","high",3693,2,"Medicine","Stanford researchers identify drug that when co-administered with opioids prevents both increasing sensitivity to pain and increasing tolerance to opioids",135,36,"http://www.nature.com/nm/journal/vaop/ncurrent/full/nm.4262.html",12,6.38095238095238,-0.09375
"817",816,"mvea",1148438857,"med   reward3","yes",56750,1484598222,"rsos.royalsocietypublishing.org",0,"5od7k0","yes","low",5257021,5,"Anthropology","Chimpanzees are more likely to reproduce with mates whose genetic makeup most differs from their own, and are unusual in that even among nonrelatives and virtual strangers they can tell genetically similar mates from more distant ones, finds Duke evolutionary anthropologists in a new study.",247,222,"http://rsos.royalsocietypublishing.org/content/4/1/160422",15,5.42222222222222,0.0808823529411765
"818",817,"KermitTheSnail",1470179956,NA,"no",25969,1484596059,"med.stanford.edu",0,"5oczbn","yes","low",964417,1041,"Health","Caffeine may counter age-related inflammation, possibly explaining why coffee drinkers tend to live longer than abstainers.",108,25541,"http://med.stanford.edu/news/all-news/2017/01/caffeine-may-counter-age-related-inflammation-study-finds.html",12,6.17647058823529,-0.05
"819",818,"sivribiber",1469036406,NA,"no",46258,1484595885,"bbc.com",0,"5ocynh","yes","low",1415021,1,"Astronomy","A giant wave in the atmosphere of Venus may be the biggest of its kind in the Solar System",72,62,"http://www.bbc.com/news/science-environment-38638067",10,3.78947368421053,0.125
"820",819,"KermitTheSnail",1470179956,NA,"no",25969,1484594746,"pubs.acs.org",0,"5ocuap","no","high",964418,10,"Engineering","Researchers have found that a snowflake-like fractal design, in which a pattern repeats at ever smaller scales, can increase graphene's inherently low optical absorption, leading to graphene photodetectors with an order-of-magnitude increase in photovoltage, along with ultrafast light detection.",258,63,"http://pubs.acs.org/doi/abs/10.1021/acs.nanolett.6b03202",14,5.95238095238095,-0.0416666666666667
"821",820,"anopla",1455579538,NA,"no",197,1484593669,"sciencemag.org",0,"5ocqcd","yes","high",12706,41,"Social Science","GRE scores and undergraduate GPA don’t predict graduate school success",63,281,"http://www.sciencemag.org/careers/2017/01/student-performance-measures-don-t-perform?rss=1",13,6.1,-0.09375
"822",821,"drewiepoodle",1320210830,"reward10","yes",141280,1484586274,"neurosciencenews.com",0,"5oby4j","yes","low",3416850,1,"Neuroscience","Concussions accelerate Alzheimer's disease-related brain atrophy and cognitive decline in people who are at genetic risk for the condition, research has found. The findings show promise for detecting the influence of concussion on neurodegeneration.",216,13,"http://neurosciencenews.com/alzheimers-concussion-neurology-5925/",17,6.05714285714286,-0.0263157894736842
"823",822,"HairySavage",1416846036,NA,"no",944,1484581758,"cam.ac.uk",0,"5obiac","yes","low",26372,20,"Psychology","Study finds links between swearing and honesty",40,109,"http://www.cam.ac.uk/research/news/frankly-do-we-give-a-damn-study-finds-links-between-swearing-and-honesty",8,5.71428571428571,-0.0625
"824",823,"Noticemenot",NA,NA,"no",NA,1484581025,"bbc.com",0,"5obfup","yes","low",NA,5,"Engineering","Battery with inbuilt 'fire extinguisher' developed - Researchers have designed a lithium-ion battery that contains a fire-extinguishing material, which is released if the battery gets too hot.",166,50,"http://www.bbc.com/news/technology-38637357",13,5.67857142857143,-0.0192307692307692
"825",824,"SirRagnarok",1484037665,NA,"no",22,1484579016,"nature.com",0,"5ob9hz","yes","high",90,1,"Medicine","Outer layer of human heart regrown using stem cells | Long-term self-renewing human epicardial cells generated from pluripotent stem cells under defined xeno-free conditions.",151,36,"http://www.nature.com/articles/s41551-016-0003",11,5.61538461538461,0.0197368421052632
"826",825,"Ragnarokcometh",1433341500,NA,"no",18743,1484577535,"newscientist.com",0,"5ob572","yes","low",292689,157,"Animal Science","Female shark learns to reproduce without males after years alone in tank",61,2102,"https://www.newscientist.com/article/2118052-female-shark-learns-to-reproduce-without-males-after-years-alone/?utm_medium=Social&utm_campaign=Echobox&utm_source=Facebook&utm_term=Autofeed&cmpid=SOC%257CNSNS%257C2017-Echobox",9,5.08333333333333,0
"827",826,"TheScientistMagazine",1479409508,"journ two","yes",622,1484576045,"the-scientist.com",0,"5ob106","yes","low",33794,0,"Biology","Stem cells can produce all embryonic cells types, but only rarely generate placental cells. But a new study reveals that removing a specific microRNA from mouse stem cells can change their nature, allowing them to consistently produce extra-embryonic cells such as placental cells in a Petri dish.",251,35,"http://www.the-scientist.com/?articles.view/articleNo/47997/title/Study--MicroRNA--Retroviruses-Coordinate-to-Influence-Pluripotency/",12,5.125,0.0192307692307692
"828",827,"edwinksl",1175053192,"eng","yes",8940,1484574691,"news.berkeley.edu",0,"5oaxfw","yes","low",80198,1,"Social Science","Crowdfunding expands innovation financing to underserved regions",58,4,"http://news.berkeley.edu/2017/01/13/crowdfunding-expands-innovation-financing-to-underserved-regions/",12,8.28571428571429,0
"829",828,"mvea",1148438857,"med   reward3","yes",56750,1484573919,"npr.org",0,"5oavh7","yes","low",5257022,10,"Neuroscience","People mix up the names of family, friends or even pets, because these names are usually stored in the same category in the brain. This is a cognitive glitch that is not related to bad memory or aging, but rather to how the brain categorizes names, with family pets filed with other family members.",245,551,"http://www.npr.org/sections/health-shots/2017/01/16/509353565/when-the-brain-scrambles-names-its-because-you-love-them",11,4.42592592592593,-0.016304347826087
"830",829,"sivribiber",1469036406,NA,"no",46258,1484570909,"wm.edu",0,"5oanph","yes","low",1415021,9,"Environment","Scientists discover that production of nitrogen gas can be bypassed as complex nitrogen compounds in soil, water and fertilizers break down. Their discovery could lead to new ways for farmers and others to reduce their emissions of harmful gases.",208,104,"http://www.wm.edu/news/stories/2017/researchers-discover-greenhouse-bypass-for-nitrogen.php",11,5.25641025641026,-0.0078125
"831",830,"Gitai_Lab",1484525004,"bio AMA","yes",180,1484570560,"self.science",0,"5oamu3","yes","low",4003,347,"Cholera AMA","Science AMA series: We’re Thomas Bartlett and Benjamin Bratton from Princeton University. The bacterium that causes cholera is curved. People have known this for 160 years, but never known how or why it’s curved. We figured it out… Ask us anything!",214,6664,"https://www.reddit.com/r/science/comments/5oamu3/science_ama_series_were_thomas_bartlett_and/",10,4.90243902439024,0.0714285714285714
"832",831,"Taylor_Kohut",1484523856,NA,"no",174,1484569848,"self.science",0,"5oal7n","yes","low",495,104,"Porn AMA","Science AMA Series: I'm Taylor Kohut at Western University and I want to talk about porn, what it is, and how it may impact the way that people think, feel, and behave. AMA!",141,555,"https://www.reddit.com/r/science/comments/5oal7n/science_ama_series_im_taylor_kohut_at_western/",10,4.06060606060606,-0.0220588235294118
"833",832,"Wagamaga",1401896229,NA,"no",36563,1484563170,"m.medicalxpress.com",0,"5oa7d0","yes","low",1505508,1,"Neuroscience","Scientists at EMBL have traced exactly which neuronal projections prevent social animals like us from acting out on impulses",106,8,"https://m.medicalxpress.com/news/2017-01-neural-instincts.html",11,5.57894736842105,0.0416666666666667
"834",833,"Rug_Bar",1469442890,NA,"no",98,1484554008,"newatlas.com",0,"5o9odv","yes","low",13910,3,"Biology","Outer layer of human heart regrown using stem cells. [Biology]",53,43,"http://newatlas.com/heart-disease-stem-cells-pennstate/47391/",7,5,-0.015625
"835",834,"Kooby2",1369018171,NA,"no",1349,1484540271,"eurekalert.org",0,"5o8pgq","yes","low",207824,7,"Physics","Scientists have demonstrated the ability to ""see"" the future of quantum systems, and used that knowledge to preempt their demise.",110,32,"https://www.eurekalert.org/pub_releases/2017-01/uos-stq011117.php",12,5.3,-0.015625
"836",835,"mvea",1148438857,"med   reward3","yes",56750,1484523583,"newscientist.com",0,"5o7agh","yes","low",5257023,3,"Animal Science","Florida harvester ants, Pogonomyrmex badius, have developed the first example of a farming strategy where they plant seeds, wait for them to germinate and then eat the soft spoils (compared to the Fijian ants which grow plants and harvest the fruits).",211,43,"https://www.newscientist.com/article/2117953-harvester-ants-farm-by-planting-seeds-to-eat-once-they-germinate/",12,5,-0.0078125
"837",836,"Silverseren",1384805506,NA,"no",51638,1484521773,"nature.com",0,"5o74ah","yes","high",65788,9,"Animal Science","Using CRISPR, researchers are now able to make gene knockout pigs for sperm stem cell transplantation without the need of irradiation or chemotherapy",127,32,"http://www.nature.com/articles/srep40176",15,5.47826086956522,0.0416666666666667
"838",837,"GeoGeoGeoGeo",1326679762,"reward1","yes",8109,1484519154,"newsroom.ucla.edu",0,"5o6v8k","yes","low",96150,4,"Astronomy","The moon is older than scientists thought, UCLA-led research team reports: Formation of the Moon occurred within the first ~60 million years after the birth of the solar system.",149,19,"http://newsroom.ucla.edu/releases/the-moon-is-older-than-scientists-thought-ucla-led-research-team-reports",10,4.8,0.0625
"839",838,"drewiepoodle",1320210830,"reward10","yes",141280,1484507285,"news.ufl.edu",0,"5o5oxu","yes","low",3416850,3275,"Health","Doctors don’t just “get over” rude treatment from patients, research suggests. In simulations with an angry parent, the performance of pediatricians suffered dramatically. The findings reinforce past research that rudeness has negative effects on medical performance.",238,48989,"http://news.ufl.edu/articles/2017/01/being-rude-to-your-childs-doctor-could-lead-to-worse-care.php",13,6.25,-0.0394736842105263
"840",839,"Wagamaga",1401896229,NA,"no",36563,1484493482,"m.medicalxpress.com",0,"5o4dyz","yes","low",1505508,24,"Social Science","Alcohol use disorder and divorce are strongly correlated, meaning that experiencing one makes it more likely to experience the other in one's lifetime, according to a new study led by researchers at Virginia Commonwealth University.",198,248,"https://m.medicalxpress.com/news/2016-12-genetic-environmental-factors-alcohol-disorder.html",12,5.57142857142857,0.0416666666666667
"841",840,"avonstratford",1364567916,NA,"no",89,1484492635,"news.mongabay.com",0,"5o4bjl","yes","low",435,2,"Environment","More than 7% of intact forest landscapes disappeared between 2000 & 2013, finds Science Advances study",87,30,"https://news.mongabay.com/2017/01/last-frontiers-of-wilderness-intact-forest-plummets-globally/",11,5.6,0.0833333333333333
