"","X1","author","author_created_date","author_flair","author_flair_binary","comment_karma","created_utc","domain","gilded","id","image","journal_h_index","link_karma","num_comments","subfield","title","title_len","upvotes","url","max_title_length","mean_title_length","title_sent"
"1",0,"porkchop_d_clown",1169824089,NA,"no",78380,1487099881,"pnas.org",0,"5u2bqq","yes","high",215451,2,"Earth Science","Six centuries of geomagnetic intensity variations recorded by royal Judean stamped jar handles",82,43,"http://www.pnas.org/content/early/2017/02/07/1615797114",11,6.30769230769231,0
"2",1,"Mictlantecuhtli",1352732955,"anthro","yes",68448,1487096354,"academic.oup.com",0,"5u1wah","no","low",292442,1,"Anthropology","Mitogenome Diversity in Sardinians: a Genetic Window onto an Island's Past",64,4,"https://academic.oup.com/mbe/article/2977388/Mitogenome-Diversity-in-Sardinians-a-Genetic",10,5.72727272727273,-0.125
"3",2,"vmjaggard99",1458917405,"natgeo two","yes",3709,1487095185,"news.nationalgeographic.com",0,"5u1rjv","yes","low",17686,1,"Paleontology","A fossil embryo of a Triassic marine reptile has been found inside its mother, adding to evidence that the ancient group that includes dinosaurs and birds was capable of live birth.",151,52,"http://news.nationalgeographic.com/2017/02/sea-monster-china-pregnant-live-birth-paleontology-science/",9,4.80645161290323,0.00833333333333333
"4",3,"drewiepoodle",1320210830,"reward10","yes",141280,1487092749,"news.mit.edu",0,"5u1ho9","yes","low",3416849,1,"Astronomy","For the first time, astronomers have observed a star pulsing in response to its orbiting planet. The planet in question is a gas giant measuring eight times the mass of Jupiter — one of the most massive exoplanets known today.",189,25,"http://news.mit.edu/2017/star-stellar-pulsations-planet-0214",11,4.69230769230769,0.0986842105263158
"5",4,"Bman409",1374004623,NA,"no",28408,1487092206,"nature.com",0,"5u1fjz","yes","high",74100,25,"Social Science","Women prefer men who use metaphorical language when paying compliments in a romantic context",79,35,"http://www.nature.com/articles/srep40871",12,5.64285714285714,0.15
"6",5,"Dr_Buguliskis",1486746403,"bio","yes",303,1487091354,"pnas.org",0,"5u1c6e","yes","high",7509,0,"Biology","Salk team develops tool that maps functional areas of the genome to better understand disease",79,10,"http://www.pnas.org/content/early/2017/02/07/1618353114.abstract?sid=05470029-5b69-4466-b178-9d31619e46c7",10,5.26666666666667,0.1875
"7",6,"recentfish",1455618839,NA,"no",15415,1487088005,"researchgate.net",0,"5u0zkh","yes","low",165437,21,"Paleontology","250 million-year-old fossil of pregnant sea creature provides earliest evidence of reptile giving live birth.",95,1673,"https://www.researchgate.net/blog/post/paleontologists-unearth-an-unexpected-baby-bump",8,5.41176470588235,0.0384615384615385
"8",7,"NinjaDiscoJesus",1314456936,NA,"no",286255,1487086941,"newscientist.com",0,"5u0vxd","yes","low",2689566,4,"Biology","Metabolic switch may bring on chronic fatigue syndrome",47,13,"https://www.newscientist.com/article/2121162-metabolic-switch-may-bring-on-chronic-fatigue-syndrome/?utm_campaign=Echobox&utm_medium=Social&utm_source=Twitter#link_time=1487085824",9,5.875,-0.104166666666667
"9",8,"HumeLAB",1487067538,NA,"no",1,1487086557,"link.springer.com",0,"5u0ukn","yes","low",17,0,"Psychology","Meta-analysis of cognitive training reveals that effects are mainly task specific and do not generalise. The results of importance for neural plasticity theory.",138,14,"http://link.springer.com/article/10.3758/s13423-016-1217-0",10,5.625,0.0625
"10",9,"KristinNG",1458063674,"natgeo two","yes",3405,1487083252,"news.nationalgeographic.com",0,"5u0jh9","yes","low",16521,1,"Anthropology","Researchers declare secondary heart deposition in spouse's tomb a previously unseen phenomena in European burial practices",107,11,"http://news.nationalgeographic.com/2017/02/france-embalmed-heart-rennes-quengo-perrien-archaeology/",11,6.6875,-0.1375
"11",10,"RifkinsDilemma",1408017251,NA,"no",2300,1487082134,"independent.co.uk",0,"5u0g3i","yes","low",111177,2,"Environment","More than 700 mammals and birds currently threatened with extinction already appear to have been adversely affected by climate change, according to a major review of scientific studies.",158,6,"http://www.independent.co.uk/environment/animal-species-700-extinction-climate-change-global-warming-oceans-pollution-a7579716.html",10,5.57142857142857,0.05
"12",11,"RifkinsDilemma",1408017251,NA,"no",2300,1487081749,"theguardian.com",0,"5u0ezh","yes","low",111177,10,"Psychology","Fictional characters make 'existential crossings' into real life, study finds - A fifth of readers report characters from novels cropping up in their daily lives, hearing their voices even after putting books aside.",183,32,"https://www.theguardian.com/books/2017/feb/14/fictional-characters-make-existential-crossings-into-real-life-study-finds?CMP=twt_a-science_b-gdnscience",11,5.53125,0.0263157894736842
"13",12,"mvea",1148438857,"med   reward3","yes",56749,1487079434,"news.byu.edu",0,"5u08a3","yes","low",5256941,15,"Medicine","When a group of mice was restricted to consume 35% fewer calories, there was an almost linear increase in lifespan. This is the first study to show that when ribosomes slow down, the aging process slows too. The decreased speed lowers production but gives ribosomes extra time to repair themselves.",249,203,"http://news.byu.edu/news/how-eating-less-can-slow-aging-process",10,4.86,-0.0271739130434783
"14",13,"NinjaDiscoJesus",1314456936,NA,"no",286255,1487078903,"newscientist.com",0,"5u06px","yes","low",2689566,875,"Animal Science","Honeybees let out a ‘whoop’ when they bump into each other - A vibrational pulse produced by honeybees, long thought to be a signal to other bees to stop what they are doing, might actually be an expression of surprise.",184,31121,"https://www.newscientist.com/article/2121275-honeybees-let-out-a-whoop-when-they-bump-into-each-other/",11,4.46153846153846,0.0546875
"15",14,"CESRA_highlights",1469285408,NA,"no",0,1487077699,"cesra.net",0,"5u03ex","yes","low",1116,1,"Astronomy","Large-scale simulations of energetic electrons from the Sun to the Earth: Langmuir Wave Distributions Induced by Electron Beams",110,8,"http://cesra.net/?p=1209",13,5.68421052631579,-0.0416666666666667
"16",15,"AmerChemSocietyAMA",1436281181,"chem AMA  reward21","yes",13244,1487077590,"self.science",0,"5u034g","yes","low",92832,106,"ACS AMA","American Chemical Society AMA: I’m Andy Jorgensen, Associate Professor of Chemistry and Environmental Sciences at the University of Toledo. Ask me anything about communicating climate change to non-scientists.",184,407,"https://www.reddit.com/r/science/comments/5u034g/american_chemical_society_ama_im_andy_jorgensen/",13,6.10344827586207,-0.0588235294117647
"17",16,"Beeologists",1487028391,"bio AMA","yes",176,1487075281,"self.science",0,"5tzx1x","yes","low",2355,236,"Honey Bee AMA","Science AMA Series: We are Dr. May Berenbaum and Dr. Gene Robinson, University of Illinois entomologists. Our genomic research efforts go together like bees and honey, and we’re here for some sweet science discussion for Valentine’s Day! AUA!",209,2992,"https://www.reddit.com/r/science/comments/5tzx1x/science_ama_series_we_are_dr_may_berenbaum_and_dr/",13,5.18421052631579,-0.01875
"18",17,"Wagamaga",1401896229,NA,"no",36563,1487070530,"newscientist.com",0,"5tzmm0","yes","low",1505508,754,"Environment","The proportion of people who accept climate change is happening and is largely human-made has risen to almost two-thirds",102,8245,"https://www.newscientist.com/article/2121132-more-people-now-believe-human-made-climate-change-is-happening/?utm_campaign=RSS%7CNSNS&utm_source=NSNS&utm_medium=RSS&utm_content=earth&campaign_id=RSS%7CNSNS-earth",10,4.76190476190476,0.0340909090909091
"19",18,"tomholder",1353078447,NA,"no",26349,1487069254,"nature.com",0,"5tzjrt","no","high",61027,8,"Neuroscience","Genetically altered mice which produce more Cadherin protein are less susceptible to cocaine addiction",89,220,"http://www.nature.com/neuro/journal/vaop/ncurrent/full/nn.4503.html",11,6.35714285714286,0.0625
"20",19,"pankur",1366872558,NA,"no",97,1487058879,"arstechnica.com",0,"5tyxxj","yes","low",11277,1,"Biology","Zika crosses the placenta by latching on to fetal blood vessels",53,378,"https://arstechnica.com/science/2017/02/zika-crosses-the-placenta-by-latching-on-to-fetal-blood-vessels/",8,4.81818181818182,0
"21",20,"pankur",1366872558,NA,"no",97,1487058814,"arstechnica.com",0,"5tyxs7","yes","low",11277,9,"Health","Potential risks of going gluten-free high arsenic and mercury levels",59,48,"https://arstechnica.com/science/2017/02/potential-risks-of-going-gluten-free-high-arsenic-and-mercury-levels/",9,5.27272727272727,-0.0714285714285714
"22",21,"_CapR_",1382082464,NA,"no",10368,1487053065,"eurekalert.org",0,"5tykll","yes","low",49438,1,"Physics","Superconductivity with two-fold symmetry -- new evidence for topological superconductor SrxBi2Se3",87,40,"https://www.eurekalert.org/pub_releases/2017-02/scp-swt021317.php",17,7.63636363636364,0.0208333333333333
"23",22,"Austion66",1359342457,"psych   reward4","yes",7892,1487043338,"sciencedirect.com",0,"5txseu","yes","low",30478,324,"Neuroscience","Study finds use of medical marijuana improves cognitive performance, contradicting previous studies that found cognitive decline with marijuana use",129,2995,"http://www.sciencedirect.com/science/article/pii/S0376871616304628",13,6.73684210526316,0.0104166666666667
"24",23,"ImNotJesus",1300954374,"psych reward10","yes",838449,1487042825,"people.virginia.edu",0,"5txqth","no","low",320217,84,"Psychology","New studies find that white participants held explicit and implicit attitudes that favored whites over blacks, yet simultaneously valued not appearing prejudiced.",141,271,"http://people.virginia.edu/~jra3ee/AT2017.pdf",14,6.31818181818182,0.104166666666667
"25",24,"ImNotJesus",1300954374,"psych reward10","yes",838449,1487042605,"sciencedirect.com",0,"5txq2w","yes","low",320217,9,"Psychology","New study finds that when individuals feel low in self-efficacy (belief that they can complete a task) reminding them of a controlling god can increase commitment to their goals.",150,9,"http://www.sciencedirect.com/science/article/pii/S0022103117300276",11,4.86666666666667,0.0769230769230769
"26",25,"ImNotJesus",1300954374,"psych reward10","yes",838449,1487042425,"sciencedirect.com",0,"5txpj5","yes","low",320217,39,"Psychology","“Welcome to the U.S.” but “change your name”? Adopting Anglo names and discrimination",81,11,"http://www.sciencedirect.com/science/article/pii/S0022103116304620",14,5.15384615384615,0.025
"27",26,"HeinieKaboobler",1369581012,NA,"no",2154,1487040469,"medicalxpress.com",0,"5txjia","yes","low",556066,2,"Psychology","Psychologists design an experiment to investigate whether human vision is more sensitive during physical activity",99,27,"https://medicalxpress.com/news/2017-02-psychologists-human-vision-sensitive-physical.html",13,6.6,0.015625
"28",27,"Mr_Turkle",1474065135,NA,"no",0,1487038803,"pediatrics.aappublications.org",0,"5txe9x","no","low",87,0,"Health","Fathers are greatly underrepresented in childhood obesity trials (6% of parents on average), but only 2% of studies acknowledge this as a limitation.",127,24,"https://pediatrics.aappublications.org/content/early/2017/01/25/peds.2016-2635",16,5.26086956521739,0
"29",28,"ImNotJesus",1300954374,"psych reward10","yes",838449,1487035852,"journals.sagepub.com",0,"5tx51d","no","low",320217,234,"Psychology","New studies find dehumanization of Mexicans and Muslims predicts support for the GOP (and in particular Trump). They also show that Latinos and Muslims in the United States feel heavily dehumanized, and that feeling was associated with support for violence and unwillingness to fight terrorism.",250,1600,"http://journals.sagepub.com/doi/pdf/10.1177/0146167216675334",14,5.44444444444444,0
"30",29,"bikeybikeybikey",1441377251,NA,"no",27,1487035300,"nytimes.com",0,"5tx37u","no","low",640,1,"Biology","How a Little Bit of Hydra Regrows a Whole Animal",39,35,"https://www.nytimes.com/2017/02/13/science/hydra-regeneration-video-scitake.html",7,3.9,-0.0416666666666667
"31",30,"anopla",1455579538,NA,"no",197,1487034239,"npr.org",0,"5twzr9","yes","low",12706,24,"Environment","90 Percent Of Fish We Use for Fishmeal Could Be Used To Feed Humans Instead",61,221,"http://www.npr.org/sections/thesalt/2017/02/13/515057834/90-percent-of-fish-we-use-for-fishmeal-could-be-used-to-feed-humans-instead",8,4.06666666666667,0.0208333333333333
"32",31,"DoremusJessup",1318441120,NA,"no",16240,1487030184,"france24.com",0,"5twl88","yes","low",1945663,13,"Health","Most of the people infected with Ebola in the West Africa epidemic that began in 2014 got sick through contact with a small number of ""superspreaders"" with the disease",139,566,"http://www.france24.com/en/20170213-small-percentage-people-spread-most-ebola-cases-study",14,4.72413793103448,-0.105769230769231
"33",32,"domo415",1345636923,NA,"no",5289,1487024497,"npr.org",0,"5tw17t","yes","low",44498,7,"Neuroscience","A Brain Tweak Lets Mice Abstain From Cocaine",37,33,"http://www.npr.org/sections/health-shots/2017/02/13/514590646/a-brain-tweak-lets-mice-abstain-from-cocaine",7,4.625,0
"34",33,"puckishfiend",1330096321,"bio","yes",1857,1487023775,"pubs.acs.org",0,"5tvyf3","no","high",196,2,"Biology","Programmable DNA-Guided Artificial Restriction Enzymes",50,10,"http://pubs.acs.org/doi/pdf/10.1021/acssynbio.6b00324",12,8.16666666666667,0.0625
"35",34,"drewiepoodle",1320210830,"reward10","yes",141280,1487022135,"royalholloway.ac.uk",0,"5tvrth","yes","low",3416850,23,"Geology","Roughly 350 km, or 217 miles, beneath the surface of the Western United States, lies a newly discovered mass of melting carbon. Researchers found the region of melting carbon using the world's largest array of seismometers. It stretches across 1.8 million square kilometers, or 695,000 square miles.",253,82,"https://www.royalholloway.ac.uk/aboutus/newsandevents/news/2017-articles/scientists-uncover-huge-1.8-million-km2-reservoir-of-melting-carbon.aspx",12,5.23404255319149,0.00543478260869565
"36",35,"MiamiPower",1334289397,NA,"no",21169,1487017206,"wired.com",0,"5tv96j","yes","low",93000,1,"Physics","Physicists Teach AI to Identify Exotic States of Matter",47,16,"https://www.wired.com/2017/02/physicists-teach-ai-identify-exotic-states-matter/",10,5.22222222222222,-0.0208333333333333
"37",36,"Wagamaga",1401896229,NA,"no",36563,1487012375,"theguardian.com",0,"5tur1f","yes","low",1505508,111,"Environment","Scientists have discovered “extraordinary” levels of toxic pollution in the most remote and inaccessible place on the planet, the 10km deep Mariana trench in the Pacific Ocean.",154,1612,"https://www.theguardian.com/environment/2017/feb/13/extraordinary-levels-of-toxic-pollution-found-in-10km-deep-mariana-trench",13,5.40740740740741,0.0673076923076923
"38",37,"Pyronic_Chaos",1336057010,"reward1","yes",259490,1487011773,"nature.com",0,"5tuoux","yes","high",169107,0,"Environment","Bioaccumulation of persistent organic pollutants in the deepest ocean fauna",66,10,"http://www.nature.com/articles/s41559-016-0051",15,6.6,-0.03125
"39",38,"jmdugan",1221770863,"bio two","yes",30203,1487011310,"newscientist.com",0,"5tun4u","yes","low",47347,2,"Physics","AI learns to solve quantum state of many particles at once",48,27,"https://www.newscientist.com/article/2120856-ai-learns-to-solve-quantum-state-of-many-particles-at-once/",9,4.36363636363636,0
"40",39,"Austion66",1359342457,"psych   reward4","yes",7892,1487010938,"mcponline.org",0,"5tults","yes","low",30478,15,"Biology","Study finds that long term calorie restriction promotes cellular fitness, which in turn may lead to increased longevity",102,181,"http://www.mcponline.org/content/11/12/1801.abstract?sid=dc837bc4-42d7-4d64-9cf7-f26c3d2247a3",11,5.61111111111111,0.0909090909090909
"41",40,"mvea",1148438857,"med   reward3","yes",56749,1487010024,"ualberta.ca",0,"5tuie9","yes","low",5256945,281,"Psychology","The more depressed your romantic partner may be, the more love you should give them, according to new University of Alberta research. The study, published in Developmental Psychology, surveyed 1,407 couples on their levels of depression, self-esteem and mutual support.",230,4806,"https://www.ualberta.ca/news-and-events/newsarticles/2017/february/want-to-help-your-partner-deal-with-depression-try-a-little-tenderness",13,5.41463414634146,0.05
"42",41,"Sariel007",1273581787,NA,"no",274828,1487008910,"arstechnica.com",0,"5tue2z","yes","low",2581950,1,"Biology","We now know why mosquitoes find malaria victims so tasty",47,2,"https://arstechnica.com/science/2017/02/we-now-know-why-mosquitoes-find-malaria-victims-so-tasty/",10,4.7,0.21875
"43",42,"drewiepoodle",1320210830,"reward10","yes",141280,1487007677,"news.ucsb.edu",0,"5tu9cx","yes","low",3416850,3,"Psychology","Pride served an important function in social life that led to its evolution among our foraging ancestors, argue researchers. They believe that the function of pride is to motivate the individual to cultivate traits and pick courses of action that increase others’ tendency to value them.",244,38,"http://www.news.ucsb.edu/2017/017673/pride-sin-or-incentive",11,5.17391304347826,0.130434782608696
"44",43,"BocceBaller42",1395420514,NA,"no",1559,1487006002,"news.upenn.edu",0,"5tu359","yes","low",72047,9,"Medicine","Protein from lettuce stops rejection of hemophilia medication. Study used dogs as model.",76,88,"https://news.upenn.edu/news/plant-made-hemophilia-therapy-shows-promise-penn-study-finds",10,5.69230769230769,0.025
"45",44,"ibmzrl",1319632872,NA,"no",1223,1487003245,"nature.com",0,"5ttsqv","yes","high",6110,0,"Chemistry","Elusive triangulene created by moving atoms one at a time",48,25,"http://www.nature.com/news/elusive-triangulene-created-by-moving-atoms-one-at-a-time-1.21462",11,4.8,-0.15625
"46",45,"researchisgood",1443541602,NA,"no",2555,1487001607,"researchgate.net",0,"5ttmnc","yes","low",79444,4,"Astronomy","Early stages of massive supernova observed for the first time.",53,153,"https://www.researchgate.net/blog/post/supernova-observed-just-after-explosion",9,5.2,-0.0416666666666667
"47",46,"ryohazuki8761",1429489471,NA,"no",327,1487000970,"blogs.agu.org",0,"5ttkhm","yes","low",7,0,"Earth Science","Greenland Ice Sheet melting can cool subtropics and alter climate",56,12,"http://blogs.agu.org/geospace/2017/02/08/greenland-ice-sheet-melting-can-cool-subtropics-alter-climate/",10,5.6,0
"48",47,"drewiepoodle",1320210830,"reward10","yes",141280,1487000516,"nouvelles.umontreal.ca",0,"5ttiw7","yes","low",3416850,1,"Paleontology","Some 12,000 years ago, Paleolithic peoples living along the coast of what's now northwestern Italy carried pebbles from the beach to their seaside caves for use in burial rituals. The small, flat, oblong stones were used to scoop up and apply ochre to the deceased prior to burial.",234,26,"http://nouvelles.umontreal.ca/en/article/2017/02/06/broken-pebbles-offer-clues-to-paleolithic-funeral-rituals/",12,4.77083333333333,-0.02
"49",48,"theddman",1234635362,"chem","yes",5919,1487000024,"onlinelibrary.wiley.com",0,"5tth31","yes","low",3442,1,"Biology","Acute exercise activates p38 MAPK and increases the expression of telomere protective genes in cardiac muscle",94,14,"http://onlinelibrary.wiley.com/doi/10.1113/EP086189/full",10,5.875,-0.015625
"50",49,"shilorea",1406124202,NA,"no",4,1486999375,"cmu.edu",0,"5ttese","yes","low",8318,14,"Psychology","Married People Have Lower Levels of Stress Hormone",43,65,"http://www.cmu.edu/dietrich/news/news-stories/2017/february/why-married-people-are-healthy.html",7,5.375,0
"51",50,"AnakinGabriel",1385931978,"psych","yes",3112,1486998363,"nature.com",0,"5ttbiq","no","high",8143,1,"Nanoscience","Chemists create an artificial microswimmer that can be controlled by light.",65,9,"http://www.nature.com/nnano/journal/v11/n12/full/nnano.2016.187.html",12,5.81818181818182,0.03125
"52",51,"houndrunner",1415640821,NA,"no",1236,1486998347,"onlinelibrary.wiley.com",0,"5ttbgr","yes","low",11520,2,"Environment","Water quality data for national-scale aquatic research",48,5,"http://onlinelibrary.wiley.com/doi/10.1002/2016WR019993/abstract",8,5.875,0.0535714285714286
"53",52,"automaticmidnight",1361164645,NA,"no",4479,1486997279,"kansascity.com",0,"5tt84w","yes","low",82343,257,"Animal Science","A new paper published in Nature brings us closer to growing real meat without the livestock.",77,2749,"http://www.kansascity.com/living/food-drink/article131539389.html",9,4.75,0.0875
"54",53,"Wagamaga",1401896229,NA,"no",36563,1486995529,"medicalnewstoday.com",0,"5tt2tn","yes","low",1505508,730,"Health","Fruits and vegetables are a pivotal part of a healthful diet, but their benefits are not limited to physical health. New research finds that increasing fruit and vegetable consumption may improve psychological well-being in as little as 2 weeks.",207,23516,"http://www.medicalnewstoday.com/articles/315781.php",13,5.075,0.102941176470588
"55",54,"pnewell",1340897842,"env","yes",100006,1486993069,"insideclimatenews.org",0,"5tsvye","yes","low",3313268,0,"Environment","Study Finds Rise in Methane in Pennsylvania Gas Country | ""The rapid increase in methane is likely due to the increased production of natural gas from the region which has increased significantly over the 2012 to 2015 period,""",189,20,"https://insideclimatenews.org/news/10022017/methane-emissions-pennsylvania-natural-gas?utm_source=Daily+Carbon+Briefing&utm_campaign=5d3add4fda-cb_daily&utm_medium=email&utm_term=0_876aab4fd7-5d3add4fda-303423917",13,5,0.0657894736842105
"56",55,"AmGeophysicalU-AMA",1446562300,"geo AMA","yes",5621,1486992094,"self.science",0,"5tsthl","no","low",34435,49,"Landslide AMA","AGU AMA: Hi Reddit, I'm Dave Petley, author of The Landslide Blog and Vice-President (Research and Innovation) at the University of Sheffield in the United Kingdom. I'm here to talk about the science and management of natural hazards and disasters. AMA!",213,464,"https://www.reddit.com/r/science/comments/5tsthl/agu_ama_hi_reddit_im_dave_petley_author_of_the/",10,4.85714285714286,0.03125
"57",56,"Phil-Baran",1486954352,"chem AMA","yes",357,1486991213,"self.science",0,"5tsr50","yes","low",2204,304,"Organic Chemistry AMA","Science AMA series: I’m Phil Baran, and I’m here to talk about our work at the Baran Laboratory where we try to simplify the way molecules are created. I’m also a MacArthur Fellow “genius grant recipient”. AMA!",184,2621,"https://www.reddit.com/r/science/comments/5tsr50/science_ama_series_im_phil_baran_and_im_here_to/",10,4.51351351351351,0.0197368421052632
"58",57,"aye-min",1481494935,NA,"no",0,1486989279,"bbk.ac.uk",0,"5tsm3q","yes","low",58,0,"Earth Science","Study provides new evidence about gas emissions from ancient North Korean volcanic eruption",79,32,"http://www.bbk.ac.uk/news/study-provides-new-evidence-about-gas-emissions-from-ancient-north-korean-volcanic-eruption",9,6.07692307692308,0.0416666666666667
"59",58,"Carl0s92",1456060280,NA,"no",0,1486989214,"cell.com",0,"5tsly5","no","high",53,1,"Neuroscience","Synaptic Competition Shapes Neuronal Dendrites",42,27,"http://www.cell.com/neuron/fulltext/S0896-6273%2816%2931042-X",11,8.4,0
"60",59,"DeveloperChris",1231055035,NA,"no",5324,1486986778,"seas.harvard.edu",0,"5tsghy","yes","low",814,13,"Chemistry","Long-lasting flow battery could run for more than a decade with minimum upkeep",66,590,"https://www.seas.harvard.edu/news/2017/02/long-lasting-flow-battery-could-run-for-more-than-decade-with-minimum-upkeep",7,4.64285714285714,-0.015625
"61",60,"pankur",1366872558,NA,"no",97,1486979288,"arstechnica.com",0,"5ts1z2","yes","low",11277,51,"Medicine","Most new, high-priced cancer drugs don't even extend life for 10 weeks",59,669,"https://arstechnica.com/science/2017/02/most-new-high-priced-cancer-drugs-dont-even-extend-life-for-10-weeks/",6,4.38461538461539,0.025
"62",61,"pankur",1366872558,NA,"no",97,1486978981,"arstechnica.com",0,"5ts1fc","yes","low",11277,2,"Neuroscience","Neural network trained to solve quantum mechanical problems",52,30,"https://arstechnica.com/science/2017/02/neural-network-trained-to-solve-quantum-mechanical-problems/",10,6.5,0
"63",62,"tmgoodwi",1337897028,NA,"no",226,1486962220,"lunduniversity.lu.se",0,"5tr2mx","yes","low",7284,10,"Health","Gut bacteria may play a role in Alzheimer's disease",43,56,"http://www.lunduniversity.lu.se/article/gut-bacteria-may-play-a-role-in-alzheimers-disease",11,4.77777777777778,0.0208333333333333
"64",63,"Tyr_Tyr",1462828350,NA,"no",86773,1486960156,"psychologytoday.com",0,"5tqwgi","yes","low",8842,32,"Psychology","New research suggests that early signs of psychopathy can be seen in children as young as two years old",85,89,"https://www.psychologytoday.com/blog/fulfillment-any-age/201611/what-age-can-we-identify-psychopathy-in-child",11,4.47368421052632,0.111111111111111
"65",64,"drewiepoodle",1320210830,"reward10","yes",141280,1486947288,"upi.com",0,"5tpua6","yes","low",3416850,9,"Paleontology","Excavation reveals sponge dominance in the wake of the end of the Ordovician Period 445 million years ago when 85% of all species on the planet went extinct.",130,249,"http://www.upi.com/Science_News/2017/02/10/Excavation-reveals-sponge-dominance-in-wake-of-end-Ordovician-crisis/1591486737501/?utm_source=sec&utm_campaign=sl&utm_medium=7",10,4.57142857142857,-0.0357142857142857
