"","X1","author","author_created_date","author_flair","author_flair_binary","comment_karma","created_utc","domain","gilded","id","image","journal_h_index","link_karma","num_comments","subfield","title","title_len","upvotes","url","max_title_length","mean_title_length","title_sent"
"513",512,"drewiepoodle",1320210830,"reward10","yes",141280,1481804347,"mountsinai.org",0,"5ih7kd","yes","low",3416850,8,"Cancer","Two studies conducted in animal models and tested in human samples show that even before tumors develop, breast cancer cells with a few defined molecular alterations can spread to organs, remain quiet for long periods of time, and then awaken to form aggressive, deadly breast cancer metastasis.",249,646,"http://www.mountsinai.org/about-us/newsroom/press-releases/researchers-reveal-how-cancer-can-spread-even-before-a-tumor-develops",11,5.19148936170213,0.055
"514",513,"PHealthy",1424353401,"epi      reward6","yes",40703,1481804005,"eurekalert.org",0,"5ih6tm","yes","low",77370,165,"Medicine","Review suggests that teens benefit from later high school start times",59,2163,"https://www.eurekalert.org/pub_releases/2016-12/aaos-rst121416.php",8,5.36363636363636,0.0625
"515",514,"9999monkeys",1423405818,NA,"no",84520,1481801909,"news.nationalgeographic.com",0,"5ih296","yes","low",576105,1,"Animal Science","Sea creatures found to have 'invisibility cloak' thanks to antireflective coatings",72,41,"http://news.nationalgeographic.com/2016/12/oceans-animals-invisible-physics/",14,6.36363636363636,-0.09375
"516",515,"drewiepoodle",1320210830,"reward10","yes",141280,1481801681,"oregonstate.edu",0,"5ih1s0","yes","low",3416850,7,"Animal Science","A recorded sound in the Mariana Trench notable for its complexity and wide frequency range likely represents the discovery of a new baleen whale call, according to researchers.",149,168,"http://oregonstate.edu/ua/ncs/archives/2016/dec/new-complex-call-recorded-mariana-trench-believed-be-baleen-whale",11,5.25,0.1484375
"517",516,"the_phet",1297521165,"reward1","yes",67944,1481795999,"telegraph.co.uk",0,"5igqkg","yes","low",427387,83,"Chemistry","Crop spray which can boost farmer's wheat yields by one fifth, without the need for genetic modification, has been developed at Oxford University. They found a molecule which helps plants make the best use of the sugary fuel that they generate during photosynthesis, producing bigger grains",245,1389,"http://www.telegraph.co.uk/science/2016/12/14/monster-wheat-grown-oxford-could-revolutionise-farming/",14,5.23913043478261,0.0760869565217391
"518",517,"the_phet",1297521165,"reward1","yes",67944,1481795710,"eurekalert.org",0,"5igq0l","yes","low",427387,3,"Social Science","Research team found households in rural Africa that vaccinate their cattle for East Coast fever increased their income and spent the additional money on food and education. They also found that when fewer cattle died from the fever, girls were more likely to attend secondary school.",238,66,"https://www.eurekalert.org/pub_releases/2016-12/wsu-vif121416.php",10,5.10869565217391,0.00480769230769231
"519",518,"lapapinton",1411457718,NA,"no",47223,1481778978,"eurekalert.org",0,"5ifppg","yes","low",249341,2,"Social Science","American death rate from drugs, alcohol, and mental disorders nearly triples since 1980",75,22,"https://www.eurekalert.org/pub_releases/2016-12/ifhm-adr121216.php",9,5.61538461538461,0.0178571428571429
"520",519,"NinjaDiscoJesus",1314456936,NA,"no",286255,1481776971,"bbc.com",0,"5ifkgm","yes","low",2689566,1,"Animal Science","Six new animal species have been identified at deep-sea vents beneath the Indian Ocean.",74,38,"http://www.bbc.com/news/science-environment-38305989",10,4.8,0.0568181818181818
"521",520,"ElectiveAffinities",1413475496,NA,"no",139,1481774783,"livescience.com",0,"5ifeuq","yes","low",11249,27,"Animal Science","Reindeer are shrinking - Climate change is making it difficult for them — and their gestating fetuses — to survive extreme winters, new research shows.",131,459,"http://www.livescience.com/57184-reindeer-shrinking-due-to-climate-change.html",9,5.54545454545455,-0.0625
"522",521,"redhatGizmo",1289986377,NA,"no",23723,1481767672,"sci-news.com",0,"5ieu9s","yes","low",335718,2,"Astronomy","Evidence of Forming Giant Planets Discovered 400 Light-Years from Earth",62,53,"http://www.sci-news.com/astronomy/giant-planets-hd-163296-04448.html",10,5.54545454545455,-0.015625
"523",522,"drewiepoodle",1320210830,"reward10","yes",141280,1481764274,"twin-cities.umn.edu",0,"5iek94","yes","low",3416850,3,"Environment","Researchers demonstrate the operation of a robotic arm to reach and grasp objects in a complex 3D environment using only their thoughts without a brain implant.",135,26,"http://twin-cities.umn.edu/news-events/umn-research-shows-people-can-control-robotic-arm-their-minds",11,5.15384615384615,0.0673076923076923
"524",523,"thinkingcarbon",1426198336,NA,"no",1775,1481762071,"neuroscientistnews.com",0,"5iecek","yes","low",6366,1,"Neuroscience","Study in mouse models offers possible approach to treating chronic pain",61,2,"http://www.neuroscientistnews.com/research-news/study-offers-approach-treating-pain",8,5.54545454545455,-0.104166666666667
"525",524,"Splenda",1264275558,NA,"no",63358,1481759820,"insideclimatenews.org",0,"5ie64m","yes","low",138043,63,"Environment","'The Arctic is unraveling,' scientists conclude after latest climate report card",70,883,"https://insideclimatenews.org/news/13122016/arctic-melting-climate-change-noaa-science",10,6.09090909090909,0.0535714285714286
"526",525,"NinjaDiscoJesus",1314456936,NA,"no",286255,1481753315,"engadget.com",0,"5idk66","yes","low",2689566,6,"Health","Study: 'Pokemon Go' boosts physical activity, but not for long",53,23,"https://www.engadget.com/2016/12/14/study-pokemon-go-physical-activity-doesnt-last/",8,4.9,0.075
"527",526,"spsheridan",1259374554,NA,"no",8239,1481753314,"wired.co.uk",0,"5idk5z","yes","low",870935,0,"Biology","Following analysis of the seahorse genome, researchers have begun unlocking some of the secrets of the Syngnathidae family including why males give birth.",132,0,"http://www.wired.co.uk/article/seahorse-pregnancy-genome",12,5.65217391304348,0
"528",527,"BatmanDracula",1424723838,NA,"no",4629,1481750891,"livescience.com",0,"5idbkw","yes","low",113406,4,"Anthropology","'Lucy' Species May Have Been Polygynous. The ancient relative of humanity dubbed ""Lucy"" may have been one of a harem of gals who mated with a single male, according to research that suggests her species was polygynous.",182,39,"http://www.livescience.com/57203-lucy-early-human-species-was-polygynous.html",10,4.72972972972973,0.0328947368421053
"529",528,"superhelical",1420836623,"bio reward5","yes",62516,1481749895,"nature.com",0,"5id81m","yes","high",18847,4,"Animal Science","Ants ""talk"" by swapping spit - hormones in saliva help ants communicate",60,15,"http://www.nature.com/nature/journal/v540/n7633/full/540319b.html",11,5.18181818181818,0.109375
"530",529,"DrGaimanRowlingKing",1399938844,NA,"no",2090,1481746955,"eurekalert.org",0,"5icxid","yes","low",105711,1,"Environment","A ""crater"" in Antarctica once thought to be the work of a meteorite impact is actually the result of ice melt, new research finds.",107,17,"https://www.eurekalert.org/pub_releases/2016-12/kl-mo120916.php",10,4.29166666666667,0.0576923076923077
"531",530,"fosterlynch",1400341821,NA,"no",-1,1481742186,"seeker.com",0,"5icgb0","yes","low",6852,0,"Animal Science","Bats Fish With Their Fingers, Glowworms Fish With Their Urine",52,0,"http://www.seeker.com/bats-fish-with-their-fingers-glowworms-fish-with-their-urine-2146858473.html",9,5.1,-0.0535714285714286
"532",531,"NinjaDiscoJesus",1314456936,NA,"no",286255,1481742178,"theguardian.com",0,"5icg9r","yes","low",2689566,118,"Health","Premature babies who were breastfed exclusively and kept warm through continuous skin-to-skin contact have become young adults with larger brains, higher salaries and less stressful lives than babies who received conventional incubator care, according to a study published this week.",244,2569,"https://www.theguardian.com/global-development/2016/dec/14/kangaroo-mother-care-premature-babies-healthier-wealthier-study-claims?CMP=twt_gu",12,5.69047619047619,0.0119047619047619
"533",532,"fosterlynch",1400341821,NA,"no",-1,1481741996,"dev.biologists.org",0,"5icfkt","yes","low",6852,0,"Biology","Researchers turn back the clock on human embryonic stem cells",52,33,"http://dev.biologists.org/content/143/23/4368",11,5.2,0
"534",533,"bulldog75",1426541896,NA,"no",1699,1481741973,"nytimes.com",0,"5icfi4","yes","low",173201,1434,"Psychology","Abortion Is Found to Have Little Effect on Women's Mental Health",54,20852,"http://www.nytimes.com/2016/12/14/health/abortion-mental-health.html",8,4.90909090909091,0.046875
"535",534,"drewiepoodle",1320210830,"reward10","yes",141280,1481735502,"ekvv.uni-bielefeld.de",0,"5ibrlg","yes","low",3416850,1,"Engineering","Scientists trap bacteria with optical tractor beam to enable easier observation at high resolutions. The principle underlying the laser beam is similar to the concept to be found in the television series 'Star Trek.'",183,43,"http://ekvv.uni-bielefeld.de/blog/uninews/entry/optical_tractor_beam_traps_bacteria",11,5.26470588235294,0.0197368421052632
"536",535,"thermos26",1318216446,"anthro","yes",14119,1481734906,"forbes.com",0,"5ibpbu","yes","low",1511,4,"Anthropology","New A. afarensis footprints found in Laetoli shed light on ancient hominin body size and gait.",79,10,"http://www.forbes.com/sites/shaenamontanari/2016/12/14/3-6-million-year-old-early-human-footprints-have-been-discovered-in-tanzania/#1ea596f532c9",10,4.8125,0
"537",536,"ManOfGizmosAndGears",1463416624,NA,"no",57973,1481733202,"jamanetwork.com",0,"5ibj4n","yes","high",31222,4,"Health","How Americans Die May Depend On Where They Live - US County-Level Trends in Mortality Rates for Major Causes of Death, 1980-2014",107,20,"http://jamanetwork.com/journals/jama/fullarticle/2592499",9,4.47826086956522,0.03125
"538",537,"Nihy",1319984064,NA,"no",11327,1481728857,"tandfonline.com",0,"5ib471","yes","low",5161,26,"Medicine","Psychotherapy and exercise are ineffective in chronic fatigue syndrome: a critical commentary and preliminary re-analysis of the PACE trial",121,67,"http://www.tandfonline.com/doi/abs/10.1080/21641846.2017.1259724",13,5.95,-0.135416666666667
"539",538,"NinjaDiscoJesus",1314456936,NA,"no",286255,1481726901,"bbc.com",0,"5iaxx0","yes","low",2689566,3,"Anthropology","Footprints made by early humans millions of years ago have been uncovered in Tanzania close to where similar tracks were found in the 1970s.",117,13,"http://www.bbc.com/news/science-environment-38289960",10,4.83333333333333,-0.0277777777777778
"540",539,"ramensupernova",1437121273,NA,"no",5374,1481723253,"nature.com",0,"5ianbe","yes","high",2007,0,"Biology","Fatality rates of infectious diseases may result from sex-specific virulence: the case of the HTLV-1 virus progressing to leukaemia, a progression more likely to kill Japanese men than Japanese women",170,3,"http://www.nature.com/articles/ncomms13849",11,5.1875,-0.0625
"541",540,"mvea",1148438857,"med   reward3","yes",56751,1481722606,"iopscience.iop.org",0,"5iall1","no","low",5257113,10,"Neuroscience","The seat of consciousness, dubbed the ""nucleus"", is proposed to be the region of the brain with the highest traffic, finds physicists, neuroscientists and mathematicians, using detailed scans of brains to assemble an information map of the human cortex that showed where that flow is concentrated.",252,24,"http://iopscience.iop.org/article/10.1088/1367-2630/18/8/083013/meta",15,5.30434782608696,0.0546875
"542",541,"mvea",1148438857,"med   reward3","yes",56751,1481722429,"nature.com",0,"5ial41","yes","high",5257113,4,"Neuroscience","Healthy human subjects could willingly modulate brain activity via a non-invasive brain-computer interface to control a robotic arm with high accuracy for performing tasks within the span of only a few training sessions and maintained the ability to control the robotic arm over multiple months.",251,68,"http://www.nature.com/articles/srep38565",10,5.27659574468085,0.100961538461538
"543",542,"PLOSScienceWednesday",1430249049,"AMA bio reward20","yes",14082,1481719164,"self.science",0,"5iacpa","no","low",115710,174,"Breast Cancer AMA","PLOS Science Wednesday: Hi reddit, we’re Katherine and Marni and we found that most DNA changes in breast cancer metastases occurs in the original tumor, while the metastatic tumors are comprised of clones from the original – Ask Us Anything!",207,4050,"https://www.reddit.com/r/science/comments/5iacpa/plos_science_wednesday_hi_reddit_were_katherine/",10,5.07692307692308,-0.00892857142857143
"544",543,"smurfyjenkins",1329667817,NA,"no",34870,1481716040,"journals.sagepub.com",0,"5ia5mv","yes","low",155854,15,"Social Science","Sleep-deprived judges give out harsher sentences",43,553,"http://journals.sagepub.com/doi/full/10.1177/0956797616678437",9,6,-0.125
"545",544,"kalenenail",1422599911,NA,"no",39,1481715640,"mykotori.com",0,"5ia4se","yes","low",10675,3,"Nanoscience","A new method is created by Researchers to trap harmful gases",50,77,"http://mykotori.com/trap-harmful-gases/",11,4.54545454545455,-0.0357142857142857
"546",545,"Wagamaga",1401896229,NA,"no",36563,1481711817,"jpain.org",0,"5i9x67","no","low",1505508,7,"Psychology","Individuals with complex regional pain syndrome experience pain simply by watching other people's movements.",95,81,"http://www.jpain.org/article/S1526-5900(16)30309-1/abstract",11,6.71428571428571,-0.1875
"547",546,"Trolske",1426279646,"bio","yes",121,1481710548,"sciencealert.com",0,"5i9urw","yes","low",5617,2,"Biology","First detailed observations on weird tardigrade mating behaviour",57,17,"http://www.sciencealert.com/we-finally-have-footage-of-tardigrade-mating-and-it-s-even-weirder-than-expected",12,7.125,-0.0416666666666667
"548",547,"researchisgood",1443541602,NA,"no",2555,1481710442,"researchgate.net",0,"5i9ujp","yes","low",79444,37,"Epidemiology","Harvard researchers find the genes that determine who smells asparagus pee and who doesn't.",78,238,"https://www.researchgate.net/blog/post/why-some-people-smell-asparagus-in-pee-and-others-dont",11,5.5,0
"549",548,"the_phet",1297521165,"reward1","yes",67944,1481709219,"pnas.org",0,"5i9s2o","yes","high",427387,0,"Psychology","Researchers demonstrated that fearful imaginings about the future can be inhibited by neural mechanisms that help to suppress the past. Importantly, suppression reduces later apprehensiveness about the feared events, a benefit that was diminished in individuals with greater trait anxiety.",250,15,"http://www.pnas.org/content/early/2016/12/08/1606604114",16,6.15,-0.0263157894736842
"550",549,"vmjaggard99",1458917405,"natgeo two","yes",3709,1481707464,"news.nationalgeographic.com",0,"5i9ooc","yes","low",17686,1,"Paleontology","A new set of 3.6-million-year-old footprints made by Australopithecus afarensis has been found at the Laetoli site in Tanzania. The prints were only found because scientists were evaluating the potential impacts of building a museum on the site.",208,13,"http://news.nationalgeographic.com/2016/12/oldest-human-footprints-australopithecus-lucy-tanzania-science/",16,4.95121951219512,0.075
"551",550,"apostoli",1188503236,NA,"no",3509,1481705506,"elifesciences.org",0,"5i9kul","yes","low",26668,2,"Anthropology","New footprints from Laetoli (Tanzania) provide evidence for marked body size variation in early hominins",90,67,"https://elifesciences.org/content/5/e19568",10,5.86666666666667,0.0833333333333333
"552",551,"--craig--",1441273606,NA,"no",2,1481688951,"sciencemag.org",0,"5i8io2","yes","high",34,7,"Environment","Reindeer are shrinking",20,10,"http://www.sciencemag.org/news/2016/12/reindeer-are-shrinking-because-warmer-arctic-temperatures",9,6.66666666666667,0
"553",552,"ManiaforBeatles",1470027722,NA,"no",22750,1481685019,"theguardian.com",0,"5i8725","no","low",1314953,9,"Anthropology","The reason why the penis bone or the 'baculum' is lost in humans may have to do with the emergence of monogamy. In monogamous relationships, the male does not need to spend a long time copulating, because the female is not likely to be leapt upon by other amorous males.",221,20,"https://www.theguardian.com/science/2016/dec/14/why-dont-humans-have-a-penis-bone-scientists-may-now-know-baculum?CMP=Share_AndroidApp_<U+D074><U+B9BD><U+BCF4><U+B4DC><U+C5D0>_<U+BCF5><U+C0AC>",13,4.3,0.0460526315789474
"554",553,"avogadros_number",1368151675,"reward2","yes",12643,1481682761,"agupubs.onlinelibrary.wiley.com",0,"5i8019","yes","low",255398,1,"Environment","Major Ocean Circulation Pattern at Risk from Greenland Ice Melt",54,11,"http://agupubs.onlinelibrary.wiley.com/hub/article/10.1002/2016GL070457/editor-highlight/",11,5.4,0.046875
"555",554,"FillsYourNiche",1481217820,"env   reward3","yes",103261,1481677881,"blogs.discovermagazine.com",0,"5i7kyl","yes","low",309209,4,"Biology","There are about 200 to 500 species of bacteria present in pitcher plant fluid. A few common species seem to be members of groups known to produce compounds that affect the surface tension of their medium. Changing the surface tension allows relatively light insects to drop into the liquid.",242,39,"http://blogs.discovermagazine.com/inkfish/2016/12/12/bacteria-help-pitcher-plants-trap-prey/#.WFCVEPkrKUk",10,4.87755102040816,0.00462962962962963
"556",555,"burtzev",1269213033,NA,"no",9427,1481676067,"pnas.org",0,"5i7fi5","yes","high",466896,0,"Neuroscience","Reducing future fears by suppressing the brain mechanisms underlying episodic simulation",78,2,"http://www.pnas.org/content/early/2016/12/08/1606604114.abstract.html?etoc",11,7.09090909090909,-0.0208333333333333
"557",556,"skoalbrother",1388717344,NA,"no",16503,1481673313,"nature.com.proxy.readcube.com",0,"5i76hm","yes","high",1489159,1,"Environment","Scientists discovered 55 lakes in Eastern Antarctica that shouldn't have been there",72,32,"http://www.nature.com.proxy.readcube.com/nclimate/journal/vaop/ncurrent/full/nclimate3180.html?token=ugKc5rPqk7ygiFuZlZpamoNM9ISyo8KNZc5N/MMc27hF9xqt5dOfFgSrWNeXWYMy&referrer_url=http://www.nature.com/articles/nclimate3180.epdf?",10,6,-0.025
"558",557,"mvea",1148438857,"med   reward3","yes",56751,1481670161,"msutoday.msu.edu",0,"5i6vzu","yes","low",5257113,14,"Social Science","Defendants charged with murder in North Carolina from 1990 to 2009 were more than twice as likely to receive the death penalty if the victims were white, Michigan State University researchers have found.",171,59,"http://msutoday.msu.edu/news/2016/are-death-row-cases-plagued-with-racial-bias/",11,5.12121212121212,-0.00961538461538462
"559",558,"StealthDrone",NA,NA,"no",NA,1481669014,"sciencenews.org",0,"5i6s1v","yes","low",NA,0,"Biology","Cell biologists learn how Zika kills brain cells, devise schemes to stop it",63,20,"https://www.sciencenews.org/blog/science-ticker/cell-biologists-learn-how-zika-kills-brain-cells?tgt=nr",10,4.76923076923077,0
"560",559,"shiruken",1283195097,"eng     rewardstar","yes",145633,1481668337,"cfpub.epa.gov",0,"5i6pqu","yes","low",306941,411,"Environment","The Environmental Protection Agency has concluded that fracking can contaminate drinking water although the prevalence remains unknown",118,11650,"https://cfpub.epa.gov/ncea/hfstudy/recordisplay.cfm?deid=332990",13,6.94117647058824,0.0568181818181818
"561",560,"jankoslavic",1415574893,NA,"no",0,1481668132,"sciencedirect.com",0,"5i6p0f","yes","low",1,2,"Physics","The Subpixel Resolution of Optical-Flow-Based Modal Analysis",54,2,"http://www.sciencedirect.com/science/article/pii/S0888327016304770",10,5.77777777777778,0.0357142857142857
"562",561,"Wagamaga",1401896229,NA,"no",36563,1481665946,"jamanetwork.com",0,"5i6h30","yes","high",1505508,5,"Social Science","American death rate from drugs, alcohol, and mental disorders nearly triples since 1980",75,11,"http://jamanetwork.com/journals/jama/fullarticle/10.1001/jama.2016.13645",9,5.61538461538461,0.0178571428571429
"563",562,"Wagamaga",1401896229,NA,"no",36563,1481665738,"journalsleep.org",0,"5i6gcs","yes","low",1505508,2,"Neuroscience","If we sleep in the first 24 hours after a traumatic experience, this may help process and integrate the distressing memories more effectively, as researchers from the University of Zurich and the Psychiatric University Hospital Zurich demonstrate in a new study",221,11,"http://www.journalsleep.org/ViewAbstract.aspx?pid=30874",11,5.34146341463415,0.025
"564",563,"physicsdavid",1161818091,NA,"no",14,1481663133,"blog.pnas.org",0,"5i66vz","yes","high",5585,1,"Physics","Why water forms on icy surfaces solved by new model after century-old mystery",65,25,"http://blog.pnas.org/2016/12/journal-club-why-does-water-form-on-icy-surfaces-new-model-solves-century-old-mystery/",8,4.57142857142857,0.0972222222222222
"565",564,"drewiepoodle",1320210830,"reward10","yes",141280,1481659558,"newscientist.com",0,"5i5tr6","yes","low",3416850,1194,"Biology","Viruses may have evolved to hit men hard but go easy on women. One explanation is that women are more valuable hosts. Women can pass infections to their children during pregnancy, birth, and breastfeeding, so there’s an evolutionary pressure on viruses to be less harmful to them.",236,27230,"https://www.newscientist.com/article/2115987-viruses-may-have-evolved-to-hit-men-hard-but-go-easy-on-women/?utm_source=NSNS&utm_medium=ILC&utm_campaign=webpush&cmpid=ILC%257CNSNS%257C2016-GLOBAL-webpush-MANFLU",13,4.85106382978723,-0.0694444444444444
"566",565,"mrchickenhorse",1437002938,NA,"no",5514,1481658890,"omni.media",0,"5i5r8t","yes","low",21369,1,"Biology","3D Bioprinting Takes Shot at Aging",29,16,"https://omni.media/3d-bioprinting-takes-shot-at-aging",11,4.83333333333333,-0.03125
"567",566,"BocceBaller42",1395420514,NA,"no",1559,1481654950,"ucrtoday.ucr.edu",0,"5i5cm7","yes","low",72049,2,"Psychology","Both pessimists and optimists brace for the worst with news",50,6,"https://ucrtoday.ucr.edu/42858",10,5,-0.125
"568",567,"BocceBaller42",1395420514,NA,"no",1559,1481653213,"news.ucsb.edu",0,"5i569m","yes","low",72049,2,"Environment","Giant kelp forests survived recent heat wave",38,154,"http://www.news.ucsb.edu/2016/017468/kelp-beats-heat",8,5.42857142857143,0.075
"569",568,"0ffline",1246814520,NA,"no",4715,1481647429,"pnas.org",0,"5i4llc","yes","high",145,4,"Environment","Past-focused environmental comparisons promote pro environmental outcomes for conservatives",83,5,"http://www.pnas.org/cgi/doi/10.1073/pnas.1610834113",13,8.2,0.0416666666666667
"570",569,"whitehole_86",1357275520,NA,"no",928,1481647290,"mcgill.ca",0,"5i4l4z","yes","low",6376,12,"Health","New study reinforces the idea that our brain’s processing of odour is not simply its reaction to the chemical compounds that make up the scent. It is influenced both by our previous experience with the scent and our knowledge of what the scent is.",206,179,"http://www.mcgill.ca/newsroom/channels/news/olfactory-perception-influenced-background-and-semantic-information-264301",10,4.59090909090909,0.0955882352941176
"571",570,"HeinieKaboobler",1369581012,NA,"no",2154,1481644180,"scienceblog.com",0,"5i4a4m","yes","low",556067,1,"Cancer","Blood test could provide cheaper, better way for doctors to manage lung cancer",66,4,"https://scienceblog.com/490633/blood-test-provide-cheaper-better-way-doctors-manage-lung-cancer/",7,5,0.125
"572",571,"HeinieKaboobler",1369581012,NA,"no",2154,1481643979,"news.illinois.edu",0,"5i49fc","yes","low",556067,1,"Psychology","Study links nutrition to brain health and intelligence in older adults",60,44,"https://news.illinois.edu/blog/view/6367/440188",12,5.45454545454545,0.232142857142857
"573",572,"Public_Fucking_Media",1471481384,NA,"no",64386,1481643965,"pbs.org",0,"5i49dy","yes","low",185351,2,"Astronomy","Galaxy’s Disk of Dark Matter Could Trigger Mass Extinctions on Earth - A new model of dark matter disk theory has accurately predicted the date of the Chicxulub crater impact, which annihilated the dinosaurs",176,13,"http://www.pbs.org/wgbh/nova/next/physics/galaxys-disk-of-dark-matter-could-trigger-mass-extinctions-on-earth/",11,5.21212121212121,0.0131578947368421
"574",573,"magenta_placenta",1229122632,NA,"no",24915,1481642296,"pnas.org",0,"5i43rr","yes","high",478713,1,"Environment","Stratospheric solar geoengineering without ozone loss",48,11,"http://www.pnas.org/content/early/2016/12/07/1615572113.abstract?sid=2efc7ea1-4579-4947-aeca-d34f1dee4108",14,8,-0.0833333333333333
"575",574,"mikepetroff",1293030594,NA,"no",7945,1481639569,"news.harvard.edu",0,"5i3vba","yes","low",112920,34,"Engineering","Researchers have identified an aerosol for solar geoengineering that may be able to cool the planet while simultaneously repairing ozone damage",123,120,"http://news.harvard.edu/gazette/story/2016/12/mitigating-the-risk-of-geoengineering/",14,5.85714285714286,0.0125
"576",575,"mitchandre",1200607633,NA,"no",12126,1481638950,"newscientist.com",0,"5i3tib","yes","low",32313,3,"Biology","Longer ‘penis’ drives evolution of bigger brains in female fish",58,9,"https://www.newscientist.com/article/2115595-longer-penis-drives-evolution-of-bigger-brains-in-female-fish/",9,5.2,0.0208333333333333
"577",576,"FridayHarbor99",1330083402,NA,"no",0,1481637080,"researchgate.net",0,"5i3o70","yes","low",167,0,"Biology","The effect of water temperature and velocity on barnacle growth: Quantifying the impact of multiple environmental stressors",107,2,"https://www.researchgate.net/publication/272102443_The_effect_of_water_temperature_and_velocity_on_barnacle_growth_Quantifying_the_impact_of_multiple_environmental_stressors?ev=prf_pub",13,6.23529411764706,0.025
