"","X1","author","author_created_date","author_flair","author_flair_binary","comment_karma","created_utc","domain","gilded","id","image","journal_h_index","link_karma","num_comments","subfield","title","title_len","upvotes","url","max_title_length","mean_title_length","title_sent"
"253",252,"FillsYourNiche",1481217820,"env   reward3","yes",103261,1482420246,"sci-news.com",0,"5jr3nz","yes","low",309205,41,"Cancer","Capsaicin, a compound found in peppers of the genus Capsicum, inhibits the growth of breast cancer cells, according to a team of researchers in Germany. The experiments were carried out with the SUM149PT cell culture.",183,895,"http://www.sci-news.com/medicine/capsaicin-breast-cancer-cells-04474.html",11,5.08571428571429,0.025
"254",253,"spsheridan",1259374554,NA,"no",8239,1482419216,"inderscience.com",0,"5jr0g1","no","low",870935,2,"Nanoscience","Scientists discover water exists in two states in the cross-over temperature range of 50 ± 10°C.",83,10,"http://www.inderscience.com/offer.php?id=79670",11,4.52941176470588,0
"255",254,"Mictlantecuhtli",1352732955,"anthro","yes",68450,1482416836,"mbe.oxfordjournals.org",0,"5jqtim","yes","low",292447,0,"Anthropology","Archaic adaptive introgression in TBX15/WARS2 - Arctic Inuit cold adaptations may originate from Denisovans",94,5,"http://mbe.oxfordjournals.org/content/early/2016/12/20/molbev.msw283.abstract?sid=3213026f-33d3-48ba-a07c-d6cf1543296b",13,6.57142857142857,-0.145833333333333
"256",255,"ecafsub",1378479184,NA,"no",66636,1482414516,"eurekalert.org",0,"5jqn8d","yes","low",84108,1,"Chemistry","Artificial leaf as mini-factory for drugs",36,10,"https://www.eurekalert.org/pub_releases/2016-12/euot-ala122116.php",10,5,0
"257",256,"Wagamaga",1401896229,NA,"no",36563,1482413682,"nature.com",0,"5jql62","no","high",1505508,77,"Health","Cancer spread is increased by a high fat diet. Researchers discover new cancer spreading protein",82,680,"http://www.nature.com/nature/journal/vaop/ncurrent/full/nature20791.html",11,5.4,0
"258",257,"Lilywen",1379768434,NA,"no",7213,1482413290,"nature.com",0,"5jqk5f","yes","high",29596,1,"Animal Science","The nature of prosociality in chimpanzees",36,94,"http://www.nature.com/articles/ncomms13915",12,6,0.375
"259",258,"Open_Neuroimaging",1482365502,"neuro AMA","yes",32,1482412939,"self.science",0,"5jqjb7","no","low",1756,143,"Neuroimaging AMA","Science AMA Series: We are the neuroscientists who started the Open Neuroimaging Lab, a winner of the Open Science Prize - AMA",105,2047,"https://www.reddit.com/r/science/comments/5jqjb7/science_ama_series_we_are_the_neuroscientists_who/",15,4.85714285714286,0.0104166666666667
"260",259,"mvea",1148438857,"med   reward3","yes",56750,1482412883,"sciencedaily.com",0,"5jqj5y","no","low",5257092,44,"Neuroscience","Music in the brain: The first imaging genetic study linking dopaminergic genes to music",74,1266,"https://www.sciencedaily.com/releases/2016/12/161221125458.htm",12,5.21428571428571,0.0138888888888889
"261",260,"SirT6",1397166648,"cancer     reward13","yes",91844,1482412715,"bbc.com",0,"5jqirl","yes","low",285727,92,"Medicine","New treatment for relapsing MS: administration of a bolus of B-cell depleting antibodies every six months reduces rates of relapse by 47% and slows disease progression in two Phase III trials.",162,2692,"http://www.bbc.com/news/health-38392548",14,4.9375,0.0234375
"262",261,"mvea",1148438857,"med   reward3","yes",56750,1482412632,"journals.plos.org",0,"5jqik2","yes","low",5257094,170,"Computer Science","A machine learning algorithm was able to discriminate between children that do and do not meet autism spectrum disorder (ASD) surveillance criteria at one surveillance site using only the text contained in developmental evaluations.",199,4963,"http://journals.plos.org/plosone/article?id=10.1371/journal.pone.0168224",13,5.76470588235294,0.0263157894736842
"263",262,"purabossa",1402141723,NA,"no",1678,1482411965,"eurekalert.org",0,"5jqgy5","yes","low",13942,15,"Astronomy","Avalanche statistics suggest Tabby's star is near a continuous phase transition",69,342,"https://www.eurekalert.org/pub_releases/2016-12/uoic-ass122016.php",10,6.27272727272727,-0.015625
"264",263,"sivribiber",1469036406,NA,"no",46258,1482409527,"nature.com",0,"5jqb91","yes","high",1415024,90,"Engineering","Researchers set new record for heat-resistant materials. Hafnium carbide can withstand temperatures of nearly 4000°C and could pave the way for both materials to be used in ever more extreme environments, such as in heat resistant shielding for the next generation of hypersonic space vehicles.",251,1060,"http://www.nature.com/articles/srep37962",12,5.21276595744681,0.00595238095238095
"265",264,"k4lifrag",1478678551,NA,"no",489,1482408741,"sciencealert.com",0,"5jq9jm","no","low",26316,26,"Geology","The supervolcano that caused one of the biggest eruptions in history has started to stir",74,93,"http://www.sciencealert.com/the-supervolcano-that-caused-one-of-the-biggest-eruptions-in-history-has-started-to-stir?",12,4.93333333333333,0.025
"266",265,"PHealthy",1424353401,"epi      reward6","yes",40703,1482407112,"ncbi.nlm.nih.gov",0,"5jq62s","yes","low",77370,203,"Social Science","Effect of female genital mutilation/cutting on sexual functions.",57,1053,"https://www.ncbi.nlm.nih.gov/pubmed/27938869",10,6.11111111111111,-0.0416666666666667
"267",266,"Wagamaga",1401896229,NA,"no",36563,1482405214,"onlinelibrary.wiley.com",0,"5jq2b3","yes","low",1505508,113,"Environment","New analysis, recently published in the Journal of Industrial Ecology, showed that consumers are responsible for more than 60 per cent of the globe's greenhouse gas emissions, and up to 80 per cent of the world's water use.",186,949,"http://onlinelibrary.wiley.com/doi/10.1111/jiec.12371/abstract",11,4.78947368421053,0.0625
"268",267,"kanhy",1365793727,NA,"no",83,1482396629,"nature.com",0,"5jplow","yes","high",16596,1,"Animal Science","Insect mimicry of plants dates back to the Permian",42,77,"http://www.nature.com/articles/ncomms13735",7,4.66666666666667,0
"269",268,"shiruken",1283195097,"eng     rewardstar","yes",145633,1482382802,"ucsdnews.ucsd.edu",0,"5jor93","yes","low",306941,2,"Neuroscience","Subiculum neurons encode an animal's current axis of travel and help align itself within a cognitive map of its environment",104,19,"http://ucsdnews.ucsd.edu/pressrelease/toeing_the_line_study_finds_brain_cells_that_signal_path_of_travel",11,5.2,0.0555555555555556
"270",269,"shiruken",1283195097,"eng     rewardstar","yes",145633,1482380719,"ioppublishing.org",0,"5jolzv","yes","low",306941,1,"Environment","Could Rudolph and friends affect climate change? Reindeer grazing increases summer albedo by reducing shrub abundance in Arctic tundra",116,21,"http://ioppublishing.org/news/could-rudolph-and-friends-help-to-slow-down-our-warming-climate/",9,6.05263157894737,0
"271",270,"zulq",1409873151,NA,"no",86,1482377803,"jci.org",0,"5joeex","yes","low",3018,0,"Cancer","Inhibiting mitochondrial respiration prevents cancer in a mouse model of Li-Fraumeni syndrome",82,0,"https://www.jci.org/articles/view/88668",13,6.23076923076923,0.0833333333333333
"272",271,"zulq",1409873151,NA,"no",86,1482369540,"journal.frontiersin.org",0,"5jnr2k","yes","low",3018,17,"Medicine","Vitamin D Signaling through Induction of Paneth Cell Defensins Maintains Gut Microbiota and Improves Metabolic Disorders and Hepatic Steatosis in Animal Models",138,72,"http://journal.frontiersin.org/article/10.3389/fphys.2016.00498/full",10,6.27272727272727,0.0138888888888889
"273",272,"Silverseren",1384805506,NA,"no",51638,1482367310,"tsukuba.ac.jp",0,"5jnkeb","yes","low",65793,1,"Biology","Mechanism of Successful Horizontal Gene Transfer between Divergent Organisms Explained",77,26,"http://www.tsukuba.ac.jp/en/news-list/p201612211010",10,7.7,0.0714285714285714
"274",273,"drewiepoodle",1320210830,"reward10","yes",141280,1482366120,"washington.edu",0,"5jngs7","yes","low",3416850,8,"Psychology","Research suggests that preschool-aged children can learn bias even through nonverbal signals displayed by adults, such as a condescending tone of voice or a disapproving look.",150,130,"http://www.washington.edu/news/2016/12/21/study-children-can-catch-social-bias-through-non-verbal-signals-expressed-by-adults/",13,5.44444444444444,0
"275",274,"drewiepoodle",1320210830,"reward10","yes",141280,1482361118,"news.osu.edu",0,"5jn13w","no","low",3416850,18,"Epidemiology","Violence spreads like a contagious disease. U.S. adolescents were up to 183% more likely to carry out some acts of violence if a friend had also committed the same act. Contagion extends by up to 4 degrees of separation – from a person to a friend, to the friend’s friend, and 2 more friends beyond.",249,90,"https://news.osu.edu/news/2016/12/20/violence-contagion/",11,4.38888888888889,0.0357142857142857
"276",275,"drewiepoodle",1320210830,"reward10","yes",141280,1482356345,"upi.com",0,"5jmlbw","yes","low",3416850,2,"Medicine","The bionic pancreas system is proving better in clinical trials at controlling blood sugar levels in patients with type 1 diabetes without risk of hypoglycemia (low blood sugar) than conventional or sensor-augmented insulin pump therapy, according to a new study.",224,29,"http://www.upi.com/Health_News/2016/12/20/Bionic-pancreas-shows-success-at-controlling-blood-sugar/1131482244193/?spt=mps&or=1&sn=hn",12,5.34146341463415,0.0288461538461538
"277",276,"SteRoPo",1379113773,NA,"no",1327,1482353764,"nature.com",0,"5jmcpm","yes","high",40954,1,"Paleontology","Earliest known rhinocerotoid fossil has been found in China.",52,23,"http://www.nature.com/articles/srep39607",13,5.66666666666667,0.125
"278",277,"edwinksl",1175053192,"eng","yes",8940,1482352478,"news.mit.edu",0,"5jm8ak","yes","low",80198,3,"Neuroscience","Distinctive brain pattern may underlie dyslexia: Study suggests reduced plasticity could account for reading difficulties.",108,22,"http://news.mit.edu/2016/distinctive-brain-pattern-may-underlie-dyslexia-1221",12,7.06666666666667,0.025
"279",278,"DoremusJessup",1318441120,NA,"no",16240,1482351934,"bbc.com",0,"5jm6gq","yes","low",1946039,12,"Medicine","Cells in the amniotic fluid that surrounds a developing baby can revive ageing and weak bones, say UK scientists. The discovery could help babies with genetic diseases, elderly people and even astronauts",172,90,"http://www.bbc.com/news/health-38376955",10,5.28125,0.0514705882352941
"280",279,"bboyjkang",1257919832,NA,"no",13344,1482351785,"nature.com",0,"5jm5zm","yes","high",18816,1,"Engineering","High resolution 3D imaging of living cells with sub-optical wavelength phonons",68,6,"http://www.nature.com/articles/srep39326",10,5.58333333333333,-0.0277777777777778
"281",280,"drewiepoodle",1320210830,"reward10","yes",141280,1482346395,"aftau.org",0,"5jlnf8","no","low",3416850,1,"Neuroscience","Study on mice finds that a popular food supplement may be key to reversing the effects of Familial Dysautonomia, or FD, a debilitating neurodegenerative disorder that affects about 1 in 31 Jewish people of Eastern European, or Ashkenazi ancestry.",208,3,"https://www.aftau.org/weblog-medicine--health?=&storyid4704=2310&ncs4704=3",17,5.23076923076923,-0.0197368421052632
"282",281,"BeMurda_",1374849362,NA,"no",4,1482346097,"bmjopen.bmj.com",0,"5jlme0","yes","low",25,2,"Health","A cross-sectional study of 392 Canadian alternative medicine clinic websites found the majority advertise unproven tests & treatments for allergy & asthma, including dangerous and/or absurd interventions like intravenous hydrogen peroxide & ionic foot bath detoxification.",237,22,"http://bmjopen.bmj.com/content/6/12/e014028.full?sid=89d0aac6-196a-4784-bc1e-537dd6984282",14,6.57142857142857,-0.0489130434782609
"283",282,"Wagamaga",1401896229,NA,"no",36563,1482344569,"alcoholjournal.org",0,"5jlgx1","no","low",1505508,5,"Health","Repeated binge drinking during adolescence can affect brain functions in future generations, potentially putting offspring at risk for such conditions as depression, anxiety, and metabolic disorders, a study has found.",189,33,"http://www.alcoholjournal.org/article/S0741-8329(16)30230-0/fulltext",11,6.13333333333333,-0.0514705882352941
"284",283,"andyhfell",1360047839,NA,"no",156,1482342948,"ucdavis.edu",0,"5jlb2u","yes","low",16850,7,"Environment","California forest survey shows that five years after a severe fire, conifers regenerate in only half of sites burned. Results could help Forest Service prioritize sites for planting.",155,162,"https://www.ucdavis.edu/news/high-severity-wildfires-complicate-natural-regeneration-california-conifers",10,5.42857142857143,-0.0333333333333333
"285",284,"Belsyre",1437439122,"bio","yes",7458,1482342595,"cell.com",0,"5jl9ur","no","high",1459,28,"Cancer","Curcumin, a compound in tumeric, has been found to suppress a tumor's immune system downregulation pathway",91,115,"http://www.cell.com/cancer-cell/abstract/S1535-6108(16)30497-4",14,5.5625,0.0625
"286",285,"scisights",1466780010,NA,"no",8,1482340582,"pnas.org",0,"5jl32z","yes","high",1700,3,"Astronomy","Rubbly surfaces of asteroids might exhibit the ""Brazil nut effect,"" sorting themselves something like mixed nuts in a can",103,9,"http://www.pnas.org/content/113/51/14465.full",10,5.26315789473684,-0.109375
"287",286,"psioni",1162046884,NA,"no",1103,1482340243,"reliawire.com",0,"5jl1va","yes","low",108453,2,"Neuroscience","Neurons in the brain store RNA molecules in order to rapidly react to stimuli",64,24,"http://reliawire.com/neuron-rna-molecule-storage/",9,4.57142857142857,0
"288",287,"imatterph",NA,NA,"no",NA,1482339244,"sciencemag.org",0,"5jkyf1","yes","high",NA,0,"Physics","Watch a cloud being born. scientists have captured the creation of a cirrus cloud by modifying an environmental scanning electron microscope (ESEM)—a microscope that can magnify subjects in a gaseous environment.",184,22,"http://www.sciencemag.org/news/2016/12/watch-cloud-being-born",13,5.53125,-0.00892857142857143
"289",288,"imatterph",NA,NA,"no",NA,1482338562,"nature.com",0,"5jkw1g","yes","high",NA,0,"Biology","Why humans develop sex cells as embryos — but corals don't<br />",55,1,"http://www.nature.com/news/why-humans-develop-sex-cells-as-embryos-but-corals-don-t-1.21218",7,4.45454545454545,0
"290",289,"spsheridan",1259374554,NA,"no",8239,1482335495,"bbc.com",0,"5jklby","yes","low",870935,0,"Earth Science","Molten iron 'jet stream' detected in Earth's outer core",47,11,"http://www.bbc.com/news/science-environment-38372342",8,5,0.0357142857142857
"291",290,"vilnius2013",1391507165,"bio","yes",22207,1482335179,"acsh.org",0,"5jkkb1","yes","low",301481,0,"Animal Science","Fake rainfall vibrations trick toads into emerging from underground.",60,8,"http://acsh.org/news/2016/12/21/fake-rainfall-vibrations-trick-toads-emerging-underground-10624",11,6.55555555555556,-0.175
"292",291,"NinjaDiscoJesus",1314456936,NA,"no",286255,1482334258,"theguardian.com",0,"5jkhd7","yes","low",2689566,6,"Biology","Scientists have offered a genetic explanation for why some people are obese and healthy while others develop diabetes and heart disease as a result of their weight.",138,7,"https://www.theguardian.com/science/2016/dec/21/three-genes-could-explain-why-some-people-are-obese-but-healthy-say-scientists?CMP=twt_a-science_b-gdnscience",11,5.07407407407407,0.0681818181818182
"293",292,"DoremusJessup",1318441120,NA,"no",16240,1482333623,"scientificamerican.com",0,"5jkfey","yes","low",1946040,0,"Biology","Why Humans Develop Sex Cells as Embryos--but Corals Don't: New insights might help unravel key secrets about safeguarding mitochondria",116,4,"https://www.scientificamerican.com/article/why-humans-develop-sex-cells-as-embryos-but-corals-dont/?wt.mc=SA_Reddit-Share",12,5.65,0.0972222222222222
"294",293,"HeinieKaboobler",1369581012,NA,"no",2154,1482331853,"digest.bps.org.uk",0,"5jk9sv","yes","low",556067,4,"Psychology","Men think women will be impressed by a tattoo, but they’re not",53,2,"https://digest.bps.org.uk/2016/12/21/men-think-women-will-be-impressed-by-a-tattoo-but-theyre-not/",9,4.16666666666667,0
"295",294,"NinjaDiscoJesus",1314456936,NA,"no",286255,1482331474,"psychiatrist.com",0,"5jk8pu","no","low",2689566,1,"Health","A study from Massachusetts General Hospital (MGH) investigators finds that, contrary to what is often believed, around two thirds of women with anorexia nervosa or bulimia nervosa will eventually recover from their eating disorders",198,6,"http://www.psychiatrist.com/jcp/article/Pages/2016/aheadofprint/15m10393.aspx",13,5.70588235294118,0.0333333333333333
"296",295,"sataky",1340813587,NA,"no",2800,1482329851,"nature.com",0,"5jk44b","yes","high",54049,5,"Earth Science","Magma could be approaching the critical degassing pressure in a supervolcano in the metropolitan area of Naples",95,46,"http://www.nature.com/articles/ncomms13712",12,5.58823529411765,-0.0714285714285714
"297",296,"belledenuit",1275532578,NA,"no",1929,1482329623,"ctvnews.ca",0,"5jk3ht","yes","low",393,13,"Medicine","New clinical trial shows that simple antibiotic cream could prevent Lyme disease",69,168,"http://www.ctvnews.ca/health/antibiotic-cream-could-prevent-lyme-disease-research-1.3211182",10,5.75,0.09375
"298",297,"NinjaDiscoJesus",1314456936,NA,"no",286255,1482328221,"independent.co.uk",0,"5jjznk","yes","low",2689566,8,"Social Science","Violence spreads through teenagers like a 'contagious disease', scientists find",70,21,"http://www.independent.co.uk/news/science/violence-spreads-teenagers-contagious-disease-scientists-find-knife-crime-london-a7487081.html",10,6.7,-0.03125
"299",298,"mikepetroff",1293030594,NA,"no",7945,1482327786,"news.harvard.edu",0,"5jjyia","yes","low",112920,4,"Neuroscience","Researchers reveal the neuroanatomy underlying Capgras syndrome, a rare disorder in which patients recognize a family member but experience that person as unfamiliar, leading to the conclusion that an impostor is impersonating their loved on",207,8,"http://news.harvard.edu/gazette/story/2016/12/blurring-the-person-you-love/",13,5.85714285714286,-0.015625
"300",299,"cassidy498",1456240613,NA,"no",55,1482327354,"news.osu.edu",0,"5jjxgh","yes","low",3188,3,"Biology","Never thought I'd see a salamander on a treadmill, but it happened and it was fantastic. Scientists used the mini machine to figure out mating patterns & help conservation efforts.",151,28,"https://news.osu.edu/news/2016/12/20/salamanders-on-the-road/",12,5.06896551724138,0.0104166666666667
"301",300,"mvea",1148438857,"med   reward3","yes",56750,1482326793,"online.liebertpub.com",0,"5jjw2x","yes","low",5257096,68,"Social Science","Taking a break from Facebook has positive effects on the two dimensions of well-being: our life satisfaction increases and our emotions become more positive, with these effects significantly greater for heavy Facebook users, passive Facebook users, and users who tend to envy others on Facebook.",251,534,"http://online.liebertpub.com/doi/10.1089/cyber.2016.0259",13,5.32608695652174,0.154411764705882
"302",301,"mvea",1148438857,"med   reward3","yes",56750,1482326700,"ajph.aphapublications.org",0,"5jjvul","yes","low",5257097,1048,"Epidemiology","US states with medical marijuana laws and dispensaries were associated with reductions in traffic fatalities, especially among those aged 25 to 44 years based on analysis of data from the 1985–2014 Fatality Analysis Reporting System.",201,24053,"http://ajph.aphapublications.org/#/doi/abs/10.2105/AJPH.2016.303577",12,5.44444444444444,-0.0138888888888889
"303",302,"PLOSScienceWednesday",1430249049,"AMA bio reward20","yes",14082,1482324344,"self.science",0,"5jjq3l","yes","low",115710,136,"Chlamydia AMA","PLOS Science Wednesday: Hi Reddit, we’re John and Yasser, and we found an unexpected mechanism of cell division in Chlamydia trachomatis unique to this human bacterial pathogen, creating implications for developing Chlamydia-specific therapies – Ask Us Anything!",230,2912,"https://www.reddit.com/r/science/comments/5jjq3l/plos_science_wednesday_hi_reddit_were_john_and/",12,5.91891891891892,0.0297619047619048
"304",303,"fullersam",1449693980,NA,"no",3005,1482322644,"news.cnrs.fr",0,"5jjm6j","yes","low",57360,185,"Biology","New study shows brainless slime can also share 'learned' knowledge by fusion",65,5227,"https://news.cnrs.fr/articles/brainless-slime-can-share-learned-knowledge",9,5.25,0.078125
"305",304,"H8-M8",1469819442,NA,"no",317,1482320457,"sciencedirect.com",0,"5jjhjw","yes","low",8187,2,"Earth Science","Present-day erosion of Martian polar terrain by the seasonal CO2 jets",59,93,"http://www.sciencedirect.com/science/article/pii/S0019103516305693",8,4.83333333333333,-0.015625
"306",305,"ninthinning01",1408990419,NA,"no",3275,1482316757,"onlinelibrary.wiley.com",0,"5jj9zi","yes","low",65543,0,"Earth Science","Albedo enhancement by stratospheric sulfur injections: More research needed - Robock - 2016 - Earth's Future",93,3,"http://onlinelibrary.wiley.com/doi/10.1002/2016EF000407/full",13,6.84615384615385,0.0535714285714286
"307",306,"ninthinning01",1408990419,NA,"no",3275,1482316519,"m.pnas.org",0,"5jj9j5","yes","high",65543,0,"Chemistry","Chemical distinctions between Stradivari’s maple and modern tonewood",63,7,"http://m.pnas.org/content/early/2016/12/13/1611253114.full",12,7.625,-0.0833333333333333
"308",307,"Wagamaga",1401896229,NA,"no",36563,1482316248,"nber.org",0,"5jj906","no","low",1505508,191,"Social Science","Economists report surging income inequality in United States. The top 1 percent income share is now almost twice as large as the bottom 50 percent share, a group that is by definition 50 times more numerous,",172,719,"https://www.nber.org/papers/w22945.pdf",10,4.69444444444444,-0.0297619047619048
"309",308,"Wagamaga",1401896229,NA,"no",36563,1482307251,"sciencedirect.com",0,"5jirga","yes","low",1505508,210,"Environment","Researchers have found that nearly 10,000 metric tons -- or 22 million pounds -- of plastic debris enter the Great Lakes every year from the United States and Canada",137,2968,"http://www.sciencedirect.com/science/article/pii/S0025326X1630981X",11,4.92592592592593,-0.0803571428571429
"310",309,"PalpatineSenpai",1468204876,NA,"no",1997,1482294766,"livescience.com",0,"5jhy0c","yes","low",15256,1,"Animal Science","Mysterious 'Ghost Shark' Found for 1st Time in Northern Hemisphere",57,14,"http://www.livescience.com/57272-ghost-shark-video-from-northern-hemisphere.html",10,5.5,0.015625
"311",310,"ninthinning01",1408990419,NA,"no",3275,1482292380,"nature.com",0,"5jhutf","yes","high",65543,0,"Geology","Greenland subglacial drainage evolution regulated by weakly connected regions of the bed : Nature Communications",98,0,"http://www.nature.com/articles/ncomms13903",14,6.92857142857143,0.0555555555555556
"312",311,"NinjaDiscoJesus",1314456936,NA,"no",286255,1482291579,"bristol.ac.uk",0,"5jhsn4","yes","low",2689566,2,"Anthropology","A team of international scientists, led by the University of Bristol, has uncovered the earliest direct evidence of humans processing plants for food found anywhere in the world.",151,43,"http://www.bristol.ac.uk/news/2016/december/prehistoric-plant-processing-.html",13,5.28571428571429,-0.0892857142857143
"313",312,"Ree81",1318081728,NA,"no",142126,1482291320,"ncbi.nlm.nih.gov",0,"5jhrwv","yes","low",40971,5,"Health","Obsolete tobacco control themes can be hazardous to public health: the need for updating views on absolute product risks and harm reduction",118,27,"https://www.ncbi.nlm.nih.gov/pmc/articles/PMC4878038/",9,5.31818181818182,0.03125
"314",313,"protohedgehog",1337603358,NA,"no",108,1482287675,"blogs.discovermagazine.com",0,"5jhhor","yes","low",6361,1,"Paleontology","Lighting up dinosaurs with lasers",29,9,"http://blogs.discovermagazine.com/crux/2016/12/20/paleontology-lasers-fossils/#.WFncyVN96M9",9,5.8,-0.125
"315",314,"NinjaDiscoJesus",1314456936,NA,"no",286255,1482284357,"bbc.com",0,"5jh85t","yes","low",2689566,8,"Health","Eating processed meat might make asthma symptoms worse, say researchers. Consuming more than four portions a week is a risk, suggests the study of nearly 1,000 French people, published in the journal Thorax.",175,17,"http://www.bbc.com/news/health-38370057",11,5.15151515151515,-0.0416666666666667
"316",315,"drewiepoodle",1320210830,"reward10","yes",141280,1482280406,"oia.hokudai.ac.jp",0,"5jgwn9","no","low",3416850,2,"Biology","Scientists previously hypothesized that evolutionary forces work to maintain a species' most functional physiological features. They call the process ""stabilizing selection,"" and suggest that it works as a counterbalance to ""random genetic drift,"" where genetic variations occur randomly over time.",259,5,"https://www.oia.hokudai.ac.jp/blog/stabilizing-evolutionary-forces-keep-ants-strong/",14,6.25,0.016304347826087
"317",316,"superhelical",1420836623,"bio reward5","yes",62516,1482278400,"pnas.org",0,"5jgqg7","yes","high",18847,4,"Biology","The concave disc shape of red blood cells results from unequal distribution of molecules in the cell membrane",92,27,"http://www.pnas.org/content/113/51/14847.short",12,5.11111111111111,0.0227272727272727
"318",317,"SamStringTheory",1356664218,NA,"no",5257,1482277650,"physics.aps.org",0,"5jgo2r","yes","high",2497,2,"Physics","Nuclear Fusion: Liquid Fuel Cells May Rectify Problems Faced by Inertial Confinement Fusion",79,55,"https://physics.aps.org/synopsis-for/10.1103/PhysRevLett.117.245001",11,6,-0.0340909090909091
"319",318,"anaxarchos",1408182847,NA,"no",4475,1482276045,"le.ac.uk",0,"5jgiy6","no","low",58539,6,"Medicine","Alzheimer’s advance: early stage study in mice show new drugs that restore memory loss and prolong life",89,32,"http://www2.le.ac.uk/offices/press/press-releases/2016/december/alzheimer2019s-advance-early-stage-study-in-mice-show-new-drugs-that-restore-memory-loss-and-prolong-life",11,5.05882352941176,0.0208333333333333
