"","X1","author","author_created_date","author_flair","author_flair_binary","comment_karma","created_utc","domain","gilded","id","image","journal_h_index","link_karma","num_comments","subfield","title","title_len","upvotes","url","max_title_length","mean_title_length","title_sent"
"521",520,"IODP",1430713706,"env AMA","yes",566,1485435901,"self.science",0,"5qa0y6","no","low",3019,29,"Ocean Floor AMA","Science AMA Series: Scientists are on board the R/V JOIDES Resolution for two months to drill into the ocean floor to investigate geochemical, tectonic, and biological processes occurring in undersea mud volcanoes in an active subduction zone.",207,279,"https://www.reddit.com/r/science/comments/5qa0y6/science_ama_series_scientists_are_on_board_the_rv/",11,5.31578947368421,-0.00657894736842105
"522",521,"Wagamaga",1401896229,NA,"no",36563,1485433542,"medicalxpress.com",0,"5q9vdu","yes","low",1505508,1,"Health","New research shows that people who have schizophrenia can still live independently, pursue higher education or hold down a demanding job – and many do just that, living full and productive lives.",166,18,"https://medicalxpress.com/news/2017-01-schizophrenia-coping-strategies-individuals-high-level.html",13,5.16129032258065,0.1015625
"523",522,"vilnius2013",1391507165,"bio","yes",22207,1485431978,"nature.com",0,"5q9s23","yes","high",301481,1,"Animal Science","Six Years in the Life of a Mother Bear - The Longest Continuous Heart Rate Recordings from a Free-Ranging Mammal",93,40,"http://www.nature.com/articles/srep40732?WT.ec_id=SREP-631-20170124&spMailingID=53263827&spUserID=NTg1NjI0NjM0NTIS1&spJobID=1084566974&spReportId=MTA4NDU2Njk3NAS2",10,4.55,0.0673076923076923
"524",523,"the_phet",1297521165,"reward1","yes",67944,1485429088,"nature.com",0,"5q9mkk","yes","high",427385,5,"Physics","Mini light gyroscope made. The smallest optical gyroscope yet made fits onto a computer chip with a volume of just 15 cubic centimetres. Instead of producing interference in a large fibre-optic loop, the light resonates inside a minuscule crystalline cavity",218,29,"http://www.nature.com/nature/journal/v541/n7638/full/541439c.html",12,5.21951219512195,0.04
"525",524,"the_phet",1297521165,"reward1","yes",67944,1485428963,"nature.com",0,"5q9mbo","yes","high",427385,25,"Environment","Across the United States, electric vehicles are more detrimental to the environment than petrol-powered vehicles thanks to the pollution created in generating electricity.",149,1,"http://www.nature.com/nature/journal/v541/n7638/full/541438b.html",11,6.08333333333333,-0.0384615384615385
"526",525,"mvea",1148438857,"med   reward3","yes",56749,1485427880,"technologyreview.com",0,"5q9ket","yes","low",5256987,58,"Medicine","Two Infants Treated with Universal Immune Cells Have Their Cancer Vanish - In a medical first, the children were treated with genetically engineered T-cells from another person.",151,3739,"https://www.technologyreview.com/s/603502/two-infants-treated-with-universal-immune-cells-have-their-cancer-vanish/",11,5.44444444444444,-0.0390625
"527",526,"Vippero",1438850855,NA,"no",3289,1485426792,"sanger.ac.uk",0,"5q9ih0","yes","low",212302,2,"Neuroscience","Genetic study identifies 14 new developmental disorders in children",59,0,"http://www.sanger.ac.uk/news/view/genetic-study-identifies-14-new-developmental-disorders-children",13,6.55555555555556,0.0416666666666667
"528",527,"the_phet",1297521165,"reward1","yes",67944,1485426712,"sciencemag.org",0,"5q9ic7","yes","high",427385,1,"Engineering","Scientists are using the process of knitting to make artificial muscle that moves more like we do. They created a textile actuator, or textuator—a new kind of smart fabric that can control movement. They coated cellulose yarn with a polymer that shifts and stretches in response to electricity",248,36,"http://www.sciencemag.org/news/2017/01/watch-knitted-muscle-could-power-supersuits-future",11,4.93877551020408,0.0625
"529",528,"Bloomsey",1432194539,NA,"no",3252,1485425491,"klewtv.com",0,"5q9g9y","yes","low",229337,28,"Paleontology","Researchers have discovered a 100-million-year-old insect preserved in amber with a triangular head, almost-alien and 'E.T.-like' appearance and features so unusual that it has been placed in its own scientific 'order' -- an incredibly rare event.",212,282,"http://klewtv.com/news/nation-world/newly-discovered-insect-looked-so-much-like-the-way-aliens-are-often-portrayed",11,4.95,-0.0476190476190476
"530",529,"ostrich-scalp",1420393142,NA,"no",8245,1485422640,"wits.ac.za",0,"5q9bgv","no","low",64,1,"Physics","Physicists show that real-time error correction in quantum communications is possible.",76,39,"http://www.wits.ac.za/news/latest-news/research-news/2017/2017-01/big-brother-will-have-some-difficulty-watching-you-in-future.html#sthash.d1b4kSRa.dpuf",14,6.16666666666667,-0.0178571428571429
"531",530,"vilnius2013",1391507165,"bio","yes",22207,1485419721,"med.stanford.edu",0,"5q96qs","yes","low",301481,16,"Medicine","Mouse pancreases grown in rats generate functional, insulin-producing cells that can reverse diabetes when transplanted into mice with the disease.",128,287,"http://med.stanford.edu/news/all-news/2017/01/rat-grown-mouse-pancreases-help-reverse-diabetes-in-mice.html",12,5.95238095238095,0.104166666666667
"532",531,"Major9000",1353456064,NA,"no",4074,1485411865,"pubs.acs.org",0,"5q8s16","no","high",4682,2,"Environment","Effects on Biotransformation, Oxidative Stress, and Endocrine Disruption in Rainbow Trout (Oncorhynchus mykiss) Exposed to Hydraulic Fracturing Flowback and Produced Water",151,7,"http://pubs.acs.org/doi/abs/10.1021/acs.est.6b04695?journalCode=esthag",17,7,-0.0625
"533",532,"swingthatwang",1450435959,NA,"no",15795,1485407998,"uth.edu",0,"5q8j0n","yes","low",13841,2,"Neuroscience","Researchers Pinpoint Area of Hippocampus Linked to Bipolar Disorder",59,42,"https://www.uth.edu/media/story.htm?id=5c9ad1ba-4cdb-4d93-9172-ee1b986a7331",11,6.55555555555556,-0.125
"534",533,"laikalow",1481690308,NA,"no",1197,1485407656,"news.nationalgeographic.com",0,"5q8i5o","yes","low",5781,3,"Animal Science","New crypt-keeper wasp - named after Egyptian god of chaos and evil - is parasite that bursts from host's head",90,22,"http://news.nationalgeographic.com/2017/01/crypt-keeper-wasps-parasites-new-species/",8,4.57894736842105,-0.0909090909090909
"535",534,"Wish_you_were_there",1356311769,NA,"no",84425,1485406032,"scienmag.com",0,"5q8dsr","yes","low",26461,0,"Neuroscience","Postpartum depression & anxiety distinct from other mood disorders, brain studies suggest.",79,22,"https://scienmag.com/postpartum-depression-anxiety-distinct-from-other-mood-disorders-brain-studies-suggest/",10,6.90909090909091,-0.046875
"536",535,"NinjaDiscoJesus",1314456936,NA,"no",286255,1485399897,"vox.com",0,"5q7wei","yes","low",2689566,32,"Health","Diabetes may be a major, overlooked reason Americans are now dying earlier - A new study triples the estimate for the death toll from diabetes.",119,49,"http://www.vox.com/policy-and-politics/2017/1/25/14383580/diabetes-americans-dying-earlier-mortality",10,4.83333333333333,0.0480769230769231
"537",536,"HeinieKaboobler",1369581012,NA,"no",2154,1485395639,"nymag.com",0,"5q7jef","yes","low",556066,1,"Psychology","Even the Easiest Exercise Makes People Happier",40,13,"http://nymag.com/scienceofus/2017/01/even-the-easiest-exercise-makes-people-happier.html",8,5.71428571428571,0.125
"538",537,"sataky",1340813587,NA,"no",2800,1485392373,"journals.plos.org",0,"5q799z","yes","low",54049,2,"Psychology","A Virtual Out-of-Body Experience Reduces Fear of Death",47,13,"http://journals.plos.org/plosone/article?id=10.1371/journal.pone.0169343",10,4.5,-0.160714285714286
"539",538,"ninthinning01",1408990419,NA,"no",3275,1485391492,"advances.sciencemag.org",0,"5q76dv","yes","high",65543,0,"Earth Science","Accelerated freshening of Antarctic Bottom Water over the last decade in the Southern Indian Ocean | Science Advances",100,5,"http://advances.sciencemag.org/content/3/1/e1601426.full",11,5.82352941176471,0
"540",539,"NinjaDiscoJesus",1314456936,NA,"no",286255,1485390911,"independent.co.uk",0,"5q74kd","yes","low",2689566,16,"Medicine","Depression linked to higher chance of dying from cancer, new study finds.",62,20,"http://www.independent.co.uk/life-style/health-and-families/health-news/depression-cancer-linked-higher-chance-dying-study-bmj-david-batty-a7546141.html",10,5,0.046875
"541",540,"RifkinsDilemma",1408017251,NA,"no",2300,1485390680,"newscientist.com",0,"5q73rk","yes","low",111177,5,"Medicine","Gene-blocking therapy reverses Alzheimer's-like symptoms in mice",58,16,"https://www.newscientist.com/article/2119254-gene-blocking-therapy-reverses-alzheimers-like-symptoms-in-mice/",11,6.22222222222222,-0.0625
"542",541,"drewiepoodle",1320210830,"reward10","yes",141280,1485388382,"news.ucsb.edu",0,"5q6w2v","yes","low",3416850,1,"Environment","Marine reserves play an important role in sustaining ecosystem diversity and abundance. Their presence enables certain species to return to a natural size structure, which enables predators to control destructive prey.",188,6,"http://www.news.ucsb.edu/2017/017617/size-matters",11,5.96774193548387,-0.0394736842105263
"543",542,"happiiiface",1460396910,NA,"no",6322,1485388080,"nature.com",0,"5q6v2v","no","high",10756,2,"Cancer","Computer scientists design artificial intelligence algorithm to diagnose skin cancer with dermatologist-level accuracy",106,11,"http://www.nature.com/nature/journal/vaop/ncurrent/full/nature21492.html",13,7.5,0.136363636363636
"544",543,"SirT6",1397166648,"cancer     reward13","yes",91843,1485380014,"sciencedaily.com",0,"5q62gz","no","low",285726,4,"Social Science","White American adults are more likely than African American adults to get an annual flu shot (47% vs. 39%) - now researchers have quantified the social, cultural and historical contexts linking race to key underlying issues such as trust in government and medical agencies.",230,4,"https://www.sciencedaily.com/releases/2017/01/170123162307.htm",11,5.16279069767442,0.04375
"545",544,"shiruken",1283195097,"eng     rewardstar","yes",145633,1485378424,"yahoo.com",0,"5q5wkj","yes","low",306941,7,"Epidemiology","Infant diarrhea linked to telomere shortening, suggesting that early life infections may influence later life health",101,80,"https://www.yahoo.com/tech/study-links-infant-diarrhea-telomere-150022710.html",10,6.25,0.102272727272727
"546",545,"nsgx",1439225143,NA,"no",140,1485377814,"nature.com",0,"5q5u8f","no","high",1502,1,"Medicine","[Microbiome] A study in Nature Medicine has found that mode of delivery, vaginal versus cesarean section, did not affect the infants’ microbiome composition.",137,5,"http://www.nature.com/articles/nm.4272.epdf?shared_access_token=xHxnozJc_OeGyiSIclSPTdRgN0jAjWel9jnR3ZoTv0NE6ptha992C7leT2EdQ5nZDW7lUhT6QJc8HM1bkldgDf43EI1mSf70ozJbHGwJ_eqTzDEe1t0h_UVvV4uBfj1HwyQxlKt4aSSfG2KtS5IVScYVbUhhShhQC6UrPt5yNIn8U0zAGw2XwH61pgnW2RA1RSacO2mOlEYGJqbQRSHZhw%3D%3D",11,5.60869565217391,0.0576923076923077
"547",546,"Smilefriend",1249913273,NA,"no",1250,1485377037,"medicalxpress.com",0,"5q5rcs","yes","low",90625,1,"Cancer","Deep learning algorithm does as well as dermatologists in identifying skin cancer",70,21,"https://medicalxpress.com/news/2017-01-deep-algorithm-dermatologists-skin-cancer.html",14,5.83333333333333,0
"548",547,"Silverseren",1384805506,NA,"no",51638,1485377001,"research.msu.edu",0,"5q5r7v","yes","low",65786,4,"Medicine","Sequencing Poisonous Mushrooms May Lead to New Medicines",49,9,"http://research.msu.edu/sequencing-poisonous-mushrooms-to-may-lead-to-new-medicines/",10,6.125,0.075
"549",548,"drewiepoodle",1320210830,"reward10","yes",141280,1485376850,"cardiff.ac.uk",0,"5q5qnx","yes","low",3416850,16,"Physics","Scientists theorize that the power of acoustic-gravity waves could be harnessed and directed at an oncoming tsunami wave, reducing its amplitude and thus diminishing the magnitude of the damage.",166,90,"http://www.cardiff.ac.uk/news/view/552789-tsunami-prevention",11,5.43333333333333,-0.0178571428571429
"550",549,"burtzev",1269213033,NA,"no",9427,1485375285,"mdpi.com",0,"5q5ko1","yes","low",466885,5,"Cancer","Dietary Patterns and Pancreatic Cancer Risk: A Meta-Analysis",53,5,"http://www.mdpi.com/2072-6643/9/1/38/htm",10,5.66666666666667,-0.0535714285714286
"551",550,"burtzev",1269213033,NA,"no",9427,1485374828,"mdpi.com",0,"5q5ivf","yes","low",466885,0,"Medicine","Retinoic Acid and Its Role in Modulating Intestinal Innate Immunity",58,0,"http://www.mdpi.com/2072-6643/9/1/68/htm",10,5.8,-0.208333333333333
"552",551,"drewiepoodle",1320210830,"reward10","yes",141280,1485372672,"uva.nl",0,"5q5akz","yes","low",3416850,1,"Neuroscience","A new research study contradicts the established view that so-called split-brain patients have a split consciousness. A split brain is a brain with a severed corpus callosum, the bundle of neural fibers connecting the brain's left and right hemispheres.",215,14,"http://www.uva.nl/en/news-events/news/uva-news/uva-news/uva-news/content/folder-3/2017/01/split-brain-does-not-lead-to-split-consciousness.html",13,5.1219512195122,0.0113636363636364
"553",552,"Wagamaga",1401896229,NA,"no",36563,1485370446,"medicalxpress.com",0,"5q51xh","yes","low",1505508,1,"Computer Science","A team of researchers at Barcelona University has found that virtual reality experiences, if conducted in a certain way, can cause a reduced fear of dying.",130,6,"https://medicalxpress.com/news/2017-01-virtual-reality-out-of-body-death-volunteers.html",11,4.88461538461539,-0.0192307692307692
"554",553,"Lightfiend",1223566505,NA,"no",47684,1485370428,"academic.oup.com",0,"5q51vg","yes","low",537101,2,"Neuroscience","The neuroanatomical basis of the Big 5 model of personality",50,8,"https://academic.oup.com/scan/article/doi/10.1093/scan/nsw175/2952683/Surface-based-morphometry-reveals-the#.WIjN24j0-Vg.twitter",15,5,0.125
"555",554,"SharkinaShark",1314356489,NA,"no",5029,1485370133,"space.com",0,"5q50pf","yes","low",105371,1,"Astronomy","The dwarf planet Ceres is cloaked in a layer of asteroid dust that disguises its true surface composition, a new study suggests.",107,21,"http://www.space.com/35451-dwarf-planet-ceres-camouflage-asteroid-dust.html?",11,4.77272727272727,0.0480769230769231
"556",555,"mvea",1148438857,"med   reward3","yes",56749,1485368860,"newatlas.com",0,"5q4vtr","yes","low",5256992,12,"Neuroscience","Smoking may normalize the impairments in brain activity associated with schizophrenia, based on a study in mice, potentially explaining why people with schizophrenia are more likely to smoke than people without the disease, and unlocking an entirely new field of drug research to combat the disease.",254,55,"http://newatlas.com/nicotine-smoking-schizophrenia-study/47552/",13,5.43478260869565,0.107954545454545
"557",556,"crowmint",1382115595,NA,"no",110,1485368610,"news.agu.org",0,"5q4uvl","no","low",736,3,"Earth Science","New study highlights need to increase female peer reviewers",51,1,"http://news.agu.org/press-release/new-study-highlights-need-to-increase-female-peer-reviewers/",10,5.66666666666667,0.0625
"558",557,"crowmint",1382115595,NA,"no",110,1485367764,"nrs.fs.fed.us",0,"5q4rm2","no","low",736,3,"Environment","Association between urban trees (loss) and crime: Evidence from the spread of the emerald ash borer in Cincinnati",96,7,"https://www.nrs.fs.fed.us/pubs/52526",11,5.16666666666667,-0.025
"559",558,"WarmGreycen",1474299989,NA,"no",3984,1485367683,"ucl.ac.uk",0,"5q4r9u","yes","low",14993,0,"Health","A team led by UCl researchers has identified how HIV is able to infect macrophages. They discovered a treatment that can maintain macrophage defenses.",127,5,"http://www.ucl.ac.uk/news/news-articles/0117/250117-hiv-macrophages",11,5.20833333333333,-0.0192307692307692
"560",559,"mmm_toasty",1401043745,"compsci","yes",9904,1485363534,"engineering.wustl.edu",0,"5q4bme","no","low",18457,0,"Nanoscience","New nanoparticle discovery may eliminate cold storage for some medical tests",66,8,"https://engineering.wustl.edu/news/Pages/Storing-and-testing-at-any-temperature.aspx",12,6,-0.0625
"561",560,"spsheridan",1259374554,NA,"no",8239,1485355966,"osapublishing.org",0,"5q3klb","no","low",870935,26,"Engineering","Engineers develop 'smart glasses' that automatically focus on what wearer sees",68,314,"https://www.osapublishing.org/oe/fulltext.cfm?uri=oe-25-2-1221&id=357441",13,6,0.142857142857143
"562",561,"smurfyjenkins",1329667817,NA,"no",34870,1485355046,"onlinelibrary.wiley.com",0,"5q3htn","yes","low",155831,879,"Social Science","Speakers of futureless tongues (those that do not distinguish between the present and future tense, e.g. Estonian) show greater support for future-oriented policies, such as protecting the environment",173,17899,"http://onlinelibrary.wiley.com/doi/10.1111/ajps.12290/full",11,5.75862068965517,-0.125
"563",562,"chemicalalice",1401453923,NA,"no",5178,1485354542,"economist.com",0,"5q3g75","yes","low",37454,0,"Neuroscience","Researchers have applied standard techniques from neuroscience to a simple microprocessor chip to test them.",94,13,"http://www.economist.com/news/science-and-technology/21714978-cautionary-tale-about-promises-modern-brain-science-tests-suggest",14,6.2,-0.0178571428571429
"564",563,"KnotTrying",1390060905,NA,"no",521,1485350461,"elifesciences.org",0,"5q34jw","yes","low",2567,30,"Neuroscience","Dyslexics' faster decay of implicit memory for sounds and words is manifested in their shorter neural adaptation",96,334,"https://elifesciences.org/content/6/e20557",10,5.58823529411765,0
"565",564,"NinjaDiscoJesus",1314456936,NA,"no",286255,1485350249,"link.springer.com",0,"5q3402","yes","low",2689566,12,"Environment","Brief exposure to Pope Francis heightens moral beliefs about climate change.",66,154,"http://link.springer.com/article/10.1007/s10584-016-1893-9",9,5.90909090909091,0.0535714285714286
"566",565,"avogadros_number",1368151675,"reward2","yes",12643,1485350076,"geneticliteracyproject.org",0,"5q33il","yes","low",255394,254,"Environment","Organic yields lag conventional by 20% in developed countries, 43% in Africa, meta-analyses find",83,916,"https://www.geneticliteracyproject.org/2017/01/23/organic-yields-lag-conventional-20-developed-countries-43-africa-meta-analyses-finds/",12,5.2,0
"567",566,"prodigies2016",1455277795,NA,"no",4714,1485349210,"researchgate.net",0,"5q315o","yes","low",108218,51,"Chemistry","Artificial cells pass a chemical Turing test by communicating with real cells.",67,2238,"https://www.researchgate.net/blog/post/artificial-cells-pass-the-turing-test",13,5.5,0.0138888888888889
"568",567,"PLOSScienceWednesday",1430249049,"AMA bio reward20","yes",14082,1485348089,"self.science",0,"5q2y8m","yes","low",115710,88,"Bumblebees AMA","PLOS Science Wednesday: Hi Reddit, my name is Lars and I published a PLOS Biology study showing bumblebees can solve a string-pulling puzzle, and share the innovation with their other bees in their colony -- Ask Me Anything!",187,1597,"https://www.reddit.com/r/science/comments/5q2y8m/plos_science_wednesday_hi_reddit_my_name_is_lars/",10,4.73684210526316,0.00568181818181818
"569",568,"Parasite_AMA",1485304356,"bio AMA","yes",181,1485346913,"self.science",0,"5q2vgq","yes","low",577,99,"Parasite AMA","Science AMA Series: We’re Drs. Kelly Weinersmith, Andrew Forbes, and Scott Egan! We just released a paper documenting a new case of parasite manipulation of host behavior. AMA!",151,648,"https://www.reddit.com/r/science/comments/5q2vgq/science_ama_series_were_drs_kelly_weinersmith/",12,5.07142857142857,0.0416666666666667
"570",569,"bostonstrong781",1399560413,NA,"no",793,1485346418,"theconversation.com",0,"5q2uam","yes","low",14413,5,"Social Science","Lack of health insurance leads to spillover effects of a lower level of social cohesion, in a study of L.A. neighborhood survey data",110,145,"https://theconversation.com/communities-plagued-by-uninsurance-also-suffer-from-breakdowns-in-trust-social-connection-71602",12,4.69565217391304,0.0357142857142857
"571",570,"avogadros_number",1368151675,"reward2","yes",12643,1485346329,"climate-lab-book.ac.uk",0,"5q2u2z","yes","low",255394,1,"Environment","Defining ‘pre-industrial’: The UN Paris Agreement aims to ensure increases in global temperature are < 2°C above pre-industrial levels. However, the starting line of the pre-industrial era is not defined by the UN, or by the IPCC. A new analysis aims to better define the pre-industrial baseline.",255,11,"http://www.climate-lab-book.ac.uk/2017/defining-pre-industrial/",11,4.62745098039216,0.05
"572",571,"avogadros_number",1368151675,"reward2","yes",12643,1485346114,"news.agu.org",0,"5q2tms","yes","low",255394,26,"Environment","Glaciologists have uncovered large valleys in the ocean floor beneath some of the massive glaciers flowing into the Amundsen Sea in West Antarctica. The troughs enable warm, salty water to reach the undersides of glaciers, fueling their increasingly rapid retreat.",225,770,"http://news.agu.org/press-release/researchers-find-seafloor-valleys-below-west-antarctic-glaciers/?utm_source=CPRE&utm_medium=email&utm_campaign=press%20releases&utm_content=17-04%20Amundsen%20Sea%20glaciers&hootPostID=8df34a27403c686f09c478e95b0b9446",13,5.525,0.0654761904761905
"573",572,"NinjaDiscoJesus",1314456936,NA,"no",286255,1485345291,"bbc.com",0,"5q2rt3","yes","low",2689566,148,"Health","Nearly one in 10 British women finds sex painful, according to a study.The survey of nearly 7,000 sexually active women aged 16 to 74, in An International Journal of Obstetrics and Gynaecology, suggests this medical problem - called dyspareunia - is common and affects women of all ages.",240,1348,"http://www.bbc.com/news/health-38729240",13,5.08695652173913,-0.0288461538461538
"574",573,"Wagamaga",1401896229,NA,"no",36563,1485343514,"journals.sagepub.com",0,"5q2o9b","yes","low",1505508,17,"Psychology","A study has indicated severe unethical behavior doesn't necessarily emerge through a gradual process but can result from a sudden ""golden opportunity.""",130,776,"http://journals.sagepub.com/doi/full/10.1177/0956797616682026",11,5.77272727272727,-0.0535714285714286
"575",574,"Vippero",1438850855,NA,"no",3289,1485341944,"eurekalert.org",0,"5q2l4i","yes","low",212302,1,"Computer Science","The combination of CRISPR and analysis of big datasets provides important insights into how the body reacts to a viral attack",105,11,"https://www.eurekalert.org/pub_releases/2017-01/nuos-ubd012417.php",11,5,0.15625
"576",575,"the_phet",1297521165,"reward1","yes",67944,1485340306,"pnas.org",0,"5q2i2t","yes","high",427385,147,"Psychology","People with low alcohol tolerance also have excellent self-control — as a study published Tuesday in PNAS on alcohol-intolerant undergrads points out. Not only are they good at saying no to alcohol, they’re good at saying no to other vices as well.",211,1531,"http://www.pnas.org/content/early/2017/01/23/1610902114",10,4.67441860465116,0.0526315789473684
"577",576,"the_phet",1297521165,"reward1","yes",67944,1485340094,"healthmedicinet.com",0,"5q2hnw","no","low",427385,92,"Social Science","Black Americans tend to lose a parent, other close relatives and spouses at earlier ages than whites, creating a devastating “grief gap,” new research suggests. Studying more than 42,000 racially diverse Americans, it was found that death strikes black families significantly earlier than whites",256,875,"http://healthmedicinet.com/i/early-family-deaths-may-create-grief-gap-for-blacks/",13,5.56818181818182,-0.0119047619047619
"578",577,"the_phet",1297521165,"reward1","yes",67944,1485339766,"pnas.org",0,"5q2h3a","yes","high",427385,13,"Neuroscience","Using 20 years of data sciencists analyzed how jet lag impairs MLB performance. Their results were surprising, and in particular they showed big jet lag effects after eastward travelling, with very limited effects after westward travel.",201,112,"http://www.pnas.org/content/early/2017/01/17/1608847114",11,5.47222222222222,-0.0375
"579",578,"mvea",1148438857,"med   reward3","yes",56749,1485339592,"newscientist.com",0,"5q2gq5","yes","low",5256993,99,"Medicine","Women are more likely to go through menopause early if they started menstruating before their 12th birthday. This is the conclusion of the largest study of its kind, involving 50,000 postmenopausal women in the UK, Australia, Japan and Scandinavia.",210,2030,"https://www.newscientist.com/article/2119117-starting-periods-at-a-young-age-is-linked-to-early-menopause/",14,5.25641025641026,0.0661764705882353
"580",579,"mvea",1148438857,"med   reward3","yes",56749,1485337865,"bbc.com",0,"5q2dcd","yes","low",5256993,14,"Animal Science","Cats are as good as dogs at certain memory tests, suggesting they may be just as smart. A study - involving 49 domestic cats - shows felines can recall memories of pleasant experiences, such as eating a favourite snack. Dogs also show this type of recollection, known as episodic memory.",238,51,"http://www.bbc.com/news/science-environment-38665057",12,4.79166666666667,0.0595238095238095
"581",580,"vilnius2013",1391507165,"bio","yes",22207,1485333070,"acsh.org",0,"5q24pd","yes","low",301481,59,"Animal Science","Fearful of being cheated on, unattractive male wrens spend more time guarding their female mates, while attractive males spend more time cheating with other females.",141,1157,"http://acsh.org/news/2017/01/24/ugly-male-birds-guard-females-sexier-suitors-10765",12,5.52,0.03125
"582",581,"brainstretcher",1390756453,NA,"no",2343,1485332066,"arstechnica.com",0,"5q22vd","yes","low",2025,6,"Neuroscience","During REM sleep, the brain cuts unneeded connections",46,32,"http://arstechnica.com/science/2017/01/rem-sleep-lets-the-brain-cut-and-strengthen-new-connections/",11,5.625,0.0416666666666667
