"","X1","author","author_created_date","author_flair","author_flair_binary","comment_karma","created_utc","domain","gilded","id","image","journal_h_index","link_karma","num_comments","subfield","title","title_len","upvotes","url","max_title_length","mean_title_length","title_sent"
"261",260,"WyattAndrew6985",1416298402,NA,"no",90,1486361914,"nbcnews.com",0,"5scnr4","yes","low",66,5,"Animal Science","This Cyborg Insect Could Bring Big Advances In Medical Care",50,9,"http://www.nbcnews.com/mach/technology/cyborg-insect-could-bring-big-advances-medical-care-n716391",8,5,0.015625
"262",261,"stevethenewsguy",1375296413,NA,"no",531,1486355784,"studyfinds.org",0,"5sc73l","yes","low",9882,178,"Health","Study finds eating two cups of grapes a day may help prevent Alzheimer's",60,710,"https://www.studyfinds.org/study-finds-grapes-alzheimers-disease/",11,4.61538461538461,0.09375
"263",262,"FillsYourNiche",1481217820,"env   reward3","yes",103261,1486330789,"sciencenewsline.com",0,"5sa3vn","no","low",309185,2,"Psychology","Emoticons Help Gauge School Happiness Level in Young Children (between 4 and 12 years of age)",78,16,"http://www.sciencenewsline.com/news/2017020314440031.html",9,4.75,0.147727272727273
"264",263,"NinjaDiscoJesus",1314456936,NA,"no",286255,1486328900,"futurity.org",0,"5s9wyh","yes","low",2689566,6,"Paleontology","Palaeontologists discover a new species of lizard from the late dinosaur era.",66,65,"http://www.futurity.org/magnuviator-ovimonsensis-lizard-skeletons-1343242-2/?utm_source=social&utm_medium=hootsuite&utm_campaign=standard",16,5.41666666666667,0.0535714285714286
"265",264,"Wagamaga",1401896229,NA,"no",36563,1486327324,"eurekalert.org",0,"5s9rkc","yes","low",1505508,18,"Psychology","An insightful new study suggest depression may at times be a blessing in disguise, as it may help us let go of unattainable goals.",107,48,"https://www.eurekalert.org/pub_releases/2017-02/fj-etl020217.php",12,4.375,0.0833333333333333
"266",265,"drewiepoodle",1320210830,"reward10","yes",141280,1486325897,"hopkinsmedicine.org",0,"5s9mt8","yes","low",3416850,240,"Psychology","Study Affirms That Cocaine Makes Users More Likely To Risk Unsafe Sex. Results reinforce need to provide condoms to drug users, researchers say.",122,2212,"http://www.hopkinsmedicine.org/news/media/releases/study_affirms_that_cocaine_makes_users_more_likely_to_risk_unsafe_sex_",11,5.17391304347826,0.0234375
"267",266,"drewiepoodle",1320210830,"reward10","yes",141280,1486318643,"caltech.edu",0,"5s8x54","no","low",3416850,2,"Engineering","A team of engineers and scientists have developed an artificial skin capable of detecting temperature changes using a mechanism similar to the one used by the organ that allows pit vipers to sense their prey.",174,17,"http://www.caltech.edu/news/engineers-create-artificial-skin-feels-temperature-changes-53779",11,4.94285714285714,0.0367647058823529
"268",267,"Phlox_carolina",1482369016,NA,"no",62702,1486315511,"journal.frontiersin.org",0,"5s8lq6","yes","low",11529,8,"Psychology","The Influence of (Dis)belief in Free Will on Immoral Behavior",52,13,"http://journal.frontiersin.org/article/10.3389/fpsyg.2017.00020/full",9,4.54545454545455,0.09375
"269",268,"drewiepoodle",1320210830,"reward10","yes",141280,1486314200,"theguardian.com",0,"5s8gxg","yes","low",3416850,5,"Psychology","'Extinction therapy' could help smokers kick habit, study suggests. Technique aims to help smokers ‘unlearn’ associations that drive addiction by exposing them to triggers, such as footage of people smoking.",182,20,"https://www.theguardian.com/society/2017/feb/03/extinction-therapy-could-help-smokers-kick-habit-study-suggests",12,5.66666666666667,0.0535714285714286
"270",269,"SirT6",1397166648,"cancer     reward13","yes",91843,1486302453,"nejm.org",0,"5s7for","yes","high",285726,8,"Medicine","Cardiovascular disease is the leading cause of death and complications in patients with type 2 diabetes. A new clinical trial reveals once weekly injection of a GLP1 analogue reduces this risk by 26%.",168,38,"http://www.nejm.org/doi/full/10.1056/NEJMoa1607141#t=abstract",14,5,0.0294117647058824
"271",270,"mvea",1148438857,"med   reward3","yes",56749,1486297116,"msutoday.msu.edu",0,"5s73mt","yes","low",5256977,1727,"Psychology","When preschoolers spend time around one another, they tend to take on each others’ personalities, indicates a new study by Michigan State University researchers, which suggests personality is shaped by environment and not just genes.",201,39422,"http://msutoday.msu.edu/news/2017/personality-traits-contagious-among-children/",13,5.54285714285714,0.0982142857142857
"272",271,"nowyouseemenowyoudo2",1468192716,NA,"no",52241,1486287186,"ucl.ac.uk",0,"5s6l2h","yes","low",5127,4,"Medicine","Antibiotics can still kill drug-resistant bacteria if they 'push' hard enough into bacterial cells",85,59,"http://www.ucl.ac.uk/news/news-articles/0117/030217-brute-force-overcome-antibiotic-resistance",11,5.46666666666667,-0.09375
"273",272,"burtzev",1269213033,NA,"no",9427,1486269445,"arch.cam.ac.uk",0,"5s5n64","yes","low",466882,2,"Anthropology","Ethiopian site sheds new light on human behaviour in the Middle and Late Stone Age",68,76,"http://www.arch.cam.ac.uk/ethiopian-site-sheds-new-light-on-human-behaviour-in-the-middle-and-late-stone-age",9,4.53333333333333,0.025
"274",273,"PalpatineSenpai",1468204876,NA,"no",1997,1486245202,"mobile.abc.net.au",0,"5s3g4f","yes","low",15256,1,"Biology","Pores found in 'platypus of microbiology' bacterium push boundaries of evolution - Science News",82,60,"http://mobile.abc.net.au/news/2017-02-02/gemmata-obscuriglobus-bacterium-pushes-boundaries-of-evolution/8228876?pfmredir=sm",12,6.07692307692308,0.015625
"275",274,"mvea",1148438857,"med   reward3","yes",56749,1486242297,"bmj.com",0,"5s33uy","no","low",5256977,40,"Medicine","Patients treated by international graduates had lower mortality than patients cared for by US graduates, concludes a study published in the BMJ with a study sample of 1,215,490 admissions to hospital treated by 44,227 general internists.",202,195,"http://www.bmj.com/content/356/bmj.j273",13,5.55555555555556,-0.0384615384615385
"276",275,"leo_szilard",1485465582,NA,"no",598,1486241191,"onlinelibrary.wiley.com",0,"5s2zb1","yes","low",912,7,"Chemistry","Flipping the switch on ammonia production: Process generates electricity instead of consuming energy.",89,45,"http://onlinelibrary.wiley.com/doi/10.1002/anie.201612500/abstract;jsessionid=063342B2C659F3BB1F79B498D502AF79.f04t04",11,6.69230769230769,0
"277",276,"moleculardreams",1462811834,NA,"no",4,1486225779,"dx.doi.org",0,"5s1hzm","yes","low",34,12,"Chemistry","Irreversible Conversion of a Water–Ethanol Solution into an Organized Two-Dimensional Network of Alternating Supramolecular Units in a Hydrophobic Zeolite under Pressure",151,17,"http://dx.doi.org/10.1002/anie.201610949",14,6.39130434782609,-0.0892857142857143
"278",277,"speckz",1149630872,NA,"no",26705,1486224330,"jamanetwork.com",0,"5s1dd1","yes","high",4159579,3,"Cancer","A substantial cancer burden may be prevented through lifestyle modification. Primary prevention should remain a priority for cancer control.",122,46,"https://jamanetwork.com/journals/jamaoncology/article-abstract/2522371",12,6.31578947368421,-0.0833333333333333
"279",278,"drewiepoodle",1320210830,"reward10","yes",141280,1486216991,"blogs.plos.org",0,"5s0plz","yes","low",3416850,3267,"Environment","Wild invasive pigs are wreaking havoc on North American ecosystems, a new report warns.",74,20050,"http://blogs.plos.org/ecology/2017/02/01/invasive-wild-pigs-leave-a-swath-of-destruction-across-u-s-and-they-keep-spreading/",10,5.14285714285714,-0.0178571428571429
"280",279,"Zoxphyl",1481483059,NA,"no",0,1486211072,"ncbi.nlm.nih.gov",0,"5s0a2h","yes","low",34,1,"Paleontology","South African fossils show that mammal-ancestors exhibited parental care and lived in aggregations of mixed-aged individuals",109,35,"https://www.ncbi.nlm.nih.gov/pmc/articles/PMC5228509/",12,5.94444444444444,0.046875
"281",280,"H8-M8",1469819442,NA,"no",317,1486195255,"nature.com",0,"5rzi19","no","high",8187,1,"Earth Science","Elevated atmospheric escape of atomic hydrogen from Mars induced by high-altitude water",76,15,"http://www.nature.com/ngeo/journal/vaop/ncurrent/full/ngeo2887.html",11,5.76923076923077,-0.1
"282",281,"H8-M8",1469819442,NA,"no",317,1486194428,"pubs.acs.org",0,"5rzgkv","yes","high",8187,3,"Chemistry","Enhanced Resolution of Chiral Amino Acids with Capillary Electrophoresis for Biosignature Detection in Extraterrestrial Samples",113,6,"http://pubs.acs.org/doi/abs/10.1021/acs.analchem.6b04338",16,7.53333333333333,0.0535714285714286
"283",282,"operator139",1447574645,NA,"no",3566,1486192402,"medicalnewstoday.com",0,"5rzcy1","yes","low",25938,27,"Neuroscience","Alcohol dependency soon to be permanently solved by inactivating neurons",63,163,"http://www.medicalnewstoday.com/articles/312817.php",12,6.3,0.025
"284",283,"mvea",1148438857,"med   reward3","yes",56749,1486185594,"independent.co.uk",0,"5ryyy6","yes","low",5256978,1,"Medicine","Antibiotic resistance: Superbugs can be killed by modifying existing drugs, scientists discover - by enhancing the mechanical forces for antibiotic action.",135,42,"http://www.independent.co.uk/news/science/superbugs-kill-cured-existing-drugs-antibiotic-resistance-new-way-scientists-ucl-a7561686.html",10,6.55,-0.05
"285",284,"shiruken",1283195097,"eng     rewardstar","yes",145633,1486170597,"newsroom.ucla.edu",0,"5rxvrr","yes","low",306941,19,"Psychology","Political affiliation can predict how people will react to false information about hazards: Social conservatives were significantly more likely liberals to find misinformation about threats credible",173,57,"http://newsroom.ucla.edu/releases/political-affiliation-can-predict-how-people-will-react-to-false-information-about-threats",14,6.61538461538461,0.0104166666666667
"286",285,"drewiepoodle",1320210830,"reward10","yes",141280,1486170363,"niaid.nih.gov",0,"5rxv29","no","low",3416850,6,"Medicine","New clinical trial results provide evidence that high-dose immunosuppressive therapy followed by transplantation of a person's own blood-forming stem cells can induce sustained remission of relapsing-remitting multiple sclerosis.",202,228,"https://www.niaid.nih.gov/news-events/stem-cell-transplants-may-induce-long-term-remission-multiple-sclerosis",17,6.38709677419355,-0.0119047619047619
"287",286,"bboyjkang",1257919832,NA,"no",13344,1486163644,"sciencedirect.com",0,"5rxa3p","yes","low",18816,3,"Chemistry","Study of a laboratory-scaled new method for the accelerated continuous ageing of wine spirits by applying ultrasound energy",106,4,"http://www.sciencedirect.com/science/article/pii/S1350417716304187",11,5.52631578947368,0.0208333333333333
"288",287,"FillsYourNiche",1481217820,"env   reward3","yes",103261,1486156764,"eurekalert.org",0,"5rwn4b","yes","low",309185,1,"Animal Science","Predator threat boosts friendships among Trinidadian guppies. Researchers discovered the fish developed stronger and more stable social bonds when they thought predators were in the area.",162,14,"https://www.eurekalert.org/pub_releases/2017-02/uoe-ptb013017.php",11,6.15384615384615,0.0125
"289",288,"BocceBaller42",1395420514,NA,"no",1559,1486156371,"usu.edu",0,"5rwlr2","yes","low",72047,515,"Biology","Putting up fences around the world's largest living organism (the Aspen clone named Pando) is helping to extend its life",101,11370,"http://www.usu.edu/today/index.cfm?id=56472",8,4.95,-0.0138888888888889
"290",289,"drewiepoodle",1320210830,"reward10","yes",141280,1486155807,"snm.ku.dk",0,"5rwjql","yes","low",3416850,2,"Geology","New research undermines the supposed correlation between an ancient asteroid collision and an uptick in biodiversity on Earth.",109,38,"http://snm.ku.dk/english/news/all_news/2017/2017.1/myth-busted-no-link-between-gigantic-asteroid-break-up-and-rise-in-biodiversity/",12,6,0.0625
"291",290,"drewiepoodle",1320210830,"reward10","yes",141280,1486147340,"helsinki.fi",0,"5rvp4j","yes","low",3416850,58,"Psychology","Human empathy can even extend to dogs: empathetic people interpret dogs’ facial expressions more intensely.",95,2818,"https://www.helsinki.fi/en/news/empathetic-people-experience-dogs-expressions-more-strongly",11,6,-0.1
"292",291,"burtzev",1269213033,NA,"no",9427,1486141932,"online.liebertpub.com",0,"5rv56q","yes","low",466882,1,"Astronomy","Star Masses and Star-Planet Distances for Earth-like Habitability",58,14,"http://online.liebertpub.com/doi/full/10.1089/ast.2016.1518",12,5.6,0.0714285714285714
"293",292,"edwinksl",1175053192,"eng","yes",8940,1486141430,"news.northeastern.edu",0,"5rv3c9","yes","low",80198,29,"Social Science","Study: Despite Trump's win, polling is a strong elections predictor globally",66,42,"https://news.northeastern.edu/2017/02/study-despite-trumps-win-polling-is-a-strong-elections-predictor-globally/",9,5.81818181818182,0
"294",293,"NinjaDiscoJesus",1314456936,NA,"no",286255,1486133884,"iq.hse.ru",0,"5rucnw","yes","low",2689566,4,"Social Science","One’s Ability to Make Money Develops Before Birth - Researchers from the Higher School of Economics have shown how the level of perinatal testosterone, the sex hormone, impacts a person’s earnings in life.",177,6,"https://iq.hse.ru/en/news/201344752.html",12,5.28125,0.1
"295",294,"NinjaDiscoJesus",1314456936,NA,"no",286255,1486133734,"uni-jena.de",0,"5ruc7u","yes","low",2689566,8,"Psychology","Easier to let go – Patients with depression find it easier to abandon unattainable goals, psychological study shows.",101,30,"https://www.uni-jena.de/en/Research+News/FM170202_depression_disengagement.html",13,5.64705882352941,-0.291666666666667
"296",295,"pnewell",1340897842,"env","yes",100006,1486132858,"theguardian.com",0,"5ru9i0","yes","low",3313271,3,"Environment","Rising carbon emissions could kill off vital corals by 2100, study warns | Destructive seaweeds found in reefs worldwide will grow more poisonous and eventually take over in the fight for space",162,11,"https://www.theguardian.com/environment/2017/feb/03/rising-carbon-emissions-could-kill-off-vital-corals-by-2100-study-warns",11,5.16129032258065,-0.0208333333333333
"297",296,"mikepetroff",1293030594,NA,"no",7945,1486131027,"news.harvard.edu",0,"5ru42a","yes","low",112920,68,"Psychology","Psychopaths are not incapable of feeling emotions, like regret and disappointment, but what they cannot do is make accurate predictions about the outcomes of their choices, according to a new Harvard study",174,1807,"http://news.harvard.edu/gazette/story/2017/02/a-revised-portrait-of-psychopaths/",14,5.34375,-0.0454545454545455
"298",297,"lamaksha77",1292172520,NA,"no",56867,1486128913,"sciencemag.org",0,"5rty0n","yes","high",1107,6,"Medicine","Modified RNA analogs created by a Boston startup to vaccinate cells against cancer and infectious diseases are in Phase I clinical trials",116,53,"http://www.sciencemag.org/news/2017/02/mysterious-2-billion-biotech-revealing-secrets-behind-its-new-drugs-and-vaccines",10,5.27272727272727,-0.0729166666666667
"299",298,"learntruth",1390580170,NA,"no",355,1486126130,"housely.com",0,"5rtqhn","yes","low",69380,8,"Health","Only one serving of most soft drinks sold in the UK contains more sugar than what you should be consuming in a day, according to a recent study published in BMJ Open.",135,45,"http://housely.com/most-soft-drinks-have-more-sugar-than-daily-global-guidelines-study-finds/",9,4.15625,-0.0178571428571429
"300",299,"Cancer_Reproduction",1486089600,"cancer AMA","yes",12,1486124629,"self.science",0,"5rtmt5","no","low",352,55,"Reproducibility Project AMA","Science AMA Series: We’re the Reproducibility Project: Cancer Biology team. AUA!",72,382,"https://www.reddit.com/r/science/comments/5rtmt5/science_ama_series_were_the_reproducibility/",15,6,0.015625
"301",300,"Tom_Crowther",1486100142,"env AMA","yes",964,1486123787,"self.science",0,"5rtksv","no","low",4362,741,"Climate Science AMA","Science AMA Series: I'm Tom Crowther, a Scientist from Yale University and the Netherlands Institute of Ecology. My research shows how human activity affects ecosystems worldwide, leading to global climate change. AMA!",187,7727,"https://www.reddit.com/r/science/comments/5rtksv/science_ama_series_im_tom_crowther_a_scientist/",11,5.65625,-0.01875
"302",301,"KermitTheSnail",1470179956,NA,"no",25967,1486121129,"medicalxpress.com",0,"5rteml","no","low",964404,179,"Health","Thirdhand smoke, defined as the sticky residue left behind by tobacco smoke, leads to biological effects on weight and cell development that could be damaging to one's health",147,1922,"https://medicalxpress.com/news/2017-02-thirdhand-affects-weight-blood-cell.html",11,5.17857142857143,0
"303",302,"sivribiber",1469036406,NA,"no",46258,1486120960,"medicalxpress.com",0,"5rte7j","no","low",1415018,82,"Neuroscience","New research shows that those who are enraged by sounds such as chewing, breathing, or pen clicking have a condition called misophonia, which results from abnormality of the brain's emotional control mechanism",178,349,"https://medicalxpress.com/news/2017-02-wired-enraging-noises-brain-overdrive.html",11,5.46875,0.0576923076923077
"304",303,"Wagamaga",1401896229,NA,"no",36563,1486116042,"medicalnewstoday.com",0,"5rt320","yes","low",1505508,13,"Health","World-first trial shows improving diet can treat major depression. In the study, adults with major depressive disorder were recruited and randomly assigned to receive either social support, which is known to be helpful for people with depression, or support from a clinical dietitian",241,253,"http://www.medicalnewstoday.com/releases/315630.php",10,5.36363636363636,0.0364583333333333
"305",304,"burtzev",1269213033,NA,"no",9427,1486115360,"advances.sciencemag.org",0,"5rt1qy","no","high",466883,2,"Biology","Resource tracking within and across continents in long-distance bird migrants",68,12,"http://advances.sciencemag.org/content/3/1/e1601360.full",10,6.09090909090909,-0.025
"306",305,"norristh",1365398898,NA,"no",442,1486109823,"ibtimes.com",0,"5rsqsh","yes","low",42825,1,"Environment","Large Ice Age Mammals Help Us Understand The Ongoing Biodiversity Loss",60,5,"http://www.ibtimes.com/what-can-large-ice-age-mammals-tell-us-about-ongoing-biodiversity-loss-lot-study-says-2473749",12,5.45454545454545,0.102272727272727
"307",306,"Etroyer",1432062247,"bio","yes",3320,1486106908,"peerj.com",0,"5rsl77","yes","low",2601,4,"Animal Science","Boxer crabs induce asexual reproduction of their associated sea anemones by splitting and intraspecific theft",95,42,"https://peerj.com/articles/2954/",13,6.33333333333333,-0.0694444444444444
"308",307,"GeoGeoGeoGeo",1326679762,"reward1","yes",8109,1486086282,"eos.org",0,"5rr397","yes","low",96150,1,"Geology","Deep Drilling Reveals Puzzling History of Campi Flegrei Caldera: Results show that caldera collapse attributed to a super eruption almost 40,000 years ago was smaller than what scientists expected.",169,27,"https://eos.org/research-spotlights/deep-drilling-reveals-puzzling-history-of-campi-flegrei-caldera",10,5.75862068965517,-0.00892857142857143
"309",308,"drewiepoodle",1320210830,"reward10","yes",141280,1486079878,"today.duke.edu",0,"5rqhz6","yes","low",3416850,2,"Animal Science","Results of a mathematical modeling study suggest that romantic attention in the animal world, by itself, is not enough to give attractive females an evolutionary edge over their plainer counterparts -- even when their good looks help them snag superior mates.",219,33,"https://today.duke.edu/2017/01/model-shows-female-beauty-isn%E2%80%99t-just-sex-appeal",12,5.35,0.166666666666667
"310",309,"adalhaidis",1384586239,NA,"no",7658,1486079647,"cell.com",0,"5rqh5q","no","high",940,0,"Anthropology","The Neolithic Transition in the Baltic Was Not Driven by Admixture with Early European Farmers",80,5,"http://www.cell.com/current-biology/fulltext/S0960-9822(16)31542-1",10,5.33333333333333,-0.0416666666666667
"311",310,"jsalsman",1340588579,NA,"no",33946,1486079546,"nasa.gov",0,"5rqgtf","yes","low",95208,7,"Astronomy","NASA's Fermi telescope discovers the furthest and brightest blazars yet",62,44,"https://www.nasa.gov/feature/goddard/2017/nasas-fermi-discovers-the-most-extreme-blazars-yet",9,6.2,0
"312",311,"DoremusJessup",1318441120,NA,"no",16240,1486077865,"bbc.com",0,"5rqaze","yes","low",1945735,0,"Astronomy","Scientists record breach in magnetic field",37,6,"http://www.bbc.com/news/science-environment-38849147",10,6.16666666666667,0
"313",312,"ElectiveAffinities",1413475496,NA,"no",139,1486077629,"popsci.com",0,"5rqa50","yes","low",11249,1,"Health","Fast food packaging may contain dangerous chemicals, study finds.",57,0,"http://www.popsci.com/fast-food-may-contain-hidden-danger-its-packaging",9,6.11111111111111,-0.125
"314",313,"mvea",1148438857,"med   reward3","yes",56749,1486076289,"arstechnica.com",0,"5rq5ih","yes","low",5256979,585,"Neuroscience","Infants as young as six-months old grasp the complex interactions between a bully, a victim, and an intervening protector - and they root for the brave protector, researchers report this week in Nature Human Behaviour.",184,24733,"https://arstechnica.com/science/2017/02/before-babies-even-babble-or-roll-theyre-primed-to-be-superhero-fans/",12,5.08571428571429,0.15625
"315",314,"drewiepoodle",1320210830,"reward10","yes",141280,1486075663,"news.cornell.edu",0,"5rq3cs","yes","low",3416850,2,"Environment","Engineers develop new technique using high-resolution mass spectrometry to assess 18 water samples collected from New York state waterways. The chemicals found in the samples included pesticides, personal care products, and pharmaceuticals like anticonvulsants, antihistamines, and muscle relaxants.",262,33,"http://news.cornell.edu/stories/2017/01/new-technique-ids-micropollutants-new-york-waterways",15,6.53846153846154,0.0511363636363636
"316",315,"GeoGeoGeoGeo",1326679762,"reward1","yes",8109,1486074317,"wis-wander.weizmann.ac.il",0,"5rpyjz","yes","low",96150,1,"Geology","A key role for green rust in the Precambrian oceans and the genesis of iron formations: Laboratory experiments show that green rust readily forms in early seawater-analogue solutions, and that it ages into minerals observed in iron formations.",206,0,"http://wis-wander.weizmann.ac.il/chemistry/rusty-green-early-ocean",11,5.17948717948718,0.0208333333333333
"317",316,"Silverseren",1384805506,NA,"no",51638,1486072014,"leibniz-gemeinschaft.de",0,"5rppyh","no","low",65786,3,"Biology","Study finds that horizontal transfer of nuclear DNA between vascular plants is fairly common",79,6,"http://www.leibniz-gemeinschaft.de/medien/aktuelles/news-details/article/horizontaler_gentransfer_100002855/",10,5.64285714285714,-0.015625
"318",317,"drewiepoodle",1320210830,"reward10","yes",141280,1486071433,"uncnews.unc.edu",0,"5rpnpp","no","low",3416850,5,"Cancer","Study describes how human stem cells, made from human skin cells, can hunt down and kill human brain cancer, a critical step toward clinical trials—and real treatment.",143,137,"http://uncnews.unc.edu/2017/02/01/revolutionary-approach-treating-glioblastoma-works-human-cells/",9,4.85714285714286,-0.0661764705882353
"319",318,"TR_54",1434337488,NA,"no",434,1486067321,"eurekalert.org",0,"5rp8og","yes","low",37895,29,"Biology","If you can't get to sleep, going camping for a weekend can reset your biological clock",71,456,"https://www.eurekalert.org/pub_releases/2017-02/uoca-cgt020217.php",10,4.375,-0.0625
"320",319,"sufficing",1438121758,NA,"no",11727,1486065502,"science.sciencemag.org",0,"5rp1wr","yes","high",47372,2,"Social Science","Study suggests polling is still best predictor of election outcomes",58,4,"http://science.sciencemag.org/content/355/6324/515.full",9,5.8,0.1875
"321",320,"avogadros_number",1368151675,"reward2","yes",12643,1486064192,"nytimes.com",0,"5rox09","no","low",255394,3,"Neuroscience","A pair of studies offer evidence suggesting that we sleep to forget some of the things we learn each day.",86,35,"https://www.nytimes.com/2017/02/02/science/sleep-memory-brain-forgetting.html?smid=tw-nytimesscience&smtyp=cur&_r=0",10,4.25,0.0375
"322",321,"DoremusJessup",1318441120,NA,"no",16240,1486063362,"blogs.scientificamerican.com",0,"5rou4r","no","low",1945735,3,"Environment","Scientists Develop a ""Better Way"" to Produce Renewable Hydrogen: Scientists at the Department of Energy's National Renewable Energy Laboratory have developed a “better way” to make hydrogen using renewable energy",187,10,"https://blogs.scientificamerican.com/plugged-in/scientists-develop-a-better-way-to-produce-renewable-hydrogen/?wt.mc=SA_Reddit-Share",10,5.93333333333333,0.0921052631578947
"323",322,"Wagamaga",1401896229,NA,"no",36563,1486062500,"huffingtonpost.com",0,"5roqyp","yes","low",1505508,13,"Psychology","Your Personality Is Linked To The Actual Shape Of Your Brain. Traits like neuroticism and open-mindedness are linked with differences in brain thickness and volume.",140,54,"http://www.huffingtonpost.com/entry/personality-traits-brain-shape_us_5888d429e4b098c0bba7e6a5?section=us_science",11,5.26923076923077,-0.0625
"324",323,"TR_54",1434337488,NA,"no",434,1486062365,"newsweek.com",0,"5roqi8","yes","low",37895,14,"Neuroscience","Brain synapses grow during the day and shrink by ~20% during sleep, helping reset neurons, two new Science studies show",100,229,"http://www.newsweek.com/brain-synapses-shrink-during-sleep-making-way-new-information-551871",8,4.8,0.0340909090909091
"325",324,"erusso16",1370013548,NA,"no",15,1486061949,"blog.pnas.org",0,"5roota","yes","high",5981,3,"Biology","Phosphorylation has surprisingly big role in circadian clocks",54,6,"http://blog.pnas.org/2017/02/journal-club-phosphorylation-has-surprisingly-big-role-in-control-of-circadian-clocks/",15,6.75,0.0416666666666667
