"","X1","author","author_created_date","author_flair","author_flair_binary","comment_karma","created_utc","domain","gilded","id","image","journal_h_index","link_karma","num_comments","subfield","title","title_len","upvotes","url","max_title_length","mean_title_length","title_sent"
"1",0,"NowSummoning",1331407865,NA,"no",328,1483597268,"cambridge.org",0,"5m4ssx","yes","low",171,8,"Neuroscience","Adolescent cannabis use, change in neurocognitive function, and high-school graduation: A longitudinal study from early adolescence to young adulthood | Development and Psychopathology",162,8,"https://www.cambridge.org/core/journals/development-and-psychopathology/article/div-classtitleadolescent-cannabis-use-change-in-neurocognitive-function-and-high-school-graduation-a-longitudinal-study-from-early-adolescence-to-young-adulthooddiv/409F2E21BE7E216535404A4BF9EB1038",15,6.82608695652174,0.00735294117647059
"2",1,"ManiaforBeatles",1470027722,NA,"no",22750,1483588552,"bbc.com",0,"5m443j","yes","low",1314953,14,"Health","People who live near major roads have higher rates of dementia, research that followed nearly 2m people in Canada over 11 years suggests. The researchers say air pollution or noisy traffic could be contributing to the brain's decline.",197,146,"http://www.bbc.com/news/health-38506735",12,5.10526315789474,0.0227272727272727
"3",2,"gazil9",1460077198,NA,"no",787,1483587877,"thelancet.com",0,"5m41x6","no","high",85216,7,"Health","Living close to heavy traffic was associated with a higher incidence of dementia",68,133,"http://www.thelancet.com/journals/lancet/article/PIIS0140-6736(16)32399-6/fulltext",10,5.23076923076923,-0.0178571428571429
"4",3,"drewiepoodle",1320210830,"reward10","yes",141280,1483582507,"bbc.com",0,"5m3l9k","yes","low",3416850,17,"Astronomy","Researchers have concluded that the source of strange cosmic flashes of light called Fast Radio Bursts, first detected in 2007 and were for years too elusive to accurately track, originate from a place they didn't expect -- a small galaxy beyond the borders of the Milky Way.",229,85,"http://www.bbc.com/news/science-environment-38502607",11,4.8695652173913,-0.0125
"5",4,"SteRoPo",1379113773,NA,"no",1327,1483581531,"peerj.com",0,"5m3i4z","yes","low",40954,3,"Health","Pre- versus post-exercise protein intake has similar effects on muscular adaptations",74,27,"https://peerj.com/articles/2825/",11,6,0
"6",5,"ZechariaSitchin",1404817474,NA,"no",761,1483580009,"newscientist.com",0,"5m3db8","yes","low",7756,28,"Neuroscience","Human brains naturally shrink with age. But a study that followed 401 people in their 70s found that the brains of those who adhered more closely to a Mediterranean-style diet shrank significantly less over a period of three years.",193,255,"https://www.newscientist.com/article/2116971-brain-shrinks-less-in-older-people-who-eat-mediterranean-diet/",13,4.75,-0.0166666666666667
"7",6,"americ",1257843533,NA,"no",7653,1483573786,"blogs.sciencemag.org",0,"5m2si9","yes","high",24105,1,"Chemistry","What This Here Compound Needs Is Some Hydrogen Peroxide",47,10,"http://blogs.sciencemag.org/pipeline/archives/2016/09/27/what-this-here-compound-needs-is-some-hydrogen-peroxide",8,5.22222222222222,0.0277777777777778
"8",7,"ninthinning01",1408990419,NA,"no",3275,1483571208,"advances.sciencemag.org",0,"5m2jc4","yes","high",65543,1,"Earth Science","Overlooked possibility of a collapsed Atlantic Meridional Overturning Circulation in warming climate | Science Advances",105,28,"http://advances.sciencemag.org/content/3/1/e1601666.full",11,7.42857142857143,-0.046875
"9",8,"americ",1257843533,NA,"no",7653,1483570111,"nejm.org",0,"5m2fex","yes","high",24105,0,"Epidemiology","Epidemiology of Acute Kidney Injury in Critically Ill Children and Young Adults — NEJM",75,1,"http://www.nejm.org/doi/full/10.1056/NEJMoa1611391",12,5.53846153846154,-0.203125
"10",9,"GeoGeoGeoGeo",1326679762,"reward1","yes",8109,1483567717,"leeds.ac.uk",0,"5m26ua","yes","low",96150,1,"Geology","New study estimates frequency of volcanic ash clouds over northern Europe. Comparing Icelandic and European records of volcanic ash fallout over last 1000 years, the researchers estimate the average return interval for ash fallout over northern Europe to be 44±7 years.",230,5,"http://www.leeds.ac.uk/news/article/3964/new_study_estimates_frequency_of_volcanic_eruptions",11,5.35714285714286,0.0185185185185185
"11",10,"fleker2",1391405544,NA,"no",17586,1483567024,"stm.sciencemag.org",0,"5m248z","yes","high",10781,1,"Biology","Skin substitute treats leg ulcers by letting the body think it's a normal wound",66,70,"http://stm.sciencemag.org/content/9/371/eaaf8611",10,4.71428571428571,-0.015625
"12",11,"Wagamaga",1401896229,NA,"no",36563,1483566954,"medicalnewstoday.com",0,"5m23z4","yes","low",1505508,1,"Health","Researchers from the University College London have found the longer an individual reports enjoying life, the lower their risk of death.",116,12,"http://www.medicalnewstoday.com/articles/314711.php",11,5.42857142857143,-0.0416666666666667
"13",12,"drewiepoodle",1320210830,"reward10","yes",141280,1483566443,"upi.com",0,"5m2246","yes","low",3416850,1,"Environment","Researchers calculated the percentage of threat to a vulnerable or endangered species caused by U.S. consumption of goods produced in the species' native country. Their calculations yielded threat hot spots.",178,5,"http://www.upi.com/Science_News/2017/01/04/Scientists-map-effects-of-consumption-on-endangered-species/1131483540144/?spt=sec&or=sn",12,5.8,-0.0808823529411765
"14",13,"astronemma",1378756526,NA,"no",1287,1483564532,"nasa.gov",0,"5m1v1b","yes","low",2865,4,"Geology","Scientists Offer Sharper Insight into Pluto’s Bladed Terrain",55,8,"https://www.nasa.gov/feature/scientists-offer-sharper-insight-into-pluto-s-bladed-terrain/",10,6.625,0.075
"15",14,"mvea",1148438857,"med   reward3","yes",56750,1483560256,"mcgill.ca",0,"5m1erj","no","low",5257073,12,"Neuroscience","Lack of joy from music linked to brain disconnection between cortical regions responsible for processing sound and subcortical regions related to reward, a condition called specific musical anhedonia, which affects three-to-five per cent of the population.",221,29,"https://www.mcgill.ca/newsroom/channels/news/lack-joy-music-linked-brain-disconnection-264912",13,5.68421052631579,0.09375
"16",15,"FillsYourNiche",1481217820,"env   reward3","yes",103261,1483559386,"eurekalert.org",0,"5m1bfc","yes","low",309203,1,"Animal Science","Suburban development is forcing some songbirds to divorce, leave and miss their best chances for successful reproduction. As forested areas increasingly are converted to suburbs, birds that live on the edge of our urban footprint must find new places to build their nests, breed and raise fledglings.",254,9,"https://www.eurekalert.org/pub_releases/2017-01/uow-sdf010317.php",12,5.29787234042553,0.0738636363636364
"17",16,"ionised",1313880141,NA,"no",238496,1483559138,"sciencenews.org",0,"5m1agc","yes","low",368618,8,"Chemistry","Carbon can exceed four-bond limit | Chemists confirm link to six other atoms in unusual molecule",81,185,"https://www.sciencenews.org/article/carbon-can-exceed-four-bond-limit",8,4.9375,-0.078125
"18",17,"prodigies2016",1455277795,NA,"no",4714,1483556838,"researchgate.net",0,"5m11tu","yes","low",108218,1382,"Environment","New study confirms that global warming never “paused” and has in fact continued to rise unabated for the last 45 years.",103,19807,"https://www.researchgate.net/blog/post/there-was-no-global-warming-hiatus",9,4.57142857142857,0.0125
"19",18,"DarthHobbitJus",1483122335,NA,"no",44,1483555245,"news.nationalgeographic.com",0,"5m0vpg","yes","low",285,2,"Environment","Maps Reveal How Global Consumption Hurts Wildlife",43,22,"http://news.nationalgeographic.com/2017/01/maps-reveal-how-global-consumption-hurts-wildlife/",11,6.14285714285714,-0.0625
"20",19,"vmjaggard99",1458917405,"natgeo two","yes",3709,1483553254,"news.nationalgeographic.com",0,"5m0o9w","yes","low",17686,1,"Astronomy","Astronomers have pinpointed the source of a repeating fast radio burst, FRB 121102, finding that it is coming from a dwarf galaxy 3 billion light-years away. The result offers clues to what kinds of cosmic events are generating FRBs.",195,15,"http://news.nationalgeographic.com/2017/01/fast-radio-bursts-galaxy-frb-121102-black-hole-space-science/",11,4.75,0
"21",20,"StuartRFKing",1462369975,NA,"no",123,1483551430,"elifesciences.org",0,"5m0hgz","yes","low",10561,1,"Biology","Ants transfer chemical cues, growth proteins and hormones mouth-to-mouth in saliva.",73,4,"https://elifesciences.org/content/5/e20375",8,5.30769230769231,0.0625
"22",21,"Smilefriend",1249913273,NA,"no",1250,1483548373,"medicalxpress.com",0,"5m05zd","yes","low",90625,25,"Cancer","Promising new drug stops spread of melanoma by 90 percent",48,204,"http://medicalxpress.com/news/2017-01-drug-melanoma-percent.html",9,4.8,0.140625
"23",22,"TheScientistMagazine",1479409508,"journ two","yes",622,1483539803,"the-scientist.com",0,"5lzd2f","yes","low",33794,694,"Health","Children born to obese parents are more likely to fail developmental tests for motor skills, social competence, or cognitive problem-solving.",122,14046,"http://www.the-scientist.com/?articles.view/articleNo/47921/title/Study--Toddlers-of-Obese-Parents-More-Susceptible-to-Developmental-Delays/",13,5.61904761904762,0.00961538461538462
"24",23,"Quiglius",1451834580,"reward1","yes",2759,1483539158,"digitaltrends.com",0,"5lzb3g","yes","low",661769,1,"Neuroscience","The way artists paint could be an early indicator of neurological diseases",63,9,"http://www.digitaltrends.com/cool-tech/paintstrokes-predict-disease/",12,5.25,0.0416666666666667
"25",24,"SirT6",1397166648,"cancer     reward13","yes",91844,1483537790,"biosciencetechnology.com",0,"5lz76m","yes","low",285726,3,"Biology","Sequencing 50,000+ human exomes, and pairing the data with electronic health records reveals that participants had on average 21 alleles with loss of function mutations, and ~3.5% of participants had mutations that were likely to be clinically relevant.",216,254,"http://www.biosciencetechnology.com/news/2016/12/analysis-50000-genomes-reveals-detrimental-mutations",12,5.52631578947368,0.104166666666667
"26",25,"uoehtam",1325671847,"neuro","yes",171,1483537386,"elifesciences.org",0,"5lz62e","yes","low",1049,0,"Biology","Harbouring public good mutants within a pathogen population can increase both fitness and virulence",86,4,"https://elifesciences.org/content/5/e18678",10,6.14285714285714,0.232142857142857
"27",26,"mvea",1148438857,"med   reward3","yes",56750,1483535161,"chla.org",0,"5lz00h","yes","low",5257073,23,"Neuroscience","Stuttering is linked to reduced blood flow in the area of brain associated with language, with more severe stuttering associated with even greater reductions in blood flow to this region, finds researchers at Children’s Hospital Los Angeles.",207,326,"http://www.chla.org/press-release/stuttering-linked-reduced-blood-flow-area-brain-associated-language",11,5.45945945945946,-0.0333333333333333
"28",27,"PLOSScienceWednesday",1430249049,"AMA bio reward20","yes",14082,1483534383,"self.science",0,"5lyxxu","yes","low",115710,46,"Brain Aging AMA","PLOS Science Wednesday: Hi Reddit, we’re Ben and Liz and we found age substantially impacts cognitive processing, indicating our method is useful for examining individual age-related differences in brain function – Ask Us Anything!",202,390,"https://www.reddit.com/r/science/comments/5lyxxu/plos_science_wednesday_hi_reddit_were_ben_and_liz/",13,5.64705882352941,0.025
"29",28,"Prof_Saiful_Islam",1483401607,"chem AMA","yes",408,1483533808,"self.science",0,"5lywl3","no","low",2483,236,"Materials and Energy Science AMA","Science AMA Series: I’m Saiful Islam, a materials chemist working on lithium and sodium batteries, solid oxide fuel cells and solar cells. I also presented the 2016 Royal Institution Christmas Lectures called ‘Supercharged: Fuelling the Future’ AMA!",219,3023,"https://www.reddit.com/r/science/comments/5lywl3/science_ama_series_im_saiful_islam_a_materials/",12,5.54054054054054,0.03
"30",29,"NowSummoning",1331407865,NA,"no",328,1483528052,"cambridge.org",0,"5lyjq3","yes","low",171,4,"Neuroscience","Adolescent cannabis use, change in neurocognitive function, and high-school graduation: A longitudinal study from early adolescence to young adulthood | Development and Psychopathology",162,10,"https://www.cambridge.org/core/journals/development-and-psychopathology/article/div-classtitleadolescent-cannabis-use-change-in-neurocognitive-function-and-high-school-graduation-a-longitudinal-study-from-early-adolescence-to-young-adulthooddiv/409F2E21BE7E216535404A4BF9EB1038",15,6.82608695652174,0.00735294117647059
"31",30,"Bloomsey",1432194539,NA,"no",3252,1483526730,"urmc.rochester.edu",0,"5lyh1u","yes","low",229337,6,"Biology","Researchers have developed a new imaging technique that could revolutionize how eye health and disease are assessed. The group is first to be able to make out individual cells at the back of the eye that are implicated in vision loss in diseases like glaucoma.",216,470,"https://www.urmc.rochester.edu/news/story/4694/a-closer-look-at-the-eye-researchers-develop-new-retinal-imaging-technique.aspx",13,4.75555555555556,0.075
"32",31,"Bloomsey",1432194539,NA,"no",3252,1483526655,"today.duke.edu",0,"5lygvn","yes","low",229337,8,"Engineering","Nanowire “Inks” Enable Paper-Based Printable Electronics",55,179,"https://today.duke.edu/2017/01/nanowire-inks-enable-paper-based-printable-electronics",11,6.85714285714286,0.125
"33",32,"Wagamaga",1401896229,NA,"no",36563,1483523925,"latimes.com",0,"5lyb9z","yes","low",1505508,32,"Social Science","New research finds that, given the number of U.S. fatalities linked to firearms, public health research on them is very underpowered.",113,42,"http://www.latimes.com/science/sciencenow/la-sci-sn-gun-violence-research-20170103-story.html",12,5.19047619047619,0.0125
"34",33,"vilnius2013",1391507165,"bio","yes",22207,1483522835,"aalto.fi",0,"5ly93e","no","low",301481,4,"Nanoscience","Researchers have created a tiny laser using silver nanoparticles.",57,28,"http://www.aalto.fi/en/current/news/2017-01-03/",13,6.22222222222222,0
"35",34,"leftofmarx",1263189510,NA,"no",43332,1483513458,"nature.com",0,"5lxpd7","yes","high",15799,3,"Biology","An integrated multi-omics analysis of the NK603 Roundup-tolerant GM maize reveals metabolism disturbances caused by the transformation process",125,27,"http://www.nature.com/articles/srep37855",14,6.15,0.0416666666666667
"36",35,"Quiglius",1451834580,"reward1","yes",2759,1483509101,"mnras.oxfordjournals.org",0,"5lxei6","yes","low",661770,1,"Astronomy","A photometric study of the peculiar and potentially double ringed, non-barred galaxy: PGC 1000714",84,20,"http://mnras.oxfordjournals.org/content/466/1/355",11,5.4,-0.0625
"37",36,"NinjaDiscoJesus",1314456936,NA,"no",286255,1483492595,"nature.com",0,"5lw000","yes","high",2689566,6,"Neuroscience","Gambling addiction activates the same brain pathways as drug and alcohol cravings, suggests new research.",91,6,"http://www.nature.com/tp/journal/v7/n1/full/tp2016256a.html",9,5.93333333333333,0.0714285714285714
"38",37,"physicsdavid",1161818091,NA,"no",14,1483487050,"blog.pnas.org",0,"5lvgos","yes","high",5585,2,"Psychology","How the principles of principals affect student values",47,5,"http://blog.pnas.org/2017/01/journal-club-how-the-principles-of-principals-affect-student-values/",10,5.875,0.025
"39",38,"drewiepoodle",1320210830,"reward10","yes",141280,1483484426,"news.mit.edu",0,"5lv74t","yes","low",3416850,85,"Environment","Study finds more extreme storms ahead for California. New technique predicts frequency of heavy precipitation with global warming.",113,950,"http://news.mit.edu/2017/more-extreme-storms-ahead-california-0103",13,6.16666666666667,-0.0227272727272727
"40",39,"edwinksl",1175053192,"eng","yes",8940,1483480891,"dx.doi.org",0,"5luud2","yes","low",80198,1,"Social Science","Narrative Style Influences Citation Frequency in Climate Change Science",63,4,"http://dx.doi.org/10.1371/journal.pone.0167983",10,7,0
"41",40,"BocceBaller42",1395420514,NA,"no",1559,1483468070,"jamanetwork.com",0,"5ltiul","yes","high",72048,6,"Health","C-section rates are >50% in Chinese super-cities",42,34,"http://jamanetwork.com/journals/jama/fullarticle/2595524",7,4.22222222222222,0.107142857142857
"42",41,"JeffCorkern",1479689202,NA,"no",30,1483466917,"ncbi.nlm.nih.gov",0,"5ltemb","yes","low",2123,42,"Medicine","CRISPR Removal Of HIV Genome From Mouse T-Cell Genome: Possible Prevention Of AIDS Recurrence",80,1414,"https://www.ncbi.nlm.nih.gov/pubmed/27194423",10,5.2,0.0357142857142857
"43",42,"Micascisto",1442805087,"geo","yes",125,1483466794,"library.seg.org",0,"5lte6n","no","low",50,4,"Astronomy","Scientists performed 3D radar imaging of Mars' polar ice caps for the first time, revealing previously unseen internal structures",111,29,"http://library.seg.org/doi/10.1190/tle36010043.1",10,5.73684210526316,-0.0208333333333333
"44",43,"andyhfell",1360047839,NA,"no",156,1483465562,"blogs.ucdavis.edu",0,"5lt9kc","yes","low",16850,1,"Biology","Community social networks help animals survive",41,3,"http://blogs.ucdavis.edu/egghead/2017/01/03/modeling-shows-social-networks-help-animals-survive/",9,6.83333333333333,0.125
"45",44,"benbrum",1472131325,"journ","yes",142,1483464252,"rh.gatech.edu",0,"5lt4qy","yes","low",5097,0,"Earth Science","A Fertilizer Dearth Foiled Animal Evolution for Eons? The phosphorus cycle and the explosion of life",85,5,"http://www.rh.gatech.edu/news/585311/fertilizer-dearth-foiled-animal-evolution-eons",10,5.25,-0.0104166666666667
"46",45,"mvea",1148438857,"med   reward3","yes",56750,1483463626,"theverge.com",0,"5lt2jf","yes","low",5257075,26,"Computer Science","All 13,000 taxis in New York City could be replaced by a fleet of 3,000 ride-sharing cars if used exclusively for carpooling, according to research published today by MIT’s Computer Science and Artificial Intelligence Laboratory (CSAIL).",204,245,"http://www.theverge.com/2017/1/2/14147286/mit-research-nyc-taxi-carpool-uber-lyft",12,5.32432432432432,0.06875
"47",46,"ZechariaSitchin",1404817474,NA,"no",761,1483460555,"medicalnewstoday.com",0,"5lsryf","yes","low",7756,5,"Health","New study busts the myth that contraceptives kill libido",48,11,"http://www.medicalnewstoday.com/articles/314851.php",14,5.33333333333333,0.075
"48",47,"BGo_research",1478016574,"env","yes",137,1483460144,"nature.com",0,"5lsqk5","yes","high",144,3,"Mathematics","Points of significance: P values and the search for significance : Nature Methods",69,19,"http://www.nature.com/nmeth/journal/v14/n1/full/nmeth.4120.html",12,5.58333333333333,0.166666666666667
"49",48,"researchisgood",1443541602,NA,"no",2555,1483459296,"researchgate.net",0,"5lsnld","yes","low",79444,205,"Engineering","Researchers design low-cost sonic tractor beam that can trap and pull an object using sound waves. It can be built using a 3-D printer for under $70.",123,4448,"https://www.researchgate.net/blog/post/make-your-own-sonic-tractor-beam",11,4.06896551724138,0.0138888888888889
"50",49,"Bman409",1374004623,NA,"no",28408,1483458464,"cambridge.org",0,"5lskvq","yes","low",74100,45,"Health","Earlier age of cannabis use and increased use frequency across adolescence associated with decline in verbal IQ and executive function tasks tapping trial and error learning and reward processing by early adulthood and lower rates of high-school graduation",219,32,"https://www.cambridge.org/core/journals/development-and-psychopathology/article/div-classtitleadolescent-cannabis-use-change-in-neurocognitive-function-and-high-school-graduation-a-longitudinal-study-from-early-adolescence-to-young-adulthooddiv/409F2E21BE7E216535404A4BF9EB1038/core-reader",11,5.58974358974359,0.00480769230769231
"51",50,"Quiglius",1451834580,"reward1","yes",2759,1483453469,"nature.com",0,"5ls5qg","no","high",661770,0,"Health","Piezo2 senses airway stretch and mediates lung inflation-induced apnoea",63,0,"http://www.nature.com/nature/journal/vaop/ncurrent/full/nature20793.html",9,6.2,-0.104166666666667
"52",51,"zulq",1409873151,NA,"no",86,1483452903,"ajcn.nutrition.org",0,"5ls491","yes","low",3018,2,"Health","A moderate increase in dietary zinc reduces DNA strand breaks in leukocytes and alters plasma proteins without changing plasma zinc concentrations",126,56,"http://ajcn.nutrition.org/content/early/2016/12/21/ajcn.116.135327.short?rss=1&related-urls=yes&legid=ajcn%3Bajcn.116.135327v1",14,6,-0.0454545454545455
"53",52,"SirT6",1397166648,"cancer     reward13","yes",91844,1483450800,"nature.com",0,"5lrypx","no","high",285726,0,"Medicine","Stimulation of the innate immune system in conjunction with a therapeutic vaccine has a potent antiviral effect in rhesus monkeys, and demonstrates the potential of this strategy as a functional cure for HIV-1",177,7,"http://www.nature.com/nature/journal/v540/n7632/full/nature20583.html",12,5.14705882352941,0.0546875
"54",53,"Quiglius",1451834580,"reward1","yes",2759,1483450537,"news.mit.edu",0,"5lry42","yes","low",661770,3,"Earth Science","Study finds more extreme storms ahead for California",45,21,"http://news.mit.edu/2017/more-extreme-storms-ahead-california-0103",10,5.625,-0.0625
"55",54,"pnewell",1340897842,"env","yes",100006,1483449992,"hakaimagazine.com",0,"5lrwqh","yes","low",3313287,29,"Environment","Greenland Ice Melt Could Push Atlantic Circulation to Collapse | Like a sudden drop in blood pressure, a weakening or shutdown of the AMOC could cut off vast swaths of the ocean from a vital supply of heat and nutrients.",181,117,"https://www.hakaimagazine.com/article-short/greenland-ice-melt-could-push-atlantic-circulation-collapse",11,4.56410256410256,-0.04375
"56",55,"MailmanSchool_AMA",1454042380,"health AMA","yes",878,1483448264,"self.science",0,"5lrsdz","yes","low",4724,511,"Medical Marijuana & Traffic Safety AMA","Science AMA Series: We’re Silvia Martins and Julian Santaella-Tenorio, epidemiologists at Columbia University’s Mailman School of Public Health. Our latest study finds that U.S. states that legalized medical marijuana saw declines in fatal car accidents. Ask Us Anything!",238,8860,"https://www.reddit.com/r/science/comments/5lrsdz/science_ama_series_were_silvia_martins_and_julian/",15,5.82051282051282,-0.0217391304347826
"57",56,"MenicusMoldbug",1463966108,NA,"no",3659,1483447993,"medscape.com",0,"5lrrql","yes","low",18480,9,"Biology","Adverse Bone Changes After Hormone Therapy of Transgender Youth",55,15,"http://www.medscape.com/viewarticle/873700?nlid=111609_821&src=WNL_mdplsnews_161230_mscpedit_peds&uac=194528DX&spon=9&impID=1265074&faf=1&pa=KgzwNZf%2Fiy4lrT%2BWYg8INAk%2FB3XcpnJ9ElnR3o8hEk1yGE9TVBacQ4XfT44jXwvD8SIvl8zjYv73GUyW5rsbWA%3D%3D",11,6.11111111111111,-0.0535714285714286
"58",57,"CESRA_highlights",1469285408,NA,"no",0,1483446896,"cesra.net",0,"5lrp4d","yes","low",1116,0,"Astronomy","Observation of quasi-periodic solar radio bursts associated with propagating fast-mode waves",82,9,"http://cesra.net/?p=1159",11,6.15384615384615,-0.0178571428571429
"59",58,"mvea",1148438857,"med   reward3","yes",56750,1483443914,"edition.cnn.com",0,"5lrijr","yes","low",5257075,4,"Medicine","Children of obese parents may be at risk of developmental delays, finds a recent study based on 4,821 children published in Pediatrics.",114,31,"http://edition.cnn.com/2017/01/02/health/parental-obesity-child-development/index.html",13,5.09090909090909,-0.025
"60",59,"sivribiber",1469036406,NA,"no",46258,1483443597,"techxplore.com",0,"5lrhvg","yes","low",1415024,23,"Engineering","Scientists have found a way to make memory chips perform computing tasks, which is traditionally done by computer processors. This means data could be processed in the same spot where it is stored, leading to much faster and thinner computers.",204,141,"https://techxplore.com/news/2017-01-scientists-memory-chips-processors-tasks.html",13,5,0.046875
"61",60,"Wagamaga",1401896229,NA,"no",36563,1483433561,"ox.ac.uk",0,"5lqybi","yes","low",1505508,1,"Neuroscience","Researchers have found a link between the activity in nerve clusters in the brain and the amount of force generated in a physical action, opening the way for the development of better devices to assist paralysed patients.",185,39,"http://www.ox.ac.uk/news/2016-11-23-brain-activity-predicts-force-your-actions",11,4.94594594594595,0.0625
"62",61,"sivribiber",1469036406,NA,"no",46258,1483405702,"businessinsider.com",0,"5lox96","yes","low",1415024,493,"Paleontology","A surprising factor in the extinction of the dinosaurs may have been how long their eggs took to hatch--sometimes nearly six months.",111,19597,"http://www.businessinsider.com/dinosaur-extinction-may-have-been-affected-by-slow-egg-incubations-2016-12",10,4.69565217391304,-0.140625
"63",62,"NinjaDiscoJesus",1314456936,NA,"no",286255,1483399638,"edition.cnn.com",0,"5lodyy","yes","low",2689566,11,"Health","Alcohol abuse linked to higher heart risks, study says",46,62,"http://edition.cnn.com/2017/01/02/health/alcohol-abuse-heart-disease-risk/index.html?sr=twcnni010217alcohol-abuse-heart-disease-risk1113PMVODtopPhoto&linkId=32950113",7,5,-0.0625
"64",63,"fsmpastafarian",1284086270,"psych                    rewardstar","yes",91843,1483393220,"journals.plos.org",0,"5lnsu1","yes","low",148155,17,"Psychology","New study finds larger gender gap in sustained attentional control, an ability necessary for everyday tasks and success, in countries with greater gender inequality",141,48,"http://journals.plos.org/plosone/article?id=10.1371/journal.pone.0165100",11,5.79166666666667,0.078125
