"","X1","author","author_created_date","author_flair","author_flair_binary","comment_karma","created_utc","domain","gilded","id","image","journal_h_index","link_karma","num_comments","subfield","title","title_len","upvotes","url","max_title_length","mean_title_length","title_sent"
"700",699,"DoremusJessup",1318441120,NA,"no",16240,1481289253,"sciencemag.org",0,"5hdobv","yes","high",1946129,51,"Biology","Ancient rashes that scar the faces of Egyptian mummies have long been cited as evidence that smallpox ravaged the region more than 3000 years ago. But now, a study of viral DNA extracted from a 17th century child mummy suggests that the deadliest form of smallpox emerged more recently",237,5573,"http://www.sciencemag.org/news/2016/12/virus-found-child-mummy-suggests-recent-rise-deadly-smallpox",9,4.79591836734694,0.0397727272727273
"701",700,"WhirlingVortex",1183331488,NA,"no",340,1481287125,"acsh.org",0,"5hdivm","yes","low",36130,64,"Chemistry","Scientists have discovered a possible protein antidote for carbon monoxide poisoning. Within minutes, mice exposed to a lethal dose of carbon monoxide were rescued when injected with the protein.",167,2229,"http://acsh.org/news/2016/12/08/possible-antidote-carbon-monoxide-poisoning-10551",10,5.6551724137931,-0.0367647058823529
"702",701,"Wagamaga",1401896229,NA,"no",36563,1481287064,"nature.com",0,"5hdiqs","no","high",1505508,14,"Nanoscience","Personality traits and psychiatric disorders linked to specific genomic locations. Researchers also find correlations between traits and distinct disorders",137,475,"http://www.nature.com/ng/journal/vaop/ncurrent/full/ng.3736.html",12,7.15789473684211,-0.125
"703",702,"Wagamaga",1401896229,NA,"no",36563,1481285258,"jamanetwork.com",0,"5hdetp","yes","high",1505508,1,"Psychology","In a new systematic review and meta-analysis in JAMA that draws from 195 studies on depression among medical students, researchers found that 27 percent experienced depression or depressive symptoms, about three times higher than the general population.",217,7,"http://jamanetwork.com/journals/jama/article-abstract/2589340",11,5.60526315789474,0
"704",703,"the_phet",1297521165,"reward1","yes",67944,1481282695,"eurekalert.org",0,"5hd9l9","yes","low",427388,1,"Social Science","New study shows how mobile money lifts Kenyan households out of poverty. Greater access to services raises daily spending, especially among female-headed households.",143,0,"https://www.eurekalert.org/pub_releases/2016-12/miot-smm120816.php",10,5.79166666666667,0
"705",704,"the_phet",1297521165,"reward1","yes",67944,1481282581,"theguardian.com",0,"5hd9d5","yes","low",427388,132,"Medicine","New diabetes treatment could eliminate need for insulin injections: tested in mice, therapy involves a capsule of genetically engineered cells implanted under the skin that release insulin as required",172,1862,"https://www.theguardian.com/science/2016/dec/08/new-diabetes-treatment-could-eliminate-need-for-insulin-injections",11,5.86206896551724,0.0514705882352941
"706",705,"the_phet",1297521165,"reward1","yes",67944,1481282315,"adn.com",0,"5hd8vb","yes","low",427388,56,"Biology","Researchers report that four distinct populations of killifish, living in four Superfund sites on the East Coast, have separately and rapidly evolved a genetic adaptation that allows them to survive in severely contaminated waters.",198,2017,"https://www.adn.com/nation-world/2016/12/08/some-fish-evolve-to-survive-the-most-poisoned-places-in-america/",12,5.73529411764706,0
"707",706,"the_phet",1297521165,"reward1","yes",67944,1481281913,"eurekalert.org",0,"5hd81e","yes","low",427388,39,"Neuroscience","Neuroscientists have discovered that the activity of certain neurons in a deep region of the mouse brain can be manipulated to induce the animal to under- or overestimate the duration of a fixed time interval.",175,365,"https://www.eurekalert.org/pub_releases/2016-12/js-ntc113016.php",15,4.94285714285714,0.0714285714285714
"708",707,"sataky",1340813587,NA,"no",2800,1481279904,"nature.com",0,"5hd45j","yes","high",54049,7,"Physics","Rare third kind of quasicrystal found in Russian meteorite",50,268,"http://www.nature.com/articles/srep38117",12,5.55555555555556,0.21875
"709",708,"mvea",1148438857,"med   reward3","yes",56751,1481260569,"journals.plos.org",0,"5hc0yg","yes","low",5257119,1,"Medicine","An increase in leukocyte telomere length over 5 years is associated with decreased mortality in patients with coronary heart disease, finds UCSF researchers, based on a prospective cohort study of 608 individuals with stable coronary artery disease.",213,24,"http://journals.plos.org/plosone/article?id=10.1371/journal.pone.0160748",11,5.67567567567568,0.00625
"710",709,"NinjaDiscoJesus",1314456936,NA,"no",286255,1481250237,"newscientist.com",0,"5hb8qy","yes","low",2689566,1,"Neuroscience","Brain cell transplant helps fearful mice overcome anxiety.",51,3,"https://www.newscientist.com/article/2115598-brain-cell-transplant-helps-fearful-mice-overcome-anxiety/",10,6.25,-0.0535714285714286
"711",710,"redhatGizmo",1289986377,NA,"no",23723,1481246462,"sci-news.com",0,"5haxpm","yes","low",335718,2,"Earth Science","NASA’s TIMED Satellite Finds Hot Atomic Hydrogen in Earth’s Thermosphere",67,11,"http://www.sci-news.com/space/hot-atomic-hydrogen-thermosphere-04429.html",12,6.3,-0.0416666666666667
"712",711,"davidklemke",1327286276,NA,"no",1227,1481245481,"pss.sagepub.com",0,"5hauuf","yes","low",20778,4,"Biology","Using a visual illusion researchers have shown that detailed peripheral vision is partially based on a reconstruction of reality.",111,22,"http://pss.sagepub.com/content/early/2016/11/12/0956797616672270",14,5.78947368421053,0
"713",712,"avogadros_number",1368151675,"reward2","yes",12643,1481244126,"huffingtonpost.ca",0,"5haqpl","yes","low",255398,23,"Earth Science","While climate sceptics have systematically attacked anthropogenic warming, up until now they have only invoked giant natural fluctuations (GNFs). Helped by statistics, the GNF model can easily be scientifically rejected.",191,99,"http://www.huffingtonpost.ca/shaun-lovejoy/the-100000-giant-climate-_b_11458848.html",14,6.16666666666667,0.104166666666667
"714",713,"BocceBaller42",1395420514,NA,"no",1559,1481239436,"news.mit.edu",0,"5habwe","yes","low",72049,1,"Social Science","Mobile-money services lift Kenyans out of poverty. (x-post from citral)",62,7,"http://news.mit.edu/2016/mobile-money-kenyans-out-poverty-1208",8,4.75,-0.0892857142857143
"715",714,"seattlechildrens",1468611823,NA,"no",0,1481238671,"news-medical.net",0,"5ha9fz","yes","low",68,3,"Medicine","Dental problems linked to cleft lip and palate may be caused by abnormal salivary glands, researchers find in mouse models",103,5,"http://www.news-medical.net/news/20161207/Dental-problems-linked-to-cleft-lip-and-palate-may-be-caused-by-abnormal-salivary-glands.aspx",11,5.1,-0.0625
"716",715,"mvea",1148438857,"med   reward3","yes",56751,1481237156,"science.sciencemag.org",0,"5ha48k","yes","high",5257119,0,"Medicine","Scientists engineered a synthetic circuit into human cells to create ß-cell–mimetic designer cells that can sense the glucose concentration and respond to correct deregulation, with implants containing these designer cells providing closed-loop glycemic control in diabetic mice.",246,16,"http://science.sciencemag.org/content/354/6317/1296",13,5.95,0.00543478260869565
"717",716,"Qwertysapiens",1327525754,"anthro","yes",10604,1481229230,"advances.sciencemag.org",0,"5h9c6k","no","high",44661,1,"Anthropology","Hominin neocortex size may be the result of a single point mutation in the ARHGAP11B gene.",75,7,"http://advances.sciencemag.org/content/advances/2/12/e1601941.full.pdf",9,4.625,-0.0178571428571429
"718",717,"drewiepoodle",1320210830,"reward10","yes",141280,1481227777,"aftau.org",0,"5h96se","yes","low",3416850,15,"Biology","Research suggests that periods of fasting or starvation may significantly shorten the lifespans of both children and their male descendants.",121,46,"https://www.aftau.org/weblog-medicine--health?=&storyid4704=2308&ncs4704=3",13,6,0.015625
"719",718,"Splenda",1264275558,NA,"no",63358,1481227268,"insideclimatenews.org",0,"5h94t5","yes","low",138043,8,"Environment","History Reveals Greenland Ice Might Melt Much Faster Than Believed: The huge ice sheet melted several times between ice ages, leading to belief it will melt faster with global warming, with dire implications for sea level rise.",191,11,"https://insideclimatenews.org/news/07122016/greenland-ice-melting-climate-change",12,5.05405405405405,0.0336538461538462
"720",719,"Wagamaga",1401896229,NA,"no",36563,1481226878,"dx.doi.org",0,"5h93cq","yes","low",1505508,2,"Neuroscience","Northwestern Medicine scientists have discovered for the first time that the rhythm of breathing creates electrical activity in the human brain that enhances emotional judgments and memory recall.",169,35,"http://dx.doi.org/10.1523/JNEUROSCI.2586-16.2016",12,6,0.0384615384615385
"721",720,"Wagamaga",1401896229,NA,"no",36563,1481225752,"journals.lww.com",0,"5h8zac","yes","low",1505508,0,"Health","Self-harm was the leading cause of pregnancy-associated deaths in Colorado from 2004 to 2014, ahead of car crashes, medical conditions and homicide, according to researchers at the University of Colorado",174,3,"http://journals.lww.com/greenjournal/Abstract/2016/12000/Maternal_Deaths_From_Suicide_and_Overdose_in.6.aspx",11,5.28125,-0.0357142857142857
"722",721,"Mictlantecuhtli",1352732955,"anthro","yes",68450,1481224382,"cell.com",0,"5h8uad","no","high",292447,0,"Biology","17th Century Variola Virus Reveals the Recent History of Smallpox",56,1,"http://www.cell.com/current-biology/fulltext/S0960-9822(16)31324-0",8,5.6,0.0892857142857143
"723",722,"shiruken",1283195097,"eng     rewardstar","yes",145633,1481222954,"news.wsu.edu",0,"5h8ox9","yes","low",306941,11,"Environment","Consumers are willing to pay an 11% premium for second-generation biofuels over conventional fuel",84,0,"https://news.wsu.edu/2016/12/08/consumers-will-pay-more-biofuels/",12,5.46666666666667,0.15625
"724",723,"drewiepoodle",1320210830,"reward10","yes",141280,1481221487,"washington.edu",0,"5h8jgt","yes","low",3416850,1,"Paleontology","Paleontologists find tumor in the fossilized jaw of a distant mammal relative. Known as a compound odontoma, this type of tumor is common to mammals today. But this animal lived 255 million years ago, before mammals even existed.",192,30,"http://www.washington.edu/news/2016/12/08/fossilized-evidence-of-a-tumor-in-a-255-million-year-old-mammal-forerunner/",15,4.92105263157895,0.05
"725",724,"vilnius2013",1391507165,"bio","yes",22207,1481220026,"acsh.org",0,"5h8e64","yes","low",301482,55,"Engineering","Because caffeine is in high demand, there is interest in using microbes to manufacture it. However, caffeine is toxic to microbes. So, a team of scientists genetically engineered an antibiotic resistance gene to make yeast highly resistant to caffeine.",214,393,"http://acsh.org/news/2016/12/07/genetically-engineered-yeast-resistant-caffeine-10552",11,5.33333333333333,0
"726",725,"vmjaggard99",1458917405,"natgeo two","yes",3709,1481217190,"news.nationalgeographic.com",0,"5h83x8","yes","low",17686,4,"Health","A child mummy from the 17th century carries the oldest known genetic sample of smallpox virus, call-in records of older cases into question.",118,49,"http://news.nationalgeographic.com/2016/12/mummies-smallpox-virus-dna-lithuania-health-science/",8,4.79166666666667,0.166666666666667
"727",726,"NightHawk521",1341116080,"reward1","yes",48075,1481217061,"sciencenews.org",0,"5h83g0","yes","low",7540,1,"Biology","Scientists have just recovered the oldest genetic evidence for smallpox, sequencing the genome of the smallpox virus from the skin of a 17th century Lithuanian mummy",140,1,"https://www.sciencenews.org/article/oldest-traces-smallpox-virus-found-child-mummy?tgt=nr",10,5.34615384615385,0.173076923076923
"728",727,"prodigies2016",1455277795,NA,"no",4714,1481216787,"researchgate.net",0,"5h82f6","yes","low",108218,1741,"Paleontology","99-million-year-old feathered dinosaur tail captured in amber discovered.",66,38520,"https://www.researchgate.net/blog/post/feathered-dinosaur-tail-captured-in-amber-found-in-myanmar",10,5.63636363636364,0.0277777777777778
"729",728,"blck_strm_trpr",1351626260,NA,"no",600,1481215330,"ucdavis.edu",0,"5h7xae","yes","low",431,23,"Animal Science","No sign of health or nutrition problems from GMO livestock feed, UC Davis animal science study finds.",85,19,"https://www.ucdavis.edu/news/no-sign-health-or-nutrition-problems-gmo-livestock-feed-study-finds",9,4.88235294117647,0.0681818181818182
"730",729,"Faststriker",1416539331,NA,"no",3963,1481215103,"yahoo.com",0,"5h7wgz","yes","low",9824,0,"Biology","Here’s the Secret to Why Our Skin Doesn’t Leak",42,0,"https://www.yahoo.com/beauty/heres-the-secret-to-why-our-skin-doesnt-leak-024955060.html",7,4.22222222222222,-0.125
"731",730,"drewiepoodle",1320210830,"reward10","yes",141280,1481213788,"news.psu.edu",0,"5h7rtf","yes","low",3416850,12,"Environment","Common pesticides are more harmful to 'good' insects than previously thought. Neonicotinoids -- the most widely used class of insecticides -- significantly reduce populations of the predatory insects that prey on pests.",188,161,"http://news.psu.edu/story/440914/2016/12/07/research/common-insecticides-are-riskier-thought-predatory-insects",14,6,0.0357142857142857
"732",731,"recentfish",1455618839,NA,"no",15415,1481210729,"scientificamerican.com",0,"5h7hea","yes","low",165437,5,"Health","40-year study of nurses finds optimistic women are less likely to die of illness.",68,10,"https://www.scientificamerican.com/article/can-a-rosy-outlook-ward-off-illness/",10,4.4,0.09375
"733",732,"SirT6",1397166648,"cancer     reward13","yes",91845,1481207912,"nature.com",0,"5h78e4","yes","high",285729,1,"Cancer","Fat fuels cancer’s spread in mice: Dietary needs of metastatic cancer cells could prove to be their Achilles heel.",98,1,"http://www.nature.com/news/fat-fuels-cancer-s-spread-in-mice-1.21092",10,4.94736842105263,0.0227272727272727
"734",733,"Nancyladia",1472148223,NA,"no",63,1481207799,"masstreatment.com",0,"5h781h","yes","low",6187,0,"Health","Lung cancer: Protein as potential tool for predicting survival",54,4,"http://masstreatment.com/lung-cancer-protein-potential-tool-predicting-survival",10,5.88888888888889,-0.0625
"735",734,"xXDesyncXx",1463583896,NA,"no",10264,1481206901,"seeker.com",0,"5h75gx","yes","low",2687,2,"Physics","Big progress was made on nuclear fusion energy technology.",50,10,"http://www.seeker.com/star-in-a-jar-fusion-reactor-works-and-promises-infinite-energy-2134228965.html?sf45382690=1",10,5.44444444444444,0.0208333333333333
"736",735,"tazcel",1280009789,NA,"no",33533,1481206124,"nhs.uk",0,"5h7377","yes","low",217463,8,"Medicine","Intake of up to 1 egg daily may be associated with reduced risk of total stroke, new study shows (meta-analysis)",93,10,"http://www.nhs.uk/news/2016/11November/Pages/Eating-one-egg-a-day-may-lower-risk-of-stroke.aspx",10,4.23809523809524,-0.0208333333333333
"737",736,"FrontiersIn",NA,NA,"no",NA,1481205079,"blog.frontiersin.org",0,"5h704e","yes","low",NA,0,NA,"Researching one of the most disruptive volcanoes to forecast future eruptions",67,2,"https://blog.frontiersin.org/2016/12/01/researching-one-of-the-most-disruptive-volcanoes-to-predict-future-eruptions/",11,6.09090909090909,-0.291666666666667
"738",737,"Jiteye",1391697387,NA,"no",359,1481204695,"medicalxpress.com",0,"5h6z2q","yes","low",19479,10,"Biology","Researchers find DNA mutation that led to change in function of gene in humans that sparked larger neocortex",91,133,"http://medicalxpress.com/news/2016-12-dna-mutation-function-gene-humans.html",11,5.05555555555556,0.0138888888888889
"739",738,"mvea",1148438857,"med   reward3","yes",56751,1481204016,"advances.sciencemag.org",0,"5h6x5t","yes","high",5257121,1,"Epidemiology","Deforestation has led to an increase in the emergence of Mycobacterium ulcerans, which causes the Buruli ulcer, and the risk of outbreaks of 250 other known human emerging infectious diseases (EIDs), finds a team of international scientists.",205,34,"http://advances.sciencemag.org/content/2/12/e1600387.full",13,5.37837837837838,-0.0576923076923077
"740",739,"mikepetroff",1293030594,NA,"no",7945,1481203778,"news.harvard.edu",0,"5h6wgj","yes","low",112920,9,"Health","A Harvard study found that women who were optimistic had a significantly reduced risk of dying from several major causes of death over an eight-year period, compared with women who were less optimistic",169,32,"http://news.harvard.edu/gazette/story/2016/12/optistic-women-live-longer-are-healthier/",13,4.91176470588235,0.05
"741",740,"izumi3682",1370263339,NA,"no",6131,1481203541,"singularityhub.com",0,"5h6vu0","yes","low",208536,2,"Neuroscience","This One Equation May Be the Root of Intelligence",41,0,"http://singularityhub.com/2016/12/07/this-one-equation-may-be-the-root-of-intelligence/",12,4.55555555555556,0.0357142857142857
"742",741,"NOAAgov",1415135570,"env AMA","yes",6433,1481202366,"self.science",0,"5h6skp","yes","low",20218,231,"NOAA AMA","Science AMA Series: Hi, we’re NOAA scientists Leila Hatch, Jason Gedamke, and Jenni Stanley. We’re here to talk about ocean noise and what NOAA is doing to reduce this threat in our national marine sanctuaries and beyond. Ask us anything!",203,3173,"https://www.reddit.com/r/science/comments/5h6skp/science_ama_series_hi_were_noaa_scientists_leila/",11,4.8,0
"743",742,"Wagamaga",1401896229,NA,"no",36563,1481198090,"ehbonline.org",0,"5h6iw2","no","low",1505508,107,"Health","Research has found a correlation between the type of oral contraceptive women use and how often couples have sex.",95,1871,"http://www.ehbonline.org/article/S1090-5138(16)30300-2/abstract",13,4.94736842105263,0.0625
"744",743,"Mariamlotte",NA,NA,"no",NA,1481197296,"earthsky.org",0,"5h6h9m","yes","low",NA,1,"Earth Science","More evidence for young Saturn moons",31,12,"http://earthsky.org/space/saturn-moons-younger-cassini-dec-2016",8,5.16666666666667,0
"745",744,"Wagamaga",1401896229,NA,"no",36563,1481196662,"tandfonline.com",0,"5h6fww","yes","low",1505508,60,"Psychology","Convincing people of fake memories is surprisingly easy. More than 50 percent of participants in several 'memory implantation' studies recalled false memories as authentic. They came to incorporate fabricated events into their personal histories.",213,983,"http://www.tandfonline.com/doi/full/10.1080/09658211.2016.1260747",12,6.11764705882353,-0.0208333333333333
"746",745,"ChrisNomad",1412589161,NA,"no",4857,1481190542,"news.nationalgeographic.com",0,"5h63zr","yes","low",38300,3,"Animal Science","Mysterious Ocean Blob Found for First Time in a Century",46,58,"http://news.nationalgeographic.com/2016/12/sea-blob-discovered-larvacean-bathochordaeus-charon/?utm_source=Twitter&utm_medium=Social&utm_content=link_tw20161207news-blob&utm_campaign=Content&sf45310923=1",10,4.6,-0.0357142857142857
"747",746,"spsheridan",1259374554,NA,"no",8239,1481180615,"pubs.rsc.org",0,"5h5kot","no","low",870935,9,"Medicine","Doctors can now sift bacteria from your blood using magnets",50,70,"http://pubs.rsc.org/en/content/articlelanding/2016/tb/c6tb01272h",8,5,0.03125
"748",747,"mvea",1148438857,"med   reward3","yes",56751,1481177149,"nature.com",0,"5h5cos","yes","high",5257123,179,"Biology","Plants can learn behaviors like animals, find Australian scientists who conditioned plants to associate light with the wind from a fan, and found that the majority of the plants learned to use the fan to predict where light would next appear.",202,1947,"http://www.nature.com/articles/srep38427",11,4.85365853658537,-0.0333333333333333
"749",748,"Minoaiof",1442393756,NA,"no",133,1481172420,"engadget.com",0,"5h50k1","yes","low",134,1,"Medicine","Cancer consumes fat to feed its metastatic march in mice",47,20,"https://www.engadget.com/2016/12/07/cancer-consumes-fat-to-feed-its-metastatic-march-in-mice/",10,4.7,0
"750",749,"mvea",1148438857,"med   reward3","yes",56751,1481170517,"nature.com",0,"5h4vdl","yes","high",5257123,1,"Engineering","Between now and 2018, the photovoltaic solar panel industry will have avoided more greenhouse gases emissions than it has released in 40 years of development, finds Dutch researchers.",156,27,"http://www.nature.com/articles/ncomms13728",12,5.46428571428571,-0.0104166666666667
"751",750,"GeoGeoGeoGeo",1326679762,"reward1","yes",8109,1481165468,"arstechnica.com",0,"5h4gh3","yes","low",96151,5,"Geology","The “technosphere” now weighs 30 trillion tons: The most accurate measurement to date of how much mass we'd leave behind if humans disappeared tomorrow",132,29,"http://arstechnica.com/science/2016/12/the-technosphere-now-weighs-30-trillion-tons/",12,5.20833333333333,0.0833333333333333
"752",751,"happiiiface",1460396910,NA,"no",6322,1481164349,"nature.com",0,"5h4d20","yes","high",10756,1,"Biology","Longitudinal study of humans from fetus to adolescence suggests that tendencies for tobacco and alcohol use are epigenetically heritable",118,53,"http://www.nature.com/tp/journal/v6/n12/full/tp2016247a.html?WT.mc_id=FBK_TP_1612_SMOKINGPREGNANCY_PORTFOLIO",14,6.21052631578947,0.0277777777777778
"753",752,"davidklemke",1327286276,NA,"no",1227,1481164225,"nature.com",0,"5h4cnl","no","high",20778,1,"Medicine","In a mouse model metastasis-initiating cancer cells rely on dietary lipids to promote metastasis. In particular protein CD36 plays a critical role in metastasis.",138,13,"http://www.nature.com/nature/journal/vaop/ncurrent/full/nature20791.html",10,5.4,0.03125
"754",753,"avogadros_number",1368151675,"reward2","yes",12643,1481163543,"nature.com",0,"5h4ain","yes","high",255398,4,"Environment","Greenland once lost nearly all its ice — and could again: Two studies illuminate how the northern ice sheet waxed and waned over millions of years.",124,50,"http://www.nature.com/news/greenland-once-lost-nearly-all-its-ice-and-could-again-1.21098",10,4.76,-0.0833333333333333
"755",754,"MaximilianKohler",1315043077,NA,"no",29165,1481159048,"ucrtoday.ucr.edu",0,"5h3wpa","yes","low",28747,1,"Biology","New Mechanism to Control Human Viral Infections Discovered",51,12,"https://ucrtoday.ucr.edu/42552",10,6.375,0.0625
"756",755,"randomnamegendarme",1397848518,NA,"no",191,1481158636,"bbc.co.uk",0,"5h3ve9","yes","low",44278,25,"Psychology","Some patients sectioned with psychotic conditions, such as schizophrenia or bipolar disorder, may actually have a treatable immune disorder. A study in the Lancet Psychiatry suggests up to one in 11 cases of psychosis may involve antibodies attacking parts of the brain.",229,148,"http://www.bbc.co.uk/news/health-38220610",13,5.35714285714286,-0.0535714285714286
"757",756,"TheLeadSA",1418167180,NA,"no",71,1481156533,"abc.net.au",0,"5h3ojo","yes","low",1982,3,"Astronomy","Ancient eclipse records revise modern calculations of Earth's spin",58,14,"http://www.abc.net.au/news/2016-12-07/how-the-earth-has-turned-since-720-bc/8096496",12,6.44444444444444,-0.05
"758",757,"drewiepoodle",1320210830,"reward10","yes",141280,1481156488,"bbc.com",0,"5h3oek","yes","low",3416850,2,"Anthropology","Analysis of black organic fragments found in a 7th century Anglo-Saxon boat burial has revealed that they are bitumen from Syria, demonstrating a ""far-reaching"" trade network.",150,75,"http://www.bbc.com/news/uk-england-suffolk-38171657",13,5.14285714285714,-0.025
"759",758,"drewiepoodle",1320210830,"reward10","yes",141280,1481151600,"bu.edu",0,"5h37vu","yes","low",3416850,28,"Social Science","Nearly all Americans are likely to know a victim of gun violence within their social networks during their lifetime, indicating that citizens are “closer to gun violence than they perceive,” according to a new study.",186,6,"http://www.bu.edu/research/articles/gun-violence-closer-than-you-think/",10,5.05714285714286,0.125
"760",759,"jezebaal",1355866471,NA,"no",3792,1481147280,"npre.illinois.edu",0,"5h2sik","yes","low",70568,5,"Chemistry","New discovery may lead to the development of super premium gasoline",57,1,"http://npre.illinois.edu/news/new-discovery-may-lead-development-super-premium-gasoline",11,5.18181818181818,0.267857142857143
"761",760,"jezebaal",1355866471,NA,"no",3792,1481147022,"anl.gov",0,"5h2rmg","yes","low",70568,1,"Engineering","Machine learning enables predictive modeling of 2-D materials",54,11,"http://www.anl.gov/articles/machine-learning-enables-predictive-modeling-2-d-materials",10,5.88888888888889,0
"762",761,"crowmint",1382115595,NA,"no",110,1481145740,"hakaimagazine.com",0,"5h2mtw","yes","low",736,1,"Environment","There Is Life on a Dead Coral Reef",27,3,"https://www.hakaimagazine.com/article-short/there-life-dead-coral-reef",5,3.375,-0.125
"763",762,"drewiepoodle",1320210830,"reward10","yes",141280,1481145157,"springer.com",0,"5h2kro","yes","low",3416850,0,"Animal Science","Some guppies have a better sense of maths than others. It allows some to find the biggest shoal possible in which to be protected against predators, while others are better at choosing fruitful foraging ground.",176,11,"http://www.springer.com/gp/about-springer/media/springer-select/guppies--study-sorts-the-maths-whizzes-from-the-dunces/11110038",9,4.94285714285714,0.182692307692308
"764",763,"Wagamaga",1401896229,NA,"no",36563,1481145102,"aac.asm.org",0,"5h2kjl","no","low",1505508,8,"Biology","Bacteria carrying a gene that grants resistance against a powerful antibiotic have been found on a pig farm in the United States",107,85,"http://aac.asm.org/content/early/2016/11/15/AAC.01298-16.full.pdf+html?ijkey=bHPQciX8uIPd6&keytype=ref&siteid=asmjournals",10,4.86363636363636,-0.0416666666666667
